map_name	utterance	trajectory	path_names	path_idxs
baltimore	Start on Race Pace Bicycles then go west to Carma's Cafe then east to CVS then east to Barnes & Noble.	Race Pace Bicycles|Carma's Cafe|CVS|Barnes & Noble	14|6|9|0	path_292.png
baltimore	FROM HOPKINS UNIVERSITY SOUTH TO BAMCOO CAFE THAN 8 OCLOCK TO GERTRUDES	Hopkins University|Bamboo Cafe|Gertrude's	10|7|2	path_46.png
baltimore	starting at hopkins university go south west to bamboo cafe and then go south west to gertrude's.	Hopkins University|Bamboo Cafe|Gertrude's	10|7|2	path_46.png
baltimore	Go from Hopkins University to Bamboo Cafe to Gertrude's	Hopkins University|Bamboo Cafe|Gertrude's	10|7|2	path_46.png
baltimore	Walk from Daniel Gilman to BMA Sculpture Gardens, then turn slightly right and walk to CVS, then turn right and walk to Race Pace Bicycles.	Daniel Gilman|BMA Sculpture Gardens|CVS|Race Pace Bicycles	5|12|9|14	path_293.png
baltimore	From Daniel Gilman go to BMA Sculpture Gardens, CVS is next, then Race Pace bicycles is last.	Daniel Gilman|BMA Sculpture Gardens|CVS|Race Pace Bicycles	5|12|9|14	path_293.png
baltimore	Daniel Gilman is the starting place.  Then go to the BMA Sculpture Gardens.  From there, go to CVS, then to Race Pace Bicycles.	Daniel Gilman|BMA Sculpture Gardens|CVS|Race Pace Bicycles	5|12|9|14	path_293.png
baltimore	Start on Alkimia then go northwest to The Breezeway then northwest to Bamboo Cafe then northwest to Carma's Cafe.	Alkimia|The Breezeway|Bamboo Cafe|Carma's Cafe	8|11|7|6	path_546.png
baltimore	Leave from Alkimia and pass by The Breezeway and the Bamboo Cafe on the way to Carma's Cafe.	Alkimia|The Breezeway|Bamboo Cafe|Carma's Cafe	8|11|7|6	path_546.png
baltimore	begin at alkimia and go to the breezeway before heading to bamboo cafe and ending at carma's cafe	Alkimia|The Breezeway|Bamboo Cafe|Carma's Cafe	8|11|7|6	path_546.png
baltimore	Start at Race Pace Bicycles heading southwest to Spirit of Music.  Then continue west to BMA Sculpture Gardens.  Once there continue Northwest to 7-eleven.	Race Pace Bicycles|Spirit of Music|BMA Sculpture Gardens|7-Eleven	14|3|12|1	path_294.png
baltimore	Starting at Rat Pace Bicycles, travel to 7-Eleven passing through Spirit of Music and BMA Sculpture Gardens.	Race Pace Bicycles|Spirit of Music|BMA Sculpture Gardens|7-Eleven	14|3|12|1	path_294.png
baltimore	Start on Race Pace Bicycles then go south to Spirit of Music then west to BMA Sculpture Gardens then west to 7-Eleven.	Race Pace Bicycles|Spirit of Music|BMA Sculpture Gardens|7-Eleven	14|3|12|1	path_294.png
baltimore	From Spirit of Music, go to Bamboo Cafe. Then go to Hopkins University.	Spirit of Music|Bamboo Cafe|Hopkins University	3|7|10	path_47.png
baltimore	Start on Spirit of Music then go east to Bamboo Cafe then north to Hopkins University.	Spirit of Music|Bamboo Cafe|Hopkins University	3|7|10	path_47.png
baltimore	Leave from the Spirit of Music and head to Bamboo Cafe.  Then go up to Hopkins University.	Spirit of Music|Bamboo Cafe|Hopkins University	3|7|10	path_47.png
baltimore	Starting from Carma's Cafe, go to the BMA Sculpture Gardens and then on to Daniel Gilman.	Carma's Cafe|BMA Sculpture Gardens|Daniel Gilman	6|12|5	path_547.png
baltimore	START AT CARMAS CAFE GO SOUTH FROM  CARMAS CAFE GO PAST  BMA SCULPTURE GARDENS ONTO DANIEL GILMAN	Carma's Cafe|BMA Sculpture Gardens|Daniel Gilman	6|12|5	path_547.png
baltimore	Leave Carma's Cafe and get down to the BMA Sculpture Gardens and stop at Daniel Gilman.	Carma's Cafe|BMA Sculpture Gardens|Daniel Gilman	6|12|5	path_547.png
baltimore	Starting from X-578 then to BMA Scupture Gardens then to CVS then finally go to Race Pace Bicycles	X-578|BMA Sculpture Gardens|CVS|Race Pace Bicycles	13|12|9|14	path_295.png
baltimore	Starting at X-578 heafing right and slightly north, continue straight to BMA Sculpture Gardens. Make a slight right and continue straight to CVS. Make a slightly sharp right and continue straight and you will arrive at Race Pace Bicycles.	X-578|BMA Sculpture Gardens|CVS|Race Pace Bicycles	13|12|9|14	path_295.png
baltimore	from x-578, go in a rightward direction to BMA sculpture gardens, and then up and slightly right until you reach CVS. from CVS, then turn right and go down slightly to race pace bicycles.	X-578|BMA Sculpture Gardens|CVS|Race Pace Bicycles	13|12|9|14	path_295.png
baltimore	Starting at 7-Eleven, go to Race Pace Bicycles, then go to Barnes & Noble, then turn around and go to CVS and stop.	7-Eleven|Race Pace Bicycles|Barnes & Noble|CVS	1|14|0|9	path_48.png
baltimore	Start from 7-Eleven and travel to Race Pace Bicycles, to Barnes & Noble, to CVS.	7-Eleven|Race Pace Bicycles|Barnes & Noble|CVS	1|14|0|9	path_48.png
baltimore	Starting from 7-Eleven go to Spirit of Music then to Carma's Cafe then to CVS	7-Eleven|Race Pace Bicycles|Barnes & Noble|CVS	1|14|0|9	path_48.png
baltimore	Go from Race Pace Bicycles to Hopkins University to Bamboo Cafe	Race Pace Bicycles|Hopkins University|Bamboo Cafe	14|10|7	path_549.png
baltimore	Starting at Race Pace Bicycles head straight to Hopkins University. Make a slight left and continue straight to Bamboo Cafe.	Race Pace Bicycles|Hopkins University|Bamboo Cafe	14|10|7	path_549.png
baltimore	Starting from Race Pace Bicycles, go to Hopkins University, and then to Bamboo Cafe	Race Pace Bicycles|Hopkins University|Bamboo Cafe	14|10|7	path_549.png
baltimore	from X-578 go to the south east to gertrude's and then turn north east to get to BMA sculpture gardens. from there go to the north east to carma's cafe and then go north east to CVS.	X-578|Gertrude's|BMA Sculpture Gardens|Carma's Cafe|CVS	13|2|12|6|9	path_296.png
baltimore	Start at X-578 and travel southeast to Gertrude's. From there, head northeast to BMA Sculpture Gardens. After, head north-northeast to Carma's Cafe. Finally head northeast to CVS.	X-578|Gertrude's|BMA Sculpture Gardens|Carma's Cafe|CVS	13|2|12|6|9	path_296.png
baltimore	Starting at X-578 go southeast to Gertrude's.  Once there turn northeast go to BMA Sculpture Garden.  From there continue north to Carma's Cafe.  At the Cafe go northeast to CVS.	X-578|Gertrude's|BMA Sculpture Gardens|Carma's Cafe|CVS	13|2|12|6|9	path_296.png
baltimore	STARTING AT GERTRUDES GO 11 OCLOCK  TO 7-ELEVEN	Gertrude's|7-Eleven	2|1	path_50.png
baltimore	starting at gertrude's go north west to the 7-eleven.	Gertrude's|7-Eleven	2|1	path_50.png
baltimore	Fly from Gertrude's to 7-Eleven.	Gertrude's|7-Eleven	2|1	path_50.png
baltimore	Start on BMA Sculpture Gardens then east to Spirit of Music then northwest to Carma's Cafe then east to CVS.	BMA Sculpture Gardens|Spirit of Music|Carma's Cafe|CVS	12|3|6|9	path_550.png
baltimore	Starting at BMA Sculpture Gardens go northwest to Spirit Music.  Once there continue to Carma's Cafe Northwest.  Once there turn east and travel to CVS.	BMA Sculpture Gardens|Spirit of Music|Carma's Cafe|CVS	12|3|6|9	path_550.png
baltimore	Go from BMA Sculpture Gardens to Spirit of Music to Carma's Cafe to CVS	BMA Sculpture Gardens|Spirit of Music|Carma's Cafe|CVS	12|3|6|9	path_550.png
baltimore	Start at Gertrude's travel northwest to X-578.  Once there turn northeast going to Spirit of Music.	Gertrude's|X-578|Spirit of Music	2|13|3	path_297.png
baltimore	Start on Gertrude's then go northwest to X-578 then east to Spirit of Music.	Gertrude's|X-578|Spirit of Music	2|13|3	path_297.png
baltimore	Starting from Gertrude's go to X-578 then to Spirit of Music	Gertrude's|X-578|Spirit of Music	2|13|3	path_297.png
baltimore	Walk from Barnes & Noble to Race Pace Bicycles, then turn left and walk to Spirit of Music, then turn left and walk to Bamboo Cafe.	Barnes & Noble|Race Pace Bicycles|Spirit of Music|Bamboo Cafe	0|14|3|7	path_551.png
baltimore	Start at Barnes & Noble. From there, head north-northwest to Race Pace Bicycles. Once there, head south-southwest to Spirit of Music. Finally, head southeast to Bamboo Cafe.	Barnes & Noble|Race Pace Bicycles|Spirit of Music|Bamboo Cafe	0|14|3|7	path_551.png
baltimore	Starting at Barnes & Noble, go to Race Pace Bicycles, then turn left and go to Spirit of Music, then turn left and end at Bamboo Cafe.	Barnes & Noble|Race Pace Bicycles|Spirit of Music|Bamboo Cafe	0|14|3|7	path_551.png
baltimore	Walk from Hopkins University to Barnes & Noble, then turn left and walk to Carma's Cafe, then turn sharply right and walk to CVS, then turn slightly right and walk to Race Pace Bicycles.	Hopkins University|Barnes & Noble|Carma's Cafe|CVS|Race Pace Bicycles	10|0|6|9|14	path_51.png
baltimore	Go from Hopkins University to Barnes & Noble to Carma's Cafe to CVS	Hopkins University|Barnes & Noble|Carma's Cafe|CVS|Race Pace Bicycles	10|0|6|9|14	path_51.png
baltimore	Start at Hopkins University heading northeast to Barnes & Noble.  Once at Barnes and Noble turn west to Carma's Cafe.  Once there turn northeast to CVS.  At CVS go south east to Race Pace Bicycles.	Hopkins University|Barnes & Noble|Carma's Cafe|CVS|Race Pace Bicycles	10|0|6|9|14	path_51.png
baltimore	Start at Carma's Cafe then proceed southeast towards the Sound of Music. Once there, make a sharp left turn then proceed southwest to BMA Sculpture Gardens. Continue south to Gertrudes. End trip there.	Carma's Cafe|Spirit of Music|BMA Sculpture Gardens|Gertrude's	6|3|12|2	path_298.png
baltimore	from Carma's Cafe go SE to Spirit of Music, turn SW to BMA Sculpture Gardens, continue SW to Gertrude's.	Carma's Cafe|Spirit of Music|BMA Sculpture Gardens|Gertrude's	6|3|12|2	path_298.png
baltimore	Starting at Carma's Cafe, go to Spirit of Music, then the BMA Sculpture Gardens and then Gertrude's.	Carma's Cafe|Spirit of Music|BMA Sculpture Gardens|Gertrude's	6|3|12|2	path_298.png
baltimore	Leave from Alkimia and go to CVS, passing through The Breezeway and the Bamboo Cafe.	Alkimia|The Breezeway|Bamboo Cafe|CVS	8|11|7|9	path_552.png
baltimore	starting at alklmia go north west to the breezeway and then on the same north west trajectory go to bamboo cafe. once there go north west to CVS.	Alkimia|The Breezeway|Bamboo Cafe|CVS	8|11|7|9	path_552.png
baltimore	Starting at Alkimia, travel to CVS passing through The Breezeway and Bamboo Cafe.	Alkimia|The Breezeway|Bamboo Cafe|CVS	8|11|7|9	path_552.png
baltimore	Go west to X 578	Daniel Gilman|X-578|BMA Sculpture Gardens	5|13|12	path_300.png
baltimore	from daniel gliman go north west to x-578 and then turn north east to go to BMA sculpture gardens	Daniel Gilman|X-578|BMA Sculpture Gardens	5|13|12	path_300.png
baltimore	Start at Daniel Gilman head northwest to X-578.  Once there turn east and head to BMA Sculpture Gardens.	Daniel Gilman|X-578|BMA Sculpture Gardens	5|13|12	path_300.png
baltimore	starting at hopkins university go north west to CVS and then go south east to race pace bicycles. from there go south east to bamboo cafe.	Hopkins University|CVS|Race Pace Bicycles|Bamboo Cafe	10|9|14|7	path_553.png
baltimore	begin at hopkins university and go to cvs before heading to race pace bicycles and ending at bamboo cafe	Hopkins University|CVS|Race Pace Bicycles|Bamboo Cafe	10|9|14|7	path_553.png
baltimore	Head towards CVS from Hopkins University. Next go to Race Pace Bicycles. Then advance towards the destination at Bamboo Cafe.	Hopkins University|CVS|Race Pace Bicycles|Bamboo Cafe	10|9|14|7	path_553.png
baltimore	From Spirit of Music, head northwest for some distance to reach Carma's Cafe. From Carma's Cafe, head slightly northeast, where you will shortly reach CVS.	Spirit of Music|Carma's Cafe|CVS	3|6|9	path_52.png
baltimore	from the spirit of music go north west to carma's cafe and then go to the north east to get to CVS.	Spirit of Music|Carma's Cafe|CVS	3|6|9	path_52.png
baltimore	Go from Spirit of Music to Carma's Cafe to CVS	Spirit of Music|Carma's Cafe|CVS	3|6|9	path_52.png
baltimore	Start on 7-Eleven then southeast to BMA Sculpture Gardens.	7-Eleven|BMA Sculpture Gardens	1|12	path_301.png
baltimore	Starting from 7-Eleven go to BMA Scupture Gardens	7-Eleven|BMA Sculpture Gardens	1|12	path_301.png
baltimore	Begin at 7-eleven and go to the BMA Sculpture Gardens	7-Eleven|BMA Sculpture Gardens	1|12	path_301.png
baltimore	Walk from Daniel Gilman to Gertrude's, then turn right and walk to Bambook Cafe, then turn left and walk to Hopkins University.	Daniel Gilman|Gertrude's|Bamboo Cafe|Hopkins University	5|2|7|10	path_554.png
baltimore	from daniel gilman go north west to gertrude's and then turn north east to get to the bamboo cafe. once there go north east to hopkins university.	Daniel Gilman|Gertrude's|Bamboo Cafe|Hopkins University	5|2|7|10	path_554.png
baltimore	Start at Daniel Gilman and head north-northwest to reach Gertrude's. From there,  head north-northeast to reach Bamboo Cafe. Finally, travel northeast to arrive at Hopkins University.	Daniel Gilman|Gertrude's|Bamboo Cafe|Hopkins University	5|2|7|10	path_554.png
baltimore	Start on CVS then go south to Bamboo Cafe then south to The Breezeway then south to Alkimia.	CVS|Bamboo Cafe|The Breezeway|Alkimia	9|7|11|8	path_53.png
baltimore	Start at CVS head southeast to Bamboo Cafe.  Once there continue south east to the Breezeway.  At the Breezeway continue southwest to Alkimia.	CVS|Bamboo Cafe|The Breezeway|Alkimia	9|7|11|8	path_53.png
baltimore	Starting at CVS, go to Bamboo Cafe, then go to The Breezeway, then end at Alkimia.	CVS|Bamboo Cafe|The Breezeway|Alkimia	9|7|11|8	path_53.png
baltimore	Starting at Spirit of Music, travel to Alkimia passing throughBamboo Cafe and The Breezeway.	Spirit of Music|Bamboo Cafe|The Breezeway|Alkimia	3|7|11|8	path_303.png
baltimore	starting at the spirit of music go to the south east to the bamboo cafe and from there go south east to the breezeway. once there go south east to alkamia.	Spirit of Music|Bamboo Cafe|The Breezeway|Alkimia	3|7|11|8	path_303.png
baltimore	Take off from Spirit of Music, go to Bamboo Cafe, to The Breezeway, then to Alkimia.	Spirit of Music|Bamboo Cafe|The Breezeway|Alkimia	3|7|11|8	path_303.png
baltimore	Go from X-578 to BMA Sculpture Gardens to Hopkins University to Barnes & Noble	X-578|BMA Sculpture Gardens|Hopkins University|Barnes & Noble	13|12|10|0	path_556.png
baltimore	Starting at X-578, go to the BMA Sculpture Gardens, then Hopkins University and then on to Barnes & Noble.	X-578|BMA Sculpture Gardens|Hopkins University|Barnes & Noble	13|12|10|0	path_556.png
baltimore	Start at X-578 and head northeast to BMA Sculpture Gardens. From there, head northeast again to Hopkins University before traveling north-northeast to Barnes & Noble.	X-578|BMA Sculpture Gardens|Hopkins University|Barnes & Noble	13|12|10|0	path_556.png
baltimore	Start on Barnes & Noble then go south to Spirit of Music then southeast to Bamboo Cafe then south to The Breezeway.	Barnes & Noble|Spirit of Music|Bamboo Cafe|The Breezeway	0|3|7|11	path_54.png
baltimore	Walk from Barnes & Noble to Spirit of Music, then turn left and walk to Bamboo Cafe, then turn slightly right and walk to The Breezeway.	Barnes & Noble|Spirit of Music|Bamboo Cafe|The Breezeway	0|3|7|11	path_54.png
baltimore	from barnes & noble go south west to the spirit of music and then go south east to get to bamboo cafe. once there go south east to the breezeway.	Barnes & Noble|Spirit of Music|Bamboo Cafe|The Breezeway	0|3|7|11	path_54.png
baltimore	Go from CVS to Race Pace Bicycles to BMA Sculpture Gardens to Gertrude's	CVS|Race Pace Bicycles|BMA Sculpture Gardens|Gertrude's	9|14|12|2	path_55.png
baltimore	go straight then left then straight again	CVS|Race Pace Bicycles|BMA Sculpture Gardens|Gertrude's	9|14|12|2	path_55.png
baltimore	Leave from CVS and go to Race Pace Bicycles.  Then go to BMA Sculpture Gardens.  After that, go to Gertrude's.	CVS|Race Pace Bicycles|BMA Sculpture Gardens|Gertrude's	9|14|12|2	path_55.png
baltimore	Go from Carma's Cafe to 7-Eleven to X-578	Carma's Cafe|7-Eleven|X-578	6|1|13	path_559.png
baltimore	start at carma's cafe, and go left and slightly down to 7-eleven, and then directly down to x-578.	Carma's Cafe|7-Eleven|X-578	6|1|13	path_559.png
baltimore	Start at Carma's Cafe and travel southwest to 7-Eleven. Once there, head south-southwest to X-578.	Carma's Cafe|7-Eleven|X-578	6|1|13	path_559.png
baltimore	Go from Carma's Cafe to Bamboo Cafe	Carma's Cafe|Bamboo Cafe	6|7	path_304.png
baltimore	Travel from Carma's Cafe to Bamboo Cafe.	Carma's Cafe|Bamboo Cafe	6|7	path_304.png
baltimore	STARTING AT CARMAS CAFE GO 5 OCLOCK TO BAMBOO CAFE	Carma's Cafe|Bamboo Cafe	6|7	path_304.png
baltimore	Start at The Breezeway and head northwest to Bamboo Cafe. From there, head north-northwest to arrive at Race Pace Bicycles.  Once there,  head north-northwest to reach CVS, before traveling west-southwest to Carma's Cafe.	The Breezeway|Bamboo Cafe|Race Pace Bicycles|CVS|Carma's Cafe	11|7|14|9|6	path_57.png
baltimore	Go from The Breezeway to Bamboo Cafe to Race Pace Bicycles to CVS to Carma's Cafe	The Breezeway|Bamboo Cafe|Race Pace Bicycles|CVS|Carma's Cafe	11|7|14|9|6	path_57.png
baltimore	Start on The Breezeway then go north to Bamboo Cafe then north to Race Pace Bicycles then west to CVS then west to Carma's Cafe.	The Breezeway|Bamboo Cafe|Race Pace Bicycles|CVS|Carma's Cafe	11|7|14|9|6	path_57.png
baltimore	Start at Gertrude's and head northeast to Spirit of Music.  At Spirit of Music go southeast to Bamboo Cafe.  At Bamboo cafe turn west to BMA Sculpture Gardens.	Gertrude's|Spirit of Music|Bamboo Cafe|BMA Sculpture Gardens	2|3|7|12	path_561.png
baltimore	Starting at Gertrude's, travel to BMA Sculpture Gardens, going through Spirit of Music and Bamboo Cafe.	Gertrude's|Spirit of Music|Bamboo Cafe|BMA Sculpture Gardens	2|3|7|12	path_561.png
baltimore	Starting at Gertrude's, go to Spirit of Music, then turn right and go to Bamboo Cafe, then turn right and end at BMA Sculpture Gardens.	Gertrude's|Spirit of Music|Bamboo Cafe|BMA Sculpture Gardens	2|3|7|12	path_561.png
baltimore	Starting from Gertrude's go to BMA Scupture Gardens then to Race Pace Bicycles then to CVS finally go to Carma's Cafe	Gertrude's|BMA Sculpture Gardens|Race Pace Bicycles|CVS|Carma's Cafe	2|12|14|9|6	path_305.png
baltimore	From Gertrude's go NE to BMA Sculpture Gardens, continue NE to Race Pace Bicycles, go west to CVS, go SW to Carma's Cafe.	Gertrude's|BMA Sculpture Gardens|Race Pace Bicycles|CVS|Carma's Cafe	2|12|14|9|6	path_305.png
baltimore	starting at gertrude's go north east to the BMA sculpture gardens and then go north east to race pace bicycles. from there turn north west and go to CVS, finally go south west to carma's cafe.	Gertrude's|BMA Sculpture Gardens|Race Pace Bicycles|CVS|Carma's Cafe	2|12|14|9|6	path_305.png
baltimore	THE BREEZEWAY 9 OCLOCK TO DANIEL GILMAN AND 2 OCLOCK TO BAMBOO CAFE	The Breezeway|Daniel Gilman|Bamboo Cafe	11|5|7	path_562.png
baltimore	Go from The Breezeway to Daniel Gilman to Bamboo Cafe	The Breezeway|Daniel Gilman|Bamboo Cafe	11|5|7	path_562.png
baltimore	Starting at The Breezeway, travel to Bamboo Cafe passing through Daniel Gibson.	The Breezeway|Daniel Gilman|Bamboo Cafe	11|5|7	path_562.png
baltimore	Go from Alkimia to The Breezeway to Bamboo Cafe to Hopkins University to CVS	Alkimia|The Breezeway|Bamboo Cafe|Hopkins University|CVS	8|11|7|10|9	path_58.png
baltimore	Starting at Alkimia, travel to CVS passing through the Breezeway, Bamboo Cafe and Hopkins University.	Alkimia|The Breezeway|Bamboo Cafe|Hopkins University|CVS	8|11|7|10|9	path_58.png
baltimore	Begin at Alkimia and go to the breezeway before heading to bamboo cafe and hopkins university, ending at race pace bicycles	Alkimia|The Breezeway|Bamboo Cafe|Hopkins University|CVS	8|11|7|10|9	path_58.png
baltimore	STARTING AT RACE PACE BICYCLES GO 7 OCLOCK TO SPIRIT OF MUSIC AND 4 OCLOCK TO BAMBOO CAFE	Race Pace Bicycles|Spirit of Music|Bamboo Cafe	14|3|7	path_307.png
baltimore	Start on Race Pace Bicycles then south to Spirit of Music then east to Bamboo Cafe.	Race Pace Bicycles|Spirit of Music|Bamboo Cafe	14|3|7	path_307.png
baltimore	Starting at Race Pace Bicycles, go to Spirit of Music, then turn left and end at Bamboo Cafe.	Race Pace Bicycles|Spirit of Music|Bamboo Cafe	14|3|7	path_307.png
baltimore	Start on CVS then go south to Bamboo Cafe then south to The Breezeway.	CVS|Bamboo Cafe|The Breezeway	9|7|11	path_563.png
baltimore	Begin at the CVS then proceed south to Bamboo Cafe. Continue along the same southerly path towards the Breezeway. End there.	CVS|Bamboo Cafe|The Breezeway	9|7|11	path_563.png
baltimore	from cvs, go down at a rightward angle to bamboo cafe, and then down to the breezeway.	CVS|Bamboo Cafe|The Breezeway	9|7|11	path_563.png
baltimore	Start at Bamboo Cafe and travel northwest to Spirit of Music. Once there, travel southeast to Daniel Gilman. Continue south-southeast to William Welch, and then head directly east to The Breezeway.	Bamboo Cafe|Spirit of Music|Daniel Gilman|William Welch|The Breezeway	7|3|5|4|11	path_59.png
baltimore	Walk from Bamboo Cafe to Spirit of Music, then turn left and walk to Daniel Gilman, then continue straight to William Welch, then turn left and walk to The Breezeway.	Bamboo Cafe|Spirit of Music|Daniel Gilman|William Welch|The Breezeway	7|3|5|4|11	path_59.png
baltimore	Beginning at Bamboo Cafe, fly to Spirit of Music, to Daniel Gilman, to William Welch, and then on to The Breezeway.	Bamboo Cafe|Spirit of Music|Daniel Gilman|William Welch|The Breezeway	7|3|5|4|11	path_59.png
baltimore	From Alkimia, head to The Breezeway, then to the Bamboo Cafe, then Spirit of Music, and finally to CVS.	Alkimia|The Breezeway|Bamboo Cafe|Spirit of Music|CVS	8|11|7|3|9	path_309.png
baltimore	Starting from Alkimia go to The Breezeway then to Bamboo Cafe then go to Spirit of Music then finally go to CVS	Alkimia|The Breezeway|Bamboo Cafe|Spirit of Music|CVS	8|11|7|3|9	path_309.png
baltimore	Leave from Alkimia and head to The Breezeway.  Then stop at The Bamboo Cafe and the Spirit of Music before heading to Race Pace Bicycles.	Alkimia|The Breezeway|Bamboo Cafe|Spirit of Music|CVS	8|11|7|3|9	path_309.png
baltimore	From 7-Eleven go to Gertrude's.	7-Eleven|Gertrude's	1|2	path_564.png
baltimore	from 7-eleven, go down in a rightward direction until you reach gertrude's.	7-Eleven|Gertrude's	1|2	path_564.png
baltimore	Start on 7-Eleven then southeast to Gertude's.	7-Eleven|Gertrude's	1|2	path_564.png
baltimore	From Hopkins University go to BMA Sculpture Gardens. Then go to X-578.	Hopkins University|BMA Sculpture Gardens|X-578	10|12|13	path_60.png
baltimore	Start at Hopkins University and travel southwest to BMA Sculpture Gardens. Once there, head south-southwest to X-578.	Hopkins University|BMA Sculpture Gardens|X-578	10|12|13	path_60.png
baltimore	begin at hopkins university and go to the bma sculpture gardens and end at x-578	Hopkins University|BMA Sculpture Gardens|X-578	10|12|13	path_60.png
baltimore	starting at carma's cafe go to the south east to get to barnes & noble and then turn north west to go to CVS.	Race Pace Bicycles|CVS|Barnes & Noble|Carma's Cafe	14|9|0|6	path_61.png
baltimore	Start on CVS then go east to Barnes & Noble then west to Carma's Cafe.	Race Pace Bicycles|CVS|Barnes & Noble|Carma's Cafe	14|9|0|6	path_61.png
baltimore	Starting at Barnes & Noble, go to CVS, then turn around and go back to Barnes & Noble, then go to Carma's Cafe and stop.	Race Pace Bicycles|CVS|Barnes & Noble|Carma's Cafe	14|9|0|6	path_61.png
baltimore	from gertrude's go to the south east to get to daniel gilman and then go south east to the breezeway. once there go to the south east to alklmia.	Gertrude's|Daniel Gilman|The Breezeway|Alkimia	2|5|11|8	path_567.png
baltimore	Begin at Gertrudes. Move down to the right to Daniel Gilman. Move to the right and slightly down to The Breezeway. Move down to the right to Alkimia.	Gertrude's|Daniel Gilman|The Breezeway|Alkimia	2|5|11|8	path_567.png
baltimore	Leave from Gertrude's and get by Daniel Gibson and The Breezeway on the way to Alkimia.	Gertrude's|Daniel Gilman|The Breezeway|Alkimia	2|5|11|8	path_567.png
baltimore	FROM WILLIAM GILMAN GO NORTH PAST DANIEL GILMAN TO BMA SCULPTURE GARDENS TURNING 2 OCLOCK TO RACE PACE BICYCLES	William Welch|Daniel Gilman|BMA Sculpture Gardens|Race Pace Bicycles	4|5|12|14	path_310.png
baltimore	Starting from William Welch, fly to Daniel Gilman, on to BMA Sculpture Gardens, and then to Race Pace Bicycles.	William Welch|Daniel Gilman|BMA Sculpture Gardens|Race Pace Bicycles	4|5|12|14	path_310.png
baltimore	Start William Welch head north to Daniel Gilman.  Once there continue north to BMA Sculpture Gardens.  At BMA Sculpture gardens, head north east to Race Pace Bicycles.	William Welch|Daniel Gilman|BMA Sculpture Gardens|Race Pace Bicycles	4|5|12|14	path_310.png
baltimore	Starting from Gertrude's, go to X-578, then the BMA Sculpture Gardens and then Bamboo Cafe.	Gertrude's|X-578|BMA Sculpture Gardens|Bamboo Cafe	2|13|12|7	path_312.png
baltimore	Start on Gertrude's then go northwest to X-578 then east to BMA Sculpture Gardens then east to Bamboo Cafe.	Gertrude's|X-578|BMA Sculpture Gardens|Bamboo Cafe	2|13|12|7	path_312.png
baltimore	Starting at Gertrude's, travel to Bamboo Cafe, going through X-578 and BMA Sculpture Gardens.	Gertrude's|X-578|BMA Sculpture Gardens|Bamboo Cafe	2|13|12|7	path_312.png
baltimore	Leave William Welch and go up to Gertrude's. Turn right and go up to BMA Sculpture Gardens.  Go on to Spirit of Music.	William Welch|Gertrude's|BMA Sculpture Gardens|Spirit of Music	4|2|12|3	path_62.png
baltimore	Start on William Welch then north to Gertrude's then northeast to BMA Sculpture Gardens then east to Spirit of Music.	William Welch|Gertrude's|BMA Sculpture Gardens|Spirit of Music	4|2|12|3	path_62.png
baltimore	From William Welch to Gertrude's to BMA Sculpture Gardens up to Spirit of Music.	William Welch|Gertrude's|BMA Sculpture Gardens|Spirit of Music	4|2|12|3	path_62.png
baltimore	Start on Carma's Cafe then east to Race Pace Bicycles then south to Spirit of Music.	Carma's Cafe|Race Pace Bicycles|Spirit of Music	6|14|3	path_569.png
baltimore	Leave from Carma's Cafe, go to Race Pace Bicycles, and then to Spirit of Music.	Carma's Cafe|Race Pace Bicycles|Spirit of Music	6|14|3	path_569.png
