map_name	utterance	trajectory	path_names	path_idxs
baltimore	Starting from Gertrude's, head southeast to reach Daniel Gilman. Go directly south, where you will shortly reach William Welch. Head directly to the east to reach The Breezeway. Head southeast to reach Alkimia.	Gertrude's|Daniel Gilman|William Welch|The Breezeway|Alkimia	2|5|4|11|8	path_360.png
baltimore	Start at Gertrude's and head southeast towards Daniel Gilman. After, continue south towards William Welch and then due East to The Breezeway. Finally, head southwest towards Alkimia.	Gertrude's|Daniel Gilman|William Welch|The Breezeway|Alkimia	2|5|4|11|8	path_360.png
baltimore	Walk from Gertrudes to Daniel Gilman, then turn slightly right and walk to William Welch, then turn left and walk to The Breezeway, then turn right and walk to Alkimia.	Gertrude's|Daniel Gilman|William Welch|The Breezeway|Alkimia	2|5|4|11|8	path_360.png
baltimore	Walk from Hopkins University to Carma's Cafe, then turn left and walk to 7-Eleven.	Hopkins University|Carma's Cafe|7-Eleven	10|6|1	path_105.png
baltimore	Starting at Hopkins University, travel to 7-Eleven passing through Carma's Cafe.	Hopkins University|Carma's Cafe|7-Eleven	10|6|1	path_105.png
baltimore	Go from Hopkins University to Carma's Cafe to 7-Eleven	Hopkins University|Carma's Cafe|7-Eleven	10|6|1	path_105.png
baltimore	STARTING AT RACE PACE BICYCLES GO 4 OCLOCK TO HOPKINS UNIVERSITY BEARING 7 OCLOCK PAST SPIRIT FOR MUSIC TO BMA SCULPTURE GARDENS	CVS|Race Pace Bicycles|Hopkins University|BMA Sculpture Gardens	9|14|10|12	path_361.png
baltimore	begin at cvs and go to race pace bicycles and hopkins university before heading to the bma sculpture gardens	CVS|Race Pace Bicycles|Hopkins University|BMA Sculpture Gardens	9|14|10|12	path_361.png
baltimore	start at CVS and go right and very slightly down to reach race pace bicycles. from race place bicycles, go right again and down to hopkins university, and then down and left to BMA sculpture gardens, passing spirit of music on your way.	CVS|Race Pace Bicycles|Hopkins University|BMA Sculpture Gardens	9|14|10|12	path_361.png
baltimore	Go from The Breezeway to Daniel Gilman to X-578 to 7-Eleven	The Breezeway|Daniel Gilman|X-578|7-Eleven	11|5|13|1	path_362.png
baltimore	Starting at The Breezeway, travel to 7-Eleven, going through Daniel Gilman and X-578.	The Breezeway|Daniel Gilman|X-578|7-Eleven	11|5|13|1	path_362.png
baltimore	Starting at The Breezeway, go to Daniel Gilman, then turn right and go to X-578, then go to 7-Eleven and stop.	The Breezeway|Daniel Gilman|X-578|7-Eleven	11|5|13|1	path_362.png
baltimore	Start at Bamboo Cafe and travel west-northwest to arrive at BMA Sculpture Gardens. From there, travel northeast to reach Spirit of Music. Finally, travel northwest to arrive at 7-Eleven.	Bamboo Cafe|BMA Sculpture Gardens|Spirit of Music|7-Eleven	7|12|3|1	path_364.png
baltimore	Start at Bamboo Cafe head west to BMA Sculpture Gardens.  Upon arriving turn northwest and go to spirit of Music.  Continue on from Spirit of Music northwest to  7-Eleven.	Bamboo Cafe|BMA Sculpture Gardens|Spirit of Music|7-Eleven	7|12|3|1	path_364.png
baltimore	{}	Bamboo Cafe|BMA Sculpture Gardens|Spirit of Music|7-Eleven	7|12|3|1	path_364.png
baltimore	start at barnes & noble, and go up and left until you get to CVS>	Barnes & Noble|CVS	0|9	path_106.png
baltimore	Go from Barnes & Noble to CVS	Barnes & Noble|CVS	0|9	path_106.png
baltimore	FROM BARNES & NOBLE GO LEFT PAST  RACE PACE BICYCLES TO CVS	Barnes & Noble|CVS	0|9	path_106.png
baltimore	Starting at Alkimia head northwest to The Breezeway.  Once there continue Northwest to Bamboo Cafe.  Upon arriving go Northeast to Hopkins University.  Continue on from Hopkins University northwest to Race Pace Bicycles.	Alkimia|The Breezeway|Bamboo Cafe|Hopkins University|Race Pace Bicycles	8|11|7|10|14	path_365.png
baltimore	beginning at alkimia, go up in a leftward direction past the breezeway, continuing on to bamboo cafe. from bamboo cafe, go rightward and up to hopkins university. from hopkins university, then head up in a leftward direction to reach race pace bicycles.	Alkimia|The Breezeway|Bamboo Cafe|Hopkins University|Race Pace Bicycles	8|11|7|10|14	path_365.png
baltimore	Start on Alkimia then north to The Breezeway then north to Bamboo Cafe then north to Hopkins University then north to Race Pace Bicycles.	Alkimia|The Breezeway|Bamboo Cafe|Hopkins University|Race Pace Bicycles	8|11|7|10|14	path_365.png
baltimore	from carma's cafe go north east to CVS and then go south east to the spirit of music. once there turn south west and go to the BMA sculpture gardens.	Carma's Cafe|CVS|Spirit of Music|BMA Sculpture Gardens	6|9|3|12	path_366.png
baltimore	Sarting at Carma's Cafe head northwest to CVS.  At CVS go southeast to Spirit of Music.  At Spirit of Music go southwest to BMA Sculpture gardens.	Carma's Cafe|CVS|Spirit of Music|BMA Sculpture Gardens	6|9|3|12	path_366.png
baltimore	Go from Carma's Cafe to CVS to Spirit of Music to BMA Sculpture Gardens	Carma's Cafe|CVS|Spirit of Music|BMA Sculpture Gardens	6|9|3|12	path_366.png
baltimore	Starting at BMA Sculpture Gardens from northeast go Race Pace Bicycles.	BMA Sculpture Gardens|Race Pace Bicycles	12|14	path_107.png
baltimore	FROM BMA SCULPTURE GARDENS HEAD 2 OCLOCK TO AT RACE PACE BICYCLES	BMA Sculpture Gardens|Race Pace Bicycles	12|14	path_107.png
baltimore	start at BMA sculpture garden, go up and right at a forty-five degree angle until you reach race pace bicycles.	BMA Sculpture Gardens|Race Pace Bicycles	12|14	path_107.png
baltimore	Start from Alkimia and fly to The Breezeway, to Bamboo Cafe, to Barnes & Noble, then to Race Pace Motorcycles.	Alkimia|The Breezeway|Bamboo Cafe|Barnes & Noble|Race Pace Bicycles	8|11|7|0|14	path_108.png
baltimore	From Alkimia go to The Breezway, then go to Bamboo Cafe, then proceed to Barnes & Noble and then to Race Pace Bicycles.	Alkimia|The Breezeway|Bamboo Cafe|Barnes & Noble|Race Pace Bicycles	8|11|7|0|14	path_108.png
baltimore	Walk from Alkimia to The Breezeway, then continue straight to Bamboo Cafe, then turn right and walk to Barnes & Noble, then turn left and walk to Race Pace Bicycles.	Alkimia|The Breezeway|Bamboo Cafe|Barnes & Noble|Race Pace Bicycles	8|11|7|0|14	path_108.png
baltimore	Starting at X-578, go to Gertrude's, then turn left and go to Spirit of Music, then continue on to Barnes & Noble and stop.	X-578|Gertrude's|Spirit of Music|Barnes & Noble	13|2|3|0	path_367.png
baltimore	from x-578 go south east to gertrude's and then turn to go north east to spirit of music, from there go north east to get to barnes & noble.	X-578|Gertrude's|Spirit of Music|Barnes & Noble	13|2|3|0	path_367.png
baltimore	Walk from X-578 to Gertrude's, then turn left and walk to Spirit of Music, then continue straight to Barnes & Noble.	X-578|Gertrude's|Spirit of Music|Barnes & Noble	13|2|3|0	path_367.png
baltimore	Start at Alkimia outside of town.  Go to The Breezeway.  Then go to William Welch.	Alkimia|The Breezeway|William Welch	8|11|4	path_368.png
baltimore	Start at Alkimia go to The Breezeway northwest of start.  Once at The Breezeway turn west to William Welch	Alkimia|The Breezeway|William Welch	8|11|4	path_368.png
baltimore	START ALKIMIA GO 11 OCLOCK TO THE BREEZEWAY AND TAKE LEFT TO WILLIAM WELCH	Alkimia|The Breezeway|William Welch	8|11|4	path_368.png
baltimore	7-Eleven to X-578 to Spirit of Music and down to BMA Sculpture Gardens.	7-Eleven|X-578|Spirit of Music|BMA Sculpture Gardens	1|13|3|12	path_112.png
baltimore	Walk from 7-Eleven to X-578, then turn left and walk to Spirit of Music, then turn sharply right and walk to BMA Sculpture Gardens.	7-Eleven|X-578|Spirit of Music|BMA Sculpture Gardens	1|13|3|12	path_112.png
baltimore	Start at 7-Eleven and head south to reach X-578.  Next, head east-northeast to arrive at Spirit of Music, before heading southwest to reach BMA Sculpture Gardens.	7-Eleven|X-578|Spirit of Music|BMA Sculpture Gardens	1|13|3|12	path_112.png
baltimore	Starting from CVS, head slightly southeast, where you will shortly reach Race Pace Bicycles. From Race Pace Bicycles. Head slightly southwest to reach 7-Eleven.	CVS|Race Pace Bicycles|7-Eleven	9|14|1	path_369.png
baltimore	Start at CVS and head south-southeast to Race Pace Bicycles. From there, head southwest to 7-Eleven.	CVS|Race Pace Bicycles|7-Eleven	9|14|1	path_369.png
baltimore	Starting from CVS go to Race Pace Bicycles then go to 7-Eleven	CVS|Race Pace Bicycles|7-Eleven	9|14|1	path_369.png
baltimore	Walk from Hopkins University to Spirit of Music, then turn left and walk to Daniel Gilman.	Hopkins University|Spirit of Music|Daniel Gilman	10|3|5	path_113.png
baltimore	FROM HOPKINS UNIVERSITY HEAD 7 OCLOCK TO SPIRIT OF MUCIC DOWNWARD TO DANIEL GILMAN	Hopkins University|Spirit of Music|Daniel Gilman	10|3|5	path_113.png
baltimore	Start at Hopkins University go southwest to Spirit of Music.  Once there continue southwest to Daniel Gilman.	Hopkins University|Spirit of Music|Daniel Gilman	10|3|5	path_113.png
baltimore	Go from Barnes & Noble to Hopkins University to Bamboo Cafe to The Breezeway to Alkimia	Barnes & Noble|Hopkins University|Bamboo Cafe|The Breezeway|Alkimia	0|10|7|11|8	path_370.png
baltimore	Begin at Barnes & Noble, then continue south to Hopkins University. Once at Hopkins University, continue south to the Bamboo Cafe. Make a sharp right, then continue southeast to the Breezway. Continue south then terminate the trip at Alkimia.	Barnes & Noble|Hopkins University|Bamboo Cafe|The Breezeway|Alkimia	0|10|7|11|8	path_370.png
baltimore	Starting at  Barnes & Noble go southwest to Hopkin University.  Continue on from there to Bamboo Cafe.  At Bamboo Cafe continue southeast to The Breezeway.  At the Breezeway to Alkimia.	Barnes & Noble|Hopkins University|Bamboo Cafe|The Breezeway|Alkimia	0|10|7|11|8	path_370.png
baltimore	Start at X-578 and head straight to the right and slightly north to BMA Sculpture Gardens. Make a right and continue straight past Daniel Gilman to William Welch.	X-578|BMA Sculpture Gardens|Daniel Gilman|William Welch	13|12|5|4	path_371.png
baltimore	start at x-578, and come right at a very slight upward angle to reach BMA sculpture garden. from the sculpture garden, come down to daniel gilman, and then you will find williams welch right below it.	X-578|BMA Sculpture Gardens|Daniel Gilman|William Welch	13|12|5|4	path_371.png
baltimore	Walk from X-578 to BMA Sculpture Gardens, then turn right and walk to Daniel Gilman, then continue straight to William Welch.	X-578|BMA Sculpture Gardens|Daniel Gilman|William Welch	13|12|5|4	path_371.png
baltimore	Go from Gertrude's to BMA Sculpture Gardens to Carma's Cafe to CVS	Gertrude's|BMA Sculpture Gardens|Carma's Cafe|CVS	2|12|6|9	path_114.png
baltimore	Walk from Gertrude's to BMA Sculpture Gardens, then turn slightly left and walk to Carma's Cafe, then turn right and walk to CVS.	Gertrude's|BMA Sculpture Gardens|Carma's Cafe|CVS	2|12|6|9	path_114.png
baltimore	STARTING AT GERTRUDES GO 2 OCLOCK TO BMA SCULPTURE GARDENS AND NORTH TO CARMAS CAFE AND RIGHT TO CVS	Gertrude's|BMA Sculpture Gardens|Carma's Cafe|CVS	2|12|6|9	path_114.png
baltimore	Walk from Carma's Cafe to 7-Eleven, then turn left and walk to Gertrude's.	Carma's Cafe|7-Eleven|Gertrude's	6|1|2	path_116.png
baltimore	Go from Carma's Cafe to 7-Eleven to Gertrude's	Carma's Cafe|7-Eleven|Gertrude's	6|1|2	path_116.png
baltimore	From Carma's go to 7-Eleven and end at Gertrude's.	Carma's Cafe|7-Eleven|Gertrude's	6|1|2	path_116.png
baltimore	We are at CVS.  We have to go to Race Pace Bicycles first, then to Barnes & Noble, then all the way to Carma's Cafe.	CVS|Barnes & Noble|Carma's Cafe	9|0|6	path_372.png
baltimore	Go from CVS to Barnes & Noble to Carma's Cafe	CVS|Barnes & Noble|Carma's Cafe	9|0|6	path_372.png
baltimore	from CVS go south east to barnes & noble and then go north west to carma's cafe.	CVS|Barnes & Noble|Carma's Cafe	9|0|6	path_372.png
baltimore	Walk from BMA Sculpture Garden to Spirit of Music, then turn right and walk to Bamboo Cafe, then turn sharply right and walk to X-578, then turn sharply left and walk to Gertrude's.	BMA Sculpture Gardens|Spirit of Music|Bamboo Cafe|X-578|Gertrude's	12|3|7|13|2	path_374.png
baltimore	Head north east until you reach the Spirit of Music Landmark.  Then head south east until you reach the Bamboo Cafe.  Head West and slightly south until you reach the X-578 land mark.  Finally head south east until you reach Gertrude's.	BMA Sculpture Gardens|Spirit of Music|Bamboo Cafe|X-578|Gertrude's	12|3|7|13|2	path_374.png
baltimore	Starting from BMA Scupture Gardens go to Spirit of Music then to Bamboo Cafe then go to X-578 then finally go to Gertrude's	BMA Sculpture Gardens|Spirit of Music|Bamboo Cafe|X-578|Gertrude's	12|3|7|13|2	path_374.png
baltimore	Start at Spirit of Music and travel southwest to BMA Sculpture Gardens.  From there cut northeast and travel to CVS.  Then make a sharp left turn west to Carma's Cafe.	Spirit of Music|BMA Sculpture Gardens|CVS|Carma's Cafe	3|12|9|6	path_117.png
baltimore	start at spirit of music, and come down and leftward to bma sculpture garden. from the sculpture garden, start up at a rightward angle to cvs, and then turn left more sharply to reach carma's cafe.	Spirit of Music|BMA Sculpture Gardens|CVS|Carma's Cafe	3|12|9|6	path_117.png
baltimore	Leave from the Spirit of Music heading to BMA Sculpture Gardens.  Then head up to CVS.  Then go to Carma's Cafe.	Spirit of Music|BMA Sculpture Gardens|CVS|Carma's Cafe	3|12|9|6	path_117.png
baltimore	Starting from Gertrude's, to northeast to reach BMA Sculpture Gardens. From there, go northeast to reach Spirit of Music. From Spirit of Music, continue northwest to reach 7-Eleven.	Gertrude's|BMA Sculpture Gardens|Spirit of Music|7-Eleven	2|12|3|1	path_375.png
baltimore	Starting at Getrude's, travel to 7-Eleven, going through BMA Sculpture Gardens and Spirit of Music.	Gertrude's|BMA Sculpture Gardens|Spirit of Music|7-Eleven	2|12|3|1	path_375.png
baltimore	Go from Gertrude's to BMA Sculture Gardens to Spirit of Music to 7-Eleven	Gertrude's|BMA Sculpture Gardens|Spirit of Music|7-Eleven	2|12|3|1	path_375.png
baltimore	Walk from 7-Eleven northeast to CVS.	7-Eleven|CVS	1|9	path_118.png
baltimore	Start at 7-Eleven go northeast to CVS.	7-Eleven|CVS	1|9	path_118.png
baltimore	begin at 7-eleven and go to cvs	7-Eleven|CVS	1|9	path_118.png
baltimore	Go from Carma's Cafe to BMA Sculpture Gardens to Gertrude's	Carma's Cafe|BMA Sculpture Gardens|Gertrude's	6|12|2	path_119.png
baltimore	Walk from Carma's Cafe to BMA Sculpture Gardens, then turn right and walk to Gertrude's.	Carma's Cafe|BMA Sculpture Gardens|Gertrude's	6|12|2	path_119.png
baltimore	From Carma's Cafe head south and slightly west until you reach BMA Sculpture Garden's.  The head south west until you arrive at Gertrude's.	Carma's Cafe|BMA Sculpture Gardens|Gertrude's	6|12|2	path_119.png
baltimore	begin at the bma sculpture gardens and go to gertrude's before ending at x-578	BMA Sculpture Gardens|Gertrude's|X-578	12|2|13	path_376.png
baltimore	Start on BMA Sculpture Gardens then southwest to Gertrude's then northwest to X-578.	BMA Sculpture Gardens|Gertrude's|X-578	12|2|13	path_376.png
baltimore	Head south to Gertrude's	BMA Sculpture Gardens|Gertrude's|X-578	12|2|13	path_376.png
baltimore	Starting at Hopkins University, go to Spirit of Music, then turn left slightly and go to Daniel Gilman and stop.	Hopkins University|Spirit of Music|Daniel Gilman	10|3|5	path_120.png
baltimore	Go from Hopkins University to Spirit of Music, then to Daniel Gilman.	Hopkins University|Spirit of Music|Daniel Gilman	10|3|5	path_120.png
baltimore	Start at Hopkins University and head southwest to Spirit of Music. Once there, head southwest again to Daniel Gilman.	Hopkins University|Spirit of Music|Daniel Gilman	10|3|5	path_120.png
baltimore	Walk from Barnes & Noble to CVS, then turn around and walk back to Race Pace Bicycles, then turn right and walk to Bamboo Cafe.	Barnes & Noble|CVS|Race Pace Bicycles|Bamboo Cafe	0|9|14|7	path_122.png
baltimore	Go from Barnes & Noble to CVS to Race Pace Bicycles to Bamboo Cafe	Barnes & Noble|CVS|Race Pace Bicycles|Bamboo Cafe	0|9|14|7	path_122.png
baltimore	Starting at Barnes & Noble, travel to Bamboo Cafe, going through CVS and Race Pace Bicycles.	Barnes & Noble|CVS|Race Pace Bicycles|Bamboo Cafe	0|9|14|7	path_122.png
baltimore	Starting at Hopkins University, go to Bamboo Cafe and stop.	Hopkins University|Bamboo Cafe	10|7	path_123.png
baltimore	Walk southwest from Hopkins University to Bamboo Cafe.	Hopkins University|Bamboo Cafe	10|7	path_123.png
baltimore	begin at hopkins university and go to bamboo cafe	Hopkins University|Bamboo Cafe	10|7	path_123.png
baltimore	from the 7-eleven go to the north east to race pace bicycles and then go south east to get to barnes & noble.	7-Eleven|Race Pace Bicycles|Barnes & Noble	1|14|0	path_124.png
baltimore	Start at 7-Eleven and head northeast to Race Pace Bicycles. Once there, head east-southeast to Barnes & Noble.	7-Eleven|Race Pace Bicycles|Barnes & Noble	1|14|0	path_124.png
baltimore	Walk from 7-Eleven to Race Pace Bicycles, then turn slightly right and walk to Barnes & Noble.	7-Eleven|Race Pace Bicycles|Barnes & Noble	1|14|0	path_124.png
baltimore	from the spirit of music go south east to bamboo cafe and then turn north east to get to hopkins university. once there go north east to barnes & noble.	Spirit of Music|Bamboo Cafe|Hopkins University|Barnes & Noble	3|7|10|0	path_377.png
baltimore	Starting at Spirit of Music go southeast to Bamboo Cafe.  Once there turn northeast to Hopkins University.  At Hopkins continue northeast to Barnes & Noble.	Spirit of Music|Bamboo Cafe|Hopkins University|Barnes & Noble	3|7|10|0	path_377.png
baltimore	Starting at Spirit of Music head south and to the right. Continue straight to Bamboo Cafe. make a slightly sharp right and continue straight to Hopkins University. Veer very slightly right and continue straight and you will arrive at Barnes and Noble.	Spirit of Music|Bamboo Cafe|Hopkins University|Barnes & Noble	3|7|10|0	path_377.png
baltimore	start at x-578, and go directly up to reach 7-eleven. from 7-eleven, go down and right to get to the BMA sculpture garden.	X-578|7-Eleven|BMA Sculpture Gardens	13|1|12	path_378.png
baltimore	Go from X-578 to 7-Eleven to BMA Sculpture Gardens	X-578|7-Eleven|BMA Sculpture Gardens	13|1|12	path_378.png
baltimore	Start out at X-578, travel to 7-Eleven, and then on to BMA Sculpture Gardens.	X-578|7-Eleven|BMA Sculpture Gardens	13|1|12	path_378.png
baltimore	begin at x-578 and go to spirit of music before ending at race pace bicycles	X-578|Spirit of Music|Race Pace Bicycles	13|3|14	path_379.png
baltimore	Begin from X-578, go to Spirit of Music, and then to Race Pace Bicycles.	X-578|Spirit of Music|Race Pace Bicycles	13|3|14	path_379.png
baltimore	Walk from x-578 to Spirit of Music, then turn left and walk to Race Pace Bicycles.	X-578|Spirit of Music|Race Pace Bicycles	13|3|14	path_379.png
baltimore	Walk southeast from 7-Eleven to Spirit of Music.	7-Eleven|Spirit of Music	1|3	path_125.png
baltimore	STARTING AT SPIRIT OF MUSIC 10 OCLOCK TO 7-ELEVEN	7-Eleven|Spirit of Music	1|3	path_125.png
baltimore	Head east to spirit of music	7-Eleven|Spirit of Music	1|3	path_125.png
baltimore	Start at BMA Sculpture Gardens and travel east-southeast to Bamboo Cafe. Once there, head southwest until you reach William Welch.	BMA Sculpture Gardens|Bamboo Cafe|William Welch	12|7|4	path_381.png
baltimore	STARTING AT BMA SCULPTURE GARDENS GO RIGHT TO BAMBOO CAFE AND 7 OCLOCK TO WILLIAM WELCH	BMA Sculpture Gardens|Bamboo Cafe|William Welch	12|7|4	path_381.png
baltimore	Starting from BMA Scupture Gardens go to Bamboo Cafe then to William Welsh	BMA Sculpture Gardens|Bamboo Cafe|William Welch	12|7|4	path_381.png
baltimore	From Hopkins University go to Barnes & Noble. Then go to CVS. Next go to Race Pace Bicycles.	Hopkins University|Barnes & Noble|CVS|Race Pace Bicycles	10|0|9|14	path_126.png
baltimore	{}	Hopkins University|Barnes & Noble|CVS|Race Pace Bicycles	10|0|9|14	path_126.png
baltimore	From Hopkins University go to Barnes & Noble, then make your way to CVS, and leave CVS and go to Race Pace bicycles.	Hopkins University|Barnes & Noble|CVS|Race Pace Bicycles	10|0|9|14	path_126.png
baltimore	Starting at Hopkins University, heading south and to the left, continue straight to Bamboo cafe. Make a left and head straight to BMA Sculpture Gardens. Make a very slight left and continue straight to X-578.	Hopkins University|Bamboo Cafe|BMA Sculpture Gardens|X-578	10|7|12|13	path_382.png
baltimore	Start at Hopkin's University and head southwest to Bamboo Cafe. From there, go directly west to BMA Sculpture Gardens before traveling west-southwest to X-578.	Hopkins University|Bamboo Cafe|BMA Sculpture Gardens|X-578	10|7|12|13	path_382.png
baltimore	begin at hopkins university and go to bamboo cafe and the bma sculpture gardens before ending at x-578	Hopkins University|Bamboo Cafe|BMA Sculpture Gardens|X-578	10|7|12|13	path_382.png
baltimore	Starting at Race Pace Bicycles, travel to Bamboo Cafe, going through Hopkins University.	Race Pace Bicycles|Hopkins University|Bamboo Cafe	14|10|7	path_383.png
baltimore	starting at the race pace bicycles go south east to get to hopkins university and then go to the south west to bamboo cafe.	Race Pace Bicycles|Hopkins University|Bamboo Cafe	14|10|7	path_383.png
baltimore	STARTING AT RACE PACE BICYCLES GO 4 OCLOCK TO HOPKINS UNIVERSITY BEARING 7 OCLOCK TO BAMBOO CAFE	Race Pace Bicycles|Hopkins University|Bamboo Cafe	14|10|7	path_383.png
baltimore	Starting at The Breezeway, travel to Spirit of Music, going through Bamboo Cafe.	The Breezeway|Bamboo Cafe|Spirit of Music	11|7|3	path_384.png
baltimore	From The Breezeway go to Bamboo Cafe. Then go to Spirit of Music.	The Breezeway|Bamboo Cafe|Spirit of Music	11|7|3	path_384.png
baltimore	Walk from The Breezeway to Bamboo Cafe, then turn left and walk to Spirit of Music.	The Breezeway|Bamboo Cafe|Spirit of Music	11|7|3	path_384.png
baltimore	Starting at Gertrude's, travel to Carma's Cafe, going through, BMA Sculpture Gardens.	Gertrude's|BMA Sculpture Gardens|Carma's Cafe	2|12|6	path_129.png
baltimore	start at gertrude's, and head up in a leftward angle to reach BMA sculpture garden. from the sculpture garden, travel up almost directly and slightly left to get to carma's cafe.	Gertrude's|BMA Sculpture Gardens|Carma's Cafe	2|12|6	path_129.png
baltimore	Start at Gertrude's and go northeast to BMA Sculpture Gardens. Then go north to Carma's Cafe.	Gertrude's|BMA Sculpture Gardens|Carma's Cafe	2|12|6	path_129.png
baltimore	start at bamboo cafe, and travel down left from there to get to william welch. come back up from william welch to daniel gilman, and then come right and only slightly down until you reach the breezeway.	Bamboo Cafe|William Welch|Daniel Gilman|The Breezeway	7|4|5|11	path_130.png
baltimore	From Bamboo Cafe go to William Welch. Then go to Daniel Gilman. Next go to The Breezeway.	Bamboo Cafe|William Welch|Daniel Gilman|The Breezeway	7|4|5|11	path_130.png
baltimore	begin at bamboo cafe and go to william welch and daniel gilman before ending at the breezeway	Bamboo Cafe|William Welch|Daniel Gilman|The Breezeway	7|4|5|11	path_130.png
baltimore	Starting from 7-Eleven then to Gertrude's then finally go to Daniel Gilman	7-Eleven|Gertrude's|Daniel Gilman	1|2|5	path_385.png
baltimore	begin at 7-eleven and go to gertrude's before ending at daniel gilman	7-Eleven|Gertrude's|Daniel Gilman	1|2|5	path_385.png
baltimore	Begin at 7-11. Move down to the right to Gertrude's. Move down to the right to Daniel Gilman.	7-Eleven|Gertrude's|Daniel Gilman	1|2|5	path_385.png
baltimore	from bamboo cafe go north west to the BMA sculpture gardens and then go south west X-578.	Bamboo Cafe|BMA Sculpture Gardens|X-578	7|12|13	path_131.png
baltimore	FROM BAMBOO CAFE GO 9 OCLOCK PAST BMA SCULPTURE GARDENS ONTO X-578	Bamboo Cafe|BMA Sculpture Gardens|X-578	7|12|13	path_131.png
baltimore	We are at Bamboo Cafe, and we need to go to X-576 by way of BMA Sculpture Gardens.	Bamboo Cafe|BMA Sculpture Gardens|X-578	7|12|13	path_131.png
baltimore	Walk from 7-Eleven to Gertrude's, then turn left and walk to Spirit of Music, then turn sharply left and walk to BMA Sculpture Gardens.	7-Eleven|Gertrude's|Spirit of Music|BMA Sculpture Gardens	1|2|3|12	path_386.png
baltimore	Go from 7-Eleven to Gertrude's to Spirit of Music to BMA Sculpture Gardens	7-Eleven|Gertrude's|Spirit of Music|BMA Sculpture Gardens	1|2|3|12	path_386.png
baltimore	Start at 7-Eleven and travel southeast to Gertrude's. Once there, travel northeast to Spirit of Music before heading southwest to BMA Sculpture Gardens.	7-Eleven|Gertrude's|Spirit of Music|BMA Sculpture Gardens	1|2|3|12	path_386.png
baltimore	Leave from Bamboo Cafe and head up to Race Pace Bicycles, then head to Carma's Cafe.	Bamboo Cafe|Race Pace Bicycles|Carma's Cafe	7|14|6	path_133.png
baltimore	start at bamboo cafe, and come up in a leftward direction to race pace bicycles, and then turn directly left from there to carma's cafe.	Bamboo Cafe|Race Pace Bicycles|Carma's Cafe	7|14|6	path_133.png
baltimore	Start at Bamboo Cafe go northwest to Race Pace Bicycles.  From there travel West to Carm's Cafe.	Bamboo Cafe|Race Pace Bicycles|Carma's Cafe	7|14|6	path_133.png
baltimore	Starting at William Welch, go to BMA Sculpture Gardens and stop.	William Welch|BMA Sculpture Gardens	4|12	path_387.png
baltimore	Walk north from William Welch to BMA Sculpture Gardens.	William Welch|BMA Sculpture Gardens	4|12	path_387.png
baltimore	begin at william welch and go to the bma sculpture gardens	William Welch|BMA Sculpture Gardens	4|12	path_387.png
baltimore	starting at CVS go south east to barnes & noble and then turn around to go north west to the race pace bicycles. from there go slightly to the south west to get to carma's cafe.	CVS|Barnes & Noble|Race Pace Bicycles|Carma's Cafe	9|0|14|6	path_134.png
