map_name	utterance	trajectory	path_names	path_idxs
harvard	Go south east to Server Quadrangle, then south west to Pusey Library, then south west to Harvard Book Store, then South west to Winthrop House	Fogg Museum|Sever Quadrangle|Pusey Library|Harvard Bookstore|Winthrop House	14|4|7|12|10	path_416.png
harvard	You want to go straight from the Fogg Museum to the Sever Quadrangle.  Make a Right and go straight until you reach the Pusey Library. You Will bear right there continuing until you reach the Harvard Book store.  Bear left at the bookstore, from there it is a straight shot to the Winthrop House.	Fogg Museum|Sever Quadrangle|Pusey Library|Harvard Bookstore|Winthrop House	14|4|7|12|10	path_416.png
harvard	Start at Harvard Bookstore. Then go to Harvard Square. Then Winthrop House. End at Malkin Quad.	Harvard Bookstore|Harvard Square|Winthrop House|Malkin Quad	12|1|10|6	path_181.png
harvard	Walk from Harvard Bookstore to Harvard Square, then turn right and walk to Winthrop House, then turn sharply left and walk to Malkin Quad.	Harvard Bookstore|Harvard Square|Winthrop House|Malkin Quad	12|1|10|6	path_181.png
harvard	Starting at Harvard Bookstore, go to Harvard Square.  After that, go to Winthrop House.  Turn to end up at Malkin Quad.	Harvard Bookstore|Harvard Square|Winthrop House|Malkin Quad	12|1|10|6	path_181.png
harvard	Begin at Winthrop House and then go to Elm Yard and then Harvard Square.	Harvard Square|Elm Yard|Winthrop House	1|3|10	path_926.png
harvard	Go from Harvard Square to Elm Yard before heading to Winthrop House.	Harvard Square|Elm Yard|Winthrop House	1|3|10	path_926.png
harvard	Begin at Harvard Square, go to Elm Yard. End at Winthrop House	Harvard Square|Elm Yard|Winthrop House	1|3|10	path_926.png
harvard	Start at Tercentary Theatre. Go to Sever Quadrangle. Then Pusey Library. Then the Busch Reisinger Museum. End at the Fogg Museum.	Tercentary Theatre|Sever Quadrangle|Pusey Library|Busch-Reisinger Museum|Fogg Museum	2|4|7|9|14	path_713.png
harvard	Start at Tercentary Theatre and head up to Sever Quadrangle. Head down to Pusey Library. Head back up to Busch- Reisinger Museum and end at Fogg Museum.	Tercentary Theatre|Sever Quadrangle|Pusey Library|Busch-Reisinger Museum|Fogg Museum	2|4|7|9|14	path_713.png
harvard	Start Tercentary theatre, go north/northwest to Sever Quadrangle.  Then turn south/southwest and travel to Pusey Library.  Then turn north/northeast and goto Busch-Reisinger Museum.  Then turn west and travel to Fogg Museum.	Tercentary Theatre|Sever Quadrangle|Pusey Library|Busch-Reisinger Museum|Fogg Museum	2|4|7|9|14	path_713.png
harvard	Go from Harvard Square to Elm Yard. Then go to Pusey Library and finish at the Fogg Museum.	Harvard Square|Elm Yard|Pusey Library|Fogg Museum	1|3|7|14	path_417.png
harvard	Go from Harvard Square to Elm Yard to Pusey Library to Fogg Museum	Harvard Square|Elm Yard|Pusey Library|Fogg Museum	1|3|7|14	path_417.png
harvard	Walk from Harvard Square to Elm Yard, then turn left and walk to Pusey Library, then turn slightly right and walk to Fogg Museum.	Harvard Square|Elm Yard|Pusey Library|Fogg Museum	1|3|7|14	path_417.png
harvard	Go from Leverett Towers to Cafe Pamplona, then to Pusey Library and finally to Elm Yard.	Leverett Towers|Cafe Pamplona|Pusey Library|Elm Yard	5|11|7|3	path_927.png
harvard	Walk from Leverett Towers to Cafe Pamplona, then turn slightly right and walk to Pusey Library, then turn right and walk to Elm Yard.	Leverett Towers|Cafe Pamplona|Pusey Library|Elm Yard	5|11|7|3	path_927.png
harvard	Please go from Leverett Towers to Cafe Pamplona. From there go to Pusey Library, and then to Elm Yard.	Leverett Towers|Cafe Pamplona|Pusey Library|Elm Yard	5|11|7|3	path_927.png
harvard	From Pusey Library head west, passing by the Harvard Bookstore to get to Leverett Towers	Pusey Library|Harvard Bookstore|Leverett Towers	7|12|5	path_714.png
harvard	Go from Pusey Library to the Harvard Bookstore before going to Leverett Towers.	Pusey Library|Harvard Bookstore|Leverett Towers	7|12|5	path_714.png
harvard	Starting at Pusey Library, head southwest to Harvard Bookstore, then go straight west to Leverett Towers.	Pusey Library|Harvard Bookstore|Leverett Towers	7|12|5	path_714.png
harvard	Start at Sever Quadrangle. Go to Tercentary Theatre. Then Harvard Square. End at Malkin Quad.	Sever Quadrangle|Tercentary Theatre|Harvard Square|Malkin Quad	4|2|1|6	path_929.png
harvard	Go from Sever Quadrangle to Tercentary Theatre to Harvard Square to Malkin Quad	Sever Quadrangle|Tercentary Theatre|Harvard Square|Malkin Quad	4|2|1|6	path_929.png
harvard	Go from Sever Quadrangle to Tercentary Theatre and then to Harvard Square and finish at Malkin Quad.	Sever Quadrangle|Tercentary Theatre|Harvard Square|Malkin Quad	4|2|1|6	path_929.png
harvard	Begin at Busch-Reisinger Museum and then go to Sever Quadrangle before heading to the Tercentary Theatre, Elm Yard, Harvard Square and then Drivemint.	Busch-Reisinger Museum|Sever Quadrangle|Tercentary Theatre|Elm Yard|Harvard Square|Drivemint	9|4|2|3|1|13	path_418.png
harvard	From the Busch-Reisinger Museum, head to the Sever Quadrangle and then Tercentary Theatre. From there, proceed to Elm Yard, then Harvard Square, and finally carry on to Drivemint.	Busch-Reisinger Museum|Sever Quadrangle|Tercentary Theatre|Elm Yard|Harvard Square|Drivemint	9|4|2|3|1|13	path_418.png
harvard	Begin at Busch- Reisinger Museum, go to Sever Quadrangle, then Tercentary Theatre, then Elm Yard, then Harvard Square. End at Drivemint	Busch-Reisinger Museum|Sever Quadrangle|Tercentary Theatre|Elm Yard|Harvard Square|Drivemint	9|4|2|3|1|13	path_418.png
harvard	Walk from Harvard Square to Elm Yard, then turn right and walk to Harvard, then turn right and walk to Malkin Quad, then turn left and walk to Drivemint.	Harvard Square|Elm Yard|Harvard|Malkin Quad|Drivemint	1|3|0|6|13	path_715.png
harvard	From Harvard Square go to Elm Yard and then to Harvard. After that go to Malkin Quad and then to Drivemint.	Harvard Square|Elm Yard|Harvard|Malkin Quad|Drivemint	1|3|0|6|13	path_715.png
harvard	Beginning at Harvard Square one can move to Elm Yard. From Elm Yard they can get to Harvard. From Harvard they can get to Malkin Quad. From Malkin Quad they can arrive at Drivemint.	Harvard Square|Elm Yard|Harvard|Malkin Quad|Drivemint	1|3|0|6|13	path_715.png
harvard	From Drivemint fly northwest to Malkin Quad, then take a sharp right and continue to reach Harvard Square	Drivemint|Malkin Quad|Harvard Square	13|6|1	path_419.png
harvard	Go from Drivemint to Malkin Quad before heading to Harvard Square.	Drivemint|Malkin Quad|Harvard Square	13|6|1	path_419.png
harvard	Go from Drivemint to Malkin Quad and then to Harvard Square.	Drivemint|Malkin Quad|Harvard Square	13|6|1	path_419.png
harvard	Start at Tercentary Theatre. Go to Busch Reisinger Theatre. End at Sever Quadrangle.	Tercentary Theatre|Busch-Reisinger Museum|Sever Quadrangle	2|9|4	path_930.png
harvard	Begin at Tercentary theatre and go straight towards Busch-Reisinger museum, then make a sharp left towards sever quadrangle	Tercentary Theatre|Busch-Reisinger Museum|Sever Quadrangle	2|9|4	path_930.png
harvard	Starting at Tercentary Theatre, go north to Busch-Reisinger Museam, then southwest to Sever Quadrangle.	Tercentary Theatre|Busch-Reisinger Museum|Sever Quadrangle	2|9|4	path_930.png
harvard	Go from Winthrop House to Elm Yard before heading to Tercentary Theatre.	Winthrop House|Elm Yard|Tercentary Theatre	10|3|2	path_420.png
harvard	From the Winthrop House, travel to Elm Yard, and then up to the Tercentary Theatre.	Winthrop House|Elm Yard|Tercentary Theatre	10|3|2	path_420.png
harvard	From Winthrop House fly east to the Elm Yard, then take a left to reach Tercentary Theatre	Winthrop House|Elm Yard|Tercentary Theatre	10|3|2	path_420.png
harvard	Start Harvard go north/northwest to Elm Yard.  Once there go north/northwest to Harvard Bookstore.  Once there turn due east and travel to Torcentary Theatre.	Harvard|Elm Yard|Harvard Bookstore|Tercentary Theatre	0|3|12|2	path_931.png
harvard	From Harvard head north to Elm Yard, and then fly northwest to the Harvard Bookstore. Finally head east to Tercentary Theatre	Harvard|Elm Yard|Harvard Bookstore|Tercentary Theatre	0|3|12|2	path_931.png
harvard	Go from Harvard to Elm Yard to Harvard Bookstore to Tercentary Theatre	Harvard|Elm Yard|Harvard Bookstore|Tercentary Theatre	0|3|12|2	path_931.png
harvard	Starting at the Pusey Library, head Southeast towards the Tercentary Theater. From the Tercentary Theater, head Southwest towards Harvard, passing the Elm Yard on your right.	Pusey Library|Tercentary Theatre|Harvard	7|2|0	path_716.png
harvard	Start at Pusey Library and go to Tercentary Theatre and then to Harvard.	Pusey Library|Tercentary Theatre|Harvard	7|2|0	path_716.png
harvard	From Pusey Library go southeast to Tercentary Theatre
From Tercentary Theatre go southwest to Harvard	Pusey Library|Tercentary Theatre|Harvard	7|2|0	path_716.png
harvard	Start at Harvard and then head to Harvard Bookstore.	Harvard|Harvard Bookstore	0|12	path_182.png
harvard	Go north west to Harvard Book Store	Harvard|Harvard Bookstore	0|12	path_182.png
harvard	Begin at Harvard, then continue north west towards harvard bookstore	Harvard|Harvard Bookstore	0|12	path_182.png
harvard	Walk from Winthrop House to Malkin Wuad, then turn left and walk to Harvard Bookstore, then turn left and walk to Cafe Pamplona, then turn slightly left and walk to Leverett Towers.	Winthrop House|Malkin Quad|Harvard Bookstore|Cafe Pamplona|Leverett Towers	10|6|12|11|5	path_717.png
harvard	from winthrop house go south east to the malkin quad, from there go north east to the harvard bookstore then turn north west to go to the cafe pampiona. lastly go south west to leverett towers.	Winthrop House|Malkin Quad|Harvard Bookstore|Cafe Pamplona|Leverett Towers	10|6|12|11|5	path_717.png
harvard	Go from Winthrop House to Malkin Quad before heading to Harvard Bookstore, continue to Cafe Pamplona and finish at Leverett Towers.	Winthrop House|Malkin Quad|Harvard Bookstore|Cafe Pamplona|Leverett Towers	10|6|12|11|5	path_717.png
harvard	Begin at Sever Quadrangle, go to Fogg Museum, then Busch, Reisinger Museum, then Cafe Pampiona. End at Leverett Towers	Sever Quadrangle|Fogg Museum|Busch-Reisinger Museum|Cafe Pamplona|Leverett Towers	4|14|9|11|5	path_932.png
harvard	Begin at Sever Quadrangle and then go to the Busch-Reisinger Museum, followed by the Fogg Museum, Cafe Pomplona and Leverett Towers.	Sever Quadrangle|Fogg Museum|Busch-Reisinger Museum|Cafe Pamplona|Leverett Towers	4|14|9|11|5	path_932.png
harvard	Starting at the Server Quadrangle, go to the Fogg Museum, then go to the Leverett Towers, via Cafe Pamplona, then turn around and go to the Busch-Reisinger Museum, going by Cafe Pamplona and the Fogg Museum.	Sever Quadrangle|Fogg Museum|Busch-Reisinger Museum|Cafe Pamplona|Leverett Towers	4|14|9|11|5	path_932.png
harvard	Start at Harvard Square and go to Harvard Bookstore and then to Leverett Towers.	Harvard Square|Harvard Bookstore|Leverett Towers	1|12|5	path_183.png
harvard	Start at Harvard Square then go northwest to the Harvard Bookstore then west to Leverett Towers.	Harvard Square|Harvard Bookstore|Leverett Towers	1|12|5	path_183.png
harvard	Begin at Harvard Square, go to Harvard Bookstore. End at Leverett Towers	Harvard Square|Harvard Bookstore|Leverett Towers	1|12|5	path_183.png
harvard	Start Harvard go north/northeast to Tercentenary theatre, once there turn north/northwest to Fogg Museum bypassing Sover Quadrangle.	Harvard|Tercentary Theatre|Fogg Museum	0|2|14	path_719.png
harvard	Go straight up from Harvard to Tercentary Theatre. Now turn left from Tercentary Theatre to Fogg Museum.	Harvard|Tercentary Theatre|Fogg Museum	0|2|14	path_719.png
harvard	From Harvard head north through Tercentary Theatre to reach Fogg Museum	Harvard|Tercentary Theatre|Fogg Museum	0|2|14	path_719.png
harvard	Go from Sever Quadrangle to Pusey Library and then to Tercentary Theatre.	Sever Quadrangle|Pusey Library|Tercentary Theatre	4|7|2	path_933.png
harvard	Go from the Server Quadrangle to the Tercentary Theatre by passing the Pusey Library.	Sever Quadrangle|Pusey Library|Tercentary Theatre	4|7|2	path_933.png
harvard	From Sever Quadrangle fly southwest to Pusey Library, then take a left and head to Tercentary Theatre	Sever Quadrangle|Pusey Library|Tercentary Theatre	4|7|2	path_933.png
harvard	starting at harvard sqaure up 2 oclock to elm yard to 11 oclock harvard bookstore. stay left heading and ending at leverett flowers	Harvard Square|Elm Yard|Harvard Bookstore|Leverett Towers	1|3|12|5	path_184.png
harvard	Starting at Harvard Square, go northeast to Elm Yard, then go northwest to Harvard Bookstore, then go straight west to Leverett Towers.	Harvard Square|Elm Yard|Harvard Bookstore|Leverett Towers	1|3|12|5	path_184.png
harvard	Start at Harvard Square and go to Elm Yard and then to Harvard Bookstore before heading to Leverett Towers.	Harvard Square|Elm Yard|Harvard Bookstore|Leverett Towers	1|3|12|5	path_184.png
harvard	Go from Sever Quadrangle to Harvard Bookstore to Café Pamplona	Sever Quadrangle|Harvard Bookstore|Cafe Pamplona	4|12|11	path_720.png
harvard	Go from Sever Quadrangle to the left onto Harvard Bookstore. Go left to Cafe Pamplona.	Sever Quadrangle|Harvard Bookstore|Cafe Pamplona	4|12|11	path_720.png
harvard	Start at Sever Quadrangle. Head to Harvard Bookstore. End at Cafe Pamplona.	Sever Quadrangle|Harvard Bookstore|Cafe Pamplona	4|12|11	path_720.png
harvard	from winthrop house go up 2 oclock t passes harvard bookstore onto busch-reisinger museun	Busch-Reisinger Museum|Harvard Bookstore|Winthrop House	9|12|10	path_186.png
harvard	Head left towards the Harvard Bookstore	Busch-Reisinger Museum|Harvard Bookstore|Winthrop House	9|12|10	path_186.png
harvard	Begin at the Busch-Reisinger Museum before heading to the Harvard Bookstore and then go to Winthrop House.	Busch-Reisinger Museum|Harvard Bookstore|Winthrop House	9|12|10	path_186.png
harvard	from winthrop house go right passes harvard sqaure to harvard	Winthrop House|Harvard|Harvard Square	10|0|1	path_935.png
harvard	Starting at Winthrop House head East passing through Harvard Square until you reach Harvard.	Winthrop House|Harvard|Harvard Square	10|0|1	path_935.png
harvard	Go from Harvard to Harvard Square to Winthrop House	Winthrop House|Harvard|Harvard Square	10|0|1	path_935.png
harvard	Begin at Leveritt Towers, go to to Harvard Bookstore, then Cafe Pampiona, then Pusey Library. End at Tercentrary Theatre	Leverett Towers|Harvard Bookstore|Cafe Pamplona|Pusey Library|Tercentary Theatre	5|12|11|7|2	path_722.png
harvard	Begin at Leverett Towers go to the Harvard Bookstore, then to Cafe Pamplona, then Pusey Library and end at Tercentary Theatre.	Leverett Towers|Harvard Bookstore|Cafe Pamplona|Pusey Library|Tercentary Theatre	5|12|11|7|2	path_722.png
harvard	Go straight from Leverett Towers to Harvard Bookstore. Turn left and go to Cafe Pamplona. Turn right and go straight to Pusey Library. Finally, go to Tercentary Theatre.	Leverett Towers|Harvard Bookstore|Cafe Pamplona|Pusey Library|Tercentary Theatre	5|12|11|7|2	path_722.png
harvard	Begin at Busch- Reisinger Museum, go to Sever Quadrangle, then Elm Yard. End at Harvard	Busch-Reisinger Museum|Sever Quadrangle|Elm Yard|Harvard	9|4|3|0	path_187.png
harvard	Go south west to Server Quadrangle, then continue south west to Elm yard, the continue south east to Harvard	Busch-Reisinger Museum|Sever Quadrangle|Elm Yard|Harvard	9|4|3|0	path_187.png
harvard	Start at the Busch-Reisinger Museum then go south to Sever Quadrangle then south again to the Elm Yard then southeast to Harvard.	Busch-Reisinger Museum|Sever Quadrangle|Elm Yard|Harvard	9|4|3|0	path_187.png
harvard	From Pusey Library fly southeast to reach Tercentary Theatre	Pusey Library|Tercentary Theatre	7|2	path_937.png
harvard	Go southeast from Pusey Library to the Tercentary Theater	Pusey Library|Tercentary Theatre	7|2	path_937.png
harvard	Go from Pusey Library to Tercentary Theatre.	Pusey Library|Tercentary Theatre	7|2	path_937.png
harvard	Start at Drivemint and go to Harvard Square and then to Malkin Quad.	Drivemint|Harvard Square|Malkin Quad	13|1|6	path_421.png
harvard	Drive north from Drivemint. Once you arrive at Harvard Square, take a left, drive west until you reach Malkin Quad.	Drivemint|Harvard Square|Malkin Quad	13|1|6	path_421.png
harvard	Start at Drivemint and head slightly Northeast until you hit Harvard Square. From there head slightly Southwest until you reach Malkin Quad.	Drivemint|Harvard Square|Malkin Quad	13|1|6	path_421.png
harvard	Starting at Elm Yard, travel southwest to Harvard Sqaure. Then travel south to Drivemint.	Elm Yard|Harvard Square|Drivemint	3|1|13	path_938.png
harvard	Start at Elm Yard and go straight towards Harvard Square. Incline slightly to the left to go towards Drivemint.	Elm Yard|Harvard Square|Drivemint	3|1|13	path_938.png
harvard	Go from Elm Yard to Harvard Square and then finish at Drivemint.	Elm Yard|Harvard Square|Drivemint	3|1|13	path_938.png
harvard	from malkin quad go north east to harvard bookstore and then go north east to pusey library from there go south west to harvard square.	Malkin Quad|Harvard Bookstore|Pusey Library|Harvard Square	6|12|7|1	path_188.png
harvard	Start at Malkin Quad then go northeast to Harvard Bookstore then east to Pusey Library then south to Harvard Square.	Malkin Quad|Harvard Bookstore|Pusey Library|Harvard Square	6|12|7|1	path_188.png
harvard	Start at Malkin Quad. Go to Harvard Bookstore. Then Pusey Library. End at Harvard Square.	Malkin Quad|Harvard Bookstore|Pusey Library|Harvard Square	6|12|7|1	path_188.png
harvard	Go from Busch-Reisinger Museum to Pusey Library to Harvard Square to Drivemint	Busch-Reisinger Museum|Pusey Library|Harvard Square|Drivemint	9|7|1|13	path_423.png
harvard	Start Busch-Reisinger Museum turn south/southwest travel to Pusey Library.  Once there turn South/southwest then travel to Harvard square.  Once at harvard square continue on same heading to Drivemint.	Busch-Reisinger Museum|Pusey Library|Harvard Square|Drivemint	9|7|1|13	path_423.png
harvard	Starting at Busch-Reisinger Museum, go southwest to Pusey Library, then go south to Harvard Square and further south to Drivemint.	Busch-Reisinger Museum|Pusey Library|Harvard Square|Drivemint	9|7|1|13	path_423.png
harvard	Starting at Harvard square head east to Harvard.  At Harvard turn northwest and travel to Elm Yard.  Once at the Elm Yard continue northeast to the Tercentary Theatre.	Harvard Square|Harvard|Elm Yard|Tercentary Theatre	1|0|3|2	path_941.png
harvard	Begin at Harvard Square, go to Harvard, then Elm Yard. End at Tercentary Theatre	Harvard Square|Harvard|Elm Yard|Tercentary Theatre	1|0|3|2	path_941.png
harvard	Start at Harvard Square and then go to Harvard before heading to Elm Yard and ending at the Tercentary Theatre.	Harvard Square|Harvard|Elm Yard|Tercentary Theatre	1|0|3|2	path_941.png
harvard	from fogg museum go south east to server quadrangle. once there turn north east and go to the busch-reisinger museum. once there turn south west and go to the pusey library.	Fogg Museum|Sever Quadrangle|Busch-Reisinger Museum|Pusey Library	14|4|9|7	path_190.png
harvard	Start at the fogg museum and go to sever quadrangle then to reisinger museum and then Pusey library.	Fogg Museum|Sever Quadrangle|Busch-Reisinger Museum|Pusey Library	14|4|9|7	path_190.png
harvard	Walk from Fogg Museum to Sever Quadrangle, then turn left and walk to Busch-Reisinger Museum, then turn sharply left and walk to Pusey Library.	Fogg Museum|Sever Quadrangle|Busch-Reisinger Museum|Pusey Library	14|4|9|7	path_190.png
harvard	Go from Harvard Square to Elm Yard to Harvard Bookstore	Harvard Square|Elm Yard|Harvard Bookstore	1|3|12	path_424.png
harvard	Go from Harvard Square to Elm Yard, then go to Harvard Bookstore.	Harvard Square|Elm Yard|Harvard Bookstore	1|3|12	path_424.png
harvard	Walk from Harvard Square to Elm Yard, then turn left and walk to Harvard Bookstore.	Harvard Square|Elm Yard|Harvard Bookstore	1|3|12	path_424.png
harvard	Go from Pusey Library to Elm Yard to Harvard to Harvard Square to Drivemint	Pusey Library|Elm Yard|Harvard|Harvard Square|Drivemint	7|3|0|1|13	path_723.png
harvard	Starting from Pusey Library, go to Harvard, passing by Elm Yard.  Turn and go to Harvard Square.  Turn again and go to Drivemint.	Pusey Library|Elm Yard|Harvard|Harvard Square|Drivemint	7|3|0|1|13	path_723.png
harvard	Pusey Library to elm yard to Harvard to Harvard square to drivemint	Pusey Library|Elm Yard|Harvard|Harvard Square|Drivemint	7|3|0|1|13	path_723.png
harvard	Begin at Leverett Towers, go to Malkin Quad. End at Winthrop House	Leverett Towers|Malkin Quad|Winthrop House	5|6|10	path_426.png
harvard	From Leverett Towers fly southeast to Malkin Quad, and then northwest a little to Winthrop House	Leverett Towers|Malkin Quad|Winthrop House	5|6|10	path_426.png
harvard	Start at Leverett Towers. Go to Malkin Quad. End at Winthrop House.	Leverett Towers|Malkin Quad|Winthrop House	5|6|10	path_426.png
harvard	Just go straight to the Pusey Library from Cafe Pamplona and you are done.	Cafe Pamplona|Pusey Library	11|7	path_725.png
harvard	From Cafe Pamplona head east straight to Pusey Library	Cafe Pamplona|Pusey Library	11|7	path_725.png
harvard	Go from Café Pamplona to Pusey Library	Cafe Pamplona|Pusey Library	11|7	path_725.png
harvard	Start at Harvard Bookstore and go towards Elm Yard. Take a slight left to end at Tercentenary Theatre.	Harvard Bookstore|Elm Yard|Tercentary Theatre	12|3|2	path_428.png
harvard	Go from Harvard Bookstore to Elm Yard to Tercentary Theatre	Harvard Bookstore|Elm Yard|Tercentary Theatre	12|3|2	path_428.png
harvard	Go from Harvard Bookstore to Elm Yard before heading to Tercentary Theatre.	Harvard Bookstore|Elm Yard|Tercentary Theatre	12|3|2	path_428.png
harvard	Start at Fogg Museum go southwest to Pusey Library then west to Cafe Pamplona then west again to Leverett Towers.	Fogg Museum|Pusey Library|Cafe Pamplona|Leverett Towers	14|7|11|5	path_191.png
harvard	Start at Fogg Museum. Go to Pusey Library. Then Cafe Pamplona. End at Leverett Towers.	Fogg Museum|Pusey Library|Cafe Pamplona|Leverett Towers	14|7|11|5	path_191.png
harvard	Drive south from Fogg Museum to the Pusey LIbrary. From here, take a right and drive west. Once you reach Cafe Pamplona, drive southwest until you reach the Leverett Towers.	Fogg Museum|Pusey Library|Cafe Pamplona|Leverett Towers	14|7|11|5	path_191.png
harvard	Go to Harvard Bookstore, then the Busch-Reisinger Museum.	Pusey Library|Harvard Bookstore|Busch-Reisinger Museum	7|12|9	path_726.png
harvard	From Pusey Library go straight until you reach the Harvard Bookstore. Make a right and head straight and you will reach the Busch-Reisinger Museum.	Pusey Library|Harvard Bookstore|Busch-Reisinger Museum	7|12|9	path_726.png
harvard	Walk from Pusey Library to Harvard Bookstore, then turn sharply right and walk to Busch-Reisinger Museum.	Pusey Library|Harvard Bookstore|Busch-Reisinger Museum	7|12|9	path_726.png
harvard	Start at Drivemint and travel to Harvard Square. Once there, go to Sever Quadrangle and then on to Busch-Reisinger Museum.	Drivemint|Harvard Square|Sever Quadrangle|Busch-Reisinger Museum	13|1|4|9	path_429.png
harvard	Walk from Drivemint to Harvard Square, then turn slightly right and walk to Sever Quadrangle, then walk straight on to Busch-Reisinger Museum.	Drivemint|Harvard Square|Sever Quadrangle|Busch-Reisinger Museum	13|1|4|9	path_429.png
harvard	Go from Drivemint to Harvard Square and then to Sever Quadrangle and finally the Busch-Reisinger Museum.	Drivemint|Harvard Square|Sever Quadrangle|Busch-Reisinger Museum	13|1|4|9	path_429.png
harvard	Begin at Busch- Reisinger Museum, go to Fogg Museum. End at Sever Quadrangle	Busch-Reisinger Museum|Fogg Museum|Sever Quadrangle	9|14|4	path_942.png
harvard	Starting at Busch-Reisinger Museum, travel east to Fogg Museum, then southeast to Sever Quadrangle.	Busch-Reisinger Museum|Fogg Museum|Sever Quadrangle	9|14|4	path_942.png
harvard	Start at Busch-Reisinger Museum and go to Fogg Museum and then to Sever Quadrangle.	Busch-Reisinger Museum|Fogg Museum|Sever Quadrangle	9|14|4	path_942.png
harvard	Walk from Leverett Towers to Cafe Pamplona, then continue straight to Tercentary Theatre, then turn sharply left and walk to Pusey Library, then turn left and walk to Harvard Bookstore.	Leverett Towers|Cafe Pamplona|Tercentary Theatre|Pusey Library|Harvard Bookstore	5|11|2|7|12	path_728.png
harvard	Start at Leverett Towers t hen go east to Cafe Pamplona then east to Tercentary Theatre then west to Pusey Library then west again to Harvard Bookstore.	Leverett Towers|Cafe Pamplona|Tercentary Theatre|Pusey Library|Harvard Bookstore	5|11|2|7|12	path_728.png
harvard	From Leverett Towers head to Cafe Pamplona then over to Tercentary Theatre. After that, go to Pusey Library, then your final stop will be Harvard Bookstore.	Leverett Towers|Cafe Pamplona|Tercentary Theatre|Pusey Library|Harvard Bookstore	5|11|2|7|12	path_728.png
harvard	Go from Elm Yard to Harvard Square before heading to Harvard Bookstore and finishing at Leverett Towers.	Elm Yard|Harvard Square|Harvard Bookstore|Leverett Towers	3|1|12|5	path_430.png
harvard	Start at Elm yard and head towards Harvard Square. Turn Right at harvard Square to Harvard Bookstore. From Harvard Bookstore end at Leverett Towers.	Elm Yard|Harvard Square|Harvard Bookstore|Leverett Towers	3|1|12|5	path_430.png
harvard	Walk from Elm Yard to Harvard Square, then turn right and walk to Harvard Bookstore, then turn left and walk Leverett Towers.	Elm Yard|Harvard Square|Harvard Bookstore|Leverett Towers	3|1|12|5	path_430.png
harvard	Start at Drivemint. Go to Harvard Square. Then Pussey Library. End at Tercentary Theatre.	Drivemint|Harvard Square|Pusey Library|Tercentary Theatre	13|1|7|2	path_194.png
