map_name	utterance	trajectory	path_names	path_idxs
harvard	from the winthrop house go north east to the elm yard	Winthrop House|Elm Yard	10|3	path_125.png
harvard	Fly from Winthrop House to Elm Yard.	Winthrop House|Elm Yard	10|3	path_125.png
harvard	Begin at winthrop house and then go to elm yard	Winthrop House|Elm Yard	10|3	path_125.png
harvard	From the Harvard Bookstore go to the Tercentary Theatre, turn and go to Harvard Square by flying by Elm Yard.	Harvard Bookstore|Tercentary Theatre|Elm Yard|Harvard Square	12|2|3|1	path_869.png
harvard	Go to Tercentary Theatre.  Start from Harvard Bookstore.  Then after you have gotten there, go to Harvard Square by way of Elm Yard.	Harvard Bookstore|Tercentary Theatre|Elm Yard|Harvard Square	12|2|3|1	path_869.png
harvard	Start at the Harvard Bookstore then go to the Tercentary Theatre, followed by Elm Yard and then Harvard Square.	Harvard Bookstore|Tercentary Theatre|Elm Yard|Harvard Square	12|2|3|1	path_869.png
harvard	Go straight to Fogg Museum and take a right to Sever Quadrangle	Harvard Bookstore|Fogg Museum|Sever Quadrangle	12|14|4	path_641.png
harvard	From the Harvard Bookstore fly northeast to Fogg Museum, then take a right to reach Sever Quadrangle	Harvard Bookstore|Fogg Museum|Sever Quadrangle	12|14|4	path_641.png
harvard	Go from Harvard Bookstore to Fogg Museum to Sever Quadrangle	Harvard Bookstore|Fogg Museum|Sever Quadrangle	12|14|4	path_641.png
harvard	Walk from Harvard to Elm Yard, then turn right and walk to Tercentary Theatre.	Harvard|Elm Yard|Tercentary Theatre	0|3|2	path_126.png
harvard	Go from Harvard to Elm Yard and then to Tercentary Theatre.	Harvard|Elm Yard|Tercentary Theatre	0|3|2	path_126.png
harvard	at harvard go up 11 oclock to elm yard and up 1 oclock to tercentary theatre	Harvard|Elm Yard|Tercentary Theatre	0|3|2	path_126.png
harvard	Begin at elm yard and then go to pusey library, then to cafe pamplona and end at leverett towers	Elm Yard|Pusey Library|Cafe Pamplona|Leverett Towers	3|7|11|5	path_871.png
harvard	Start at Elm Yard.  Head to Pusey Library.  Turn right to get to Cafe Pamplona.  Then go to Leverett Towers.	Elm Yard|Pusey Library|Cafe Pamplona|Leverett Towers	3|7|11|5	path_871.png
harvard	Begin at Elm Yard and then go to Pusey Library, Cafe Pomplona, and tehn Leverett Towers.	Elm Yard|Pusey Library|Cafe Pamplona|Leverett Towers	3|7|11|5	path_871.png
harvard	I want you to turn left from Pusey Library to Harvard Bookstore.	Pusey Library|Harvard Bookstore	7|12	path_642.png
harvard	Go straight from Pusey Library to Harvard Bookstore.	Pusey Library|Harvard Bookstore	7|12	path_642.png
harvard	Start at the Pusey Library and go to the Harvard Bookstore.	Pusey Library|Harvard Bookstore	7|12	path_642.png
harvard	from malkin quad you are going to go north east to harvard and then turn north west and go to the elm yard. from there you will go north west to the harvard bookstore and lastly go directly west to the leverett towers.	Malkin Quad|Harvard|Elm Yard|Harvard Bookstore|Leverett Towers	6|0|3|12|5	path_127.png
harvard	Go from Malkin Quad to Leverett Towers, by passing Harvard, Elm Yard and Harvard Bookstore in that order.	Malkin Quad|Harvard|Elm Yard|Harvard Bookstore|Leverett Towers	6|0|3|12|5	path_127.png
harvard	Begin at Malkin Quad, go to Harvard, then Elm Yard, then Harvard Bookstore. End at Leverett Towers	Malkin Quad|Harvard|Elm Yard|Harvard Bookstore|Leverett Towers	6|0|3|12|5	path_127.png
harvard	From Harvard Bookstore fly east to Pusey Library, then turn around and head west to Cafe Pamplone, and finally keep heading west to Leverett Towers	Harvard Bookstore|Pusey Library|Cafe Pamplona|Leverett Towers	12|7|11|5	path_362.png
harvard	Walk from Harvard Bookstore to Pusey Library, then turn sharply left and walk to Cafe Pamplona, then walk straight on to Leverett Towers.	Harvard Bookstore|Pusey Library|Cafe Pamplona|Leverett Towers	12|7|11|5	path_362.png
harvard	Start at Harvard Bookstore and go to Pusey Library and then to Cafe Pamplona before heading to Leverett Towers.	Harvard Bookstore|Pusey Library|Cafe Pamplona|Leverett Towers	12|7|11|5	path_362.png
harvard	Begin at Elm Yard, go to Malkin Quad. End at Winthrop House	Elm Yard|Malkin Quad|Winthrop House	3|6|10	path_872.png
harvard	Elm Yard to Malkin Quad to Winthrop House	Elm Yard|Malkin Quad|Winthrop House	3|6|10	path_872.png
harvard	Start at Elm Yard, proceed to Malkin Quad and then turn and proceed to Winthrop House.	Elm Yard|Malkin Quad|Winthrop House	3|6|10	path_872.png
harvard	Go from Harvard Bookstore to Café Pamplona to Winthrop House to Malkin Quad	Harvard Bookstore|Cafe Pamplona|Winthrop House|Malkin Quad	12|11|10|6	path_643.png
harvard	Starting at Harvard Bookstore, go to Cafe Pamplona. Turn left and go to Winthrop House. Turn left again and go to Malkin Quad.	Harvard Bookstore|Cafe Pamplona|Winthrop House|Malkin Quad	12|11|10|6	path_643.png
harvard	Starting at Harvard Bookstore, go to Cafe Pamplona. Then, go to Winthrop House. Finally, go to Malkin Quad.	Harvard Bookstore|Cafe Pamplona|Winthrop House|Malkin Quad	12|11|10|6	path_643.png
harvard	start at tercentary theatre head down 7 oclock to elm yard and continue down to harvard sqaure	Tercentary Theatre|Elm Yard|Harvard Square	2|3|1	path_364.png
harvard	Start at Tercentary Theatre then move southwest Elm Yard then move further southwest to Harvard Square.	Tercentary Theatre|Elm Yard|Harvard Square	2|3|1	path_364.png
harvard	Begin at Tercentary Theatre, go to Elm Yard. End at Harvard Square	Tercentary Theatre|Elm Yard|Harvard Square	2|3|1	path_364.png
harvard	Start at Harvard Square, then go to Winthrup House, then to Leverett Towers.	Harvard Square|Winthrop House|Leverett Towers	1|10|5	path_644.png
harvard	Beginning at Harvard Square travel to Leverett Towers by way of Winthrop House.	Harvard Square|Winthrop House|Leverett Towers	1|10|5	path_644.png
harvard	Beginning at Harvard Square, head directly to Winthrop House. Then make a right and go to Leverett Towers.	Harvard Square|Winthrop House|Leverett Towers	1|10|5	path_644.png
harvard	Walk from Harvard Bookstore to Fogg Museum, then turn slightly right and walk to Busch-Reisinger Museum, then turn right and walk to Sever Quadrangle.	Harvard Bookstore|Fogg Museum|Busch-Reisinger Museum|Sever Quadrangle	12|14|9|4	path_128.png
harvard	Starting at Harvard Bookstore, travel northeast to Fogg Museum, then east to Busch-Reisinger Museum. Then travel southwest to Sever Quadrangle.	Harvard Bookstore|Fogg Museum|Busch-Reisinger Museum|Sever Quadrangle	12|14|9|4	path_128.png
harvard	Start at the Harvard Bookstore. Go to the Fogg Museum. Then the Busch Reisinger Museum. End at Sever Quadrangle.	Harvard Bookstore|Fogg Museum|Busch-Reisinger Museum|Sever Quadrangle	12|14|9|4	path_128.png
harvard	Start at Leverett Towers. Go to Winthrop House. End at Cafe Pamplona.	Leverett Towers|Winthrop House|Cafe Pamplona	5|10|11	path_365.png
harvard	Go to Winthrop House and then go to Cafe Pamplona.	Leverett Towers|Winthrop House|Cafe Pamplona	5|10|11	path_365.png
harvard	Go from Leverett Towers to Winthrop House and then go to Cafe Pamplona.	Leverett Towers|Winthrop House|Cafe Pamplona	5|10|11	path_365.png
harvard	Begin Tercentary Theatre, go to Harvard Square. End at Harvard	Tercentary Theatre|Harvard Square|Harvard	2|1|0	path_873.png
harvard	Go from Tercentary Theatre go southwest to Harvard Square.  From there head east to Harvard.	Tercentary Theatre|Harvard Square|Harvard	2|1|0	path_873.png
harvard	Start at the Tercentary Theatre. Go into Harvard Square and end at Harvard.	Tercentary Theatre|Harvard Square|Harvard	2|1|0	path_873.png
harvard	from harvard bookstore go directly west to leverett towers	Harvard Bookstore|Leverett Towers	12|5	path_129.png
harvard	Begin at Harvard bookstore and go left to leverett towers	Harvard Bookstore|Leverett Towers	12|5	path_129.png
harvard	Go from the Harvard Bookstore to the Leverett Towers.	Harvard Bookstore|Leverett Towers	12|5	path_129.png
harvard	Starting from Elm Yard go to Harvard Square, then make a right turn at 90 degrees and go to Harvard Bookstore.	Elm Yard|Harvard Square|Harvard Bookstore	3|1|12	path_875.png
harvard	Go from Harvard to Harvard Square to Harvard Bookstore	Elm Yard|Harvard Square|Harvard Bookstore	3|1|12	path_875.png
harvard	Start at elm yard and head straight to harvard square.  Turn right and head to harvard bookstore.	Elm Yard|Harvard Square|Harvard Bookstore	3|1|12	path_875.png
harvard	Begin at Cafe Pampiona, go to Harvard Bookstore. End at Harvard Square	Cafe Pamplona|Harvard Bookstore|Harvard Square	11|12|1	path_646.png
harvard	At Harvard, go to Cafe Pamplona. Make a stop at the bookstore next. Finally, make your way to Harvard Square.	Cafe Pamplona|Harvard Bookstore|Harvard Square	11|12|1	path_646.png
harvard	Start at Cafe Pamplona. Go to the Harvard Bookstore. End at Harvard Square.	Cafe Pamplona|Harvard Bookstore|Harvard Square	11|12|1	path_646.png
harvard	Begin at Busch- Reisinger Museum, go to Tercentary Theatre, then Elm Yard. End at Malkin Quad	Busch-Reisinger Museum|Tercentary Theatre|Elm Yard|Malkin Quad	9|2|3|6	path_368.png
harvard	Start at Bushch-Reisinger Museum and head South to Tercentary Theatre; at the Theater continue South West to Elm Yard; at Elm Yard go West to Malkin Quad.	Busch-Reisinger Museum|Tercentary Theatre|Elm Yard|Malkin Quad	9|2|3|6	path_368.png
harvard	Starting from the Busch-Reisinger Museum, go to the Tercentary Theatre, then to Elm Yard and, finally, to Malkin Quad.	Busch-Reisinger Museum|Tercentary Theatre|Elm Yard|Malkin Quad	9|2|3|6	path_368.png
harvard	Go from Leverett Towers to Cafe Pamplona and then to Tercentary Theatre	Leverett Towers|Cafe Pamplona|Tercentary Theatre	5|11|2	path_876.png
harvard	Start at Leverett Towers. Go to Cafe Pamplona, then Tercentary Theatre.	Leverett Towers|Cafe Pamplona|Tercentary Theatre	5|11|2	path_876.png
harvard	Walk from Leverett Woers to Cafe Pamplona, then straight on to Tercentary Theatre.	Leverett Towers|Cafe Pamplona|Tercentary Theatre	5|11|2	path_876.png
harvard	Walk from Busch-Reisinger Museum to Tercentary Theatre, then turn right and walk to Pusey Library.	Busch-Reisinger Museum|Tercentary Theatre|Pusey Library	9|2|7	path_370.png
harvard	Go from Busch-Reisinger Museum to Tercentary Theatre and then to Pusey Library.	Busch-Reisinger Museum|Tercentary Theatre|Pusey Library	9|2|7	path_370.png
harvard	from busch-reisinger museum go south east to tercentary theatre then go north west to pusey library.	Busch-Reisinger Museum|Tercentary Theatre|Pusey Library	9|2|7	path_370.png
harvard	Go from Elm Yard to Tercentary Theatre before heading to Pusey Library and finish at Sever Quadrangle.	Elm Yard|Tercentary Theatre|Pusey Library|Sever Quadrangle	3|2|7|4	path_130.png
harvard	Begin at Elm Yard before heading to Tercentary Theatre and then Pusey Library before ending at Sever Quadrangle.	Elm Yard|Tercentary Theatre|Pusey Library|Sever Quadrangle	3|2|7|4	path_130.png
harvard	Go from Elm Yard to Tercentary Theatre to Pusey Library to Sever Quadrangle	Elm Yard|Tercentary Theatre|Pusey Library|Sever Quadrangle	3|2|7|4	path_130.png
harvard	Depart from the Harvard Bookstore and head ENE to the Pusey Library. When you reach the Pusey Library, head SE to your destination, the elm yard.	Harvard Bookstore|Pusey Library|Elm Yard	12|7|3	path_647.png
harvard	Start at Harvard Bookstore. Go to Pusey Library. End at Elm Yard.	Harvard Bookstore|Pusey Library|Elm Yard	12|7|3	path_647.png
harvard	You will navigate away from the Harvard Bookstore in a straight line to the Pusey Library. At the library, turn and navigate a direct path to Elm Yard and you're done.	Harvard Bookstore|Pusey Library|Elm Yard	12|7|3	path_647.png
harvard	Begin at the Winthrop House before heading to Cafe Pomplona and then go to Elm Yard.	Winthrop House|Cafe Pamplona|Elm Yard	10|11|3	path_877.png
harvard	Go from Winthrop House to Cafe Pamplona before heading to Elm Yard.	Winthrop House|Cafe Pamplona|Elm Yard	10|11|3	path_877.png
harvard	Start at Winthrop House then go northeast to Cafe Pamplona then finish heading southeast to Elm Yard.	Winthrop House|Cafe Pamplona|Elm Yard	10|11|3	path_877.png
harvard	Start at the Busch-Reisinger Museum and fly to the Fogg Museum, then go to the Pusey Library and finish at the Sever Quadrangle.	Busch-Reisinger Museum|Fogg Museum|Pusey Library|Sever Quadrangle	9|14|7|4	path_648.png
harvard	From the Busch-Rasinger Museum, head west towards the Fogg Museum. Then, head south to the Pusey Library. Finally, head north east to the server quadrangle.	Busch-Reisinger Museum|Fogg Museum|Pusey Library|Sever Quadrangle	9|14|7|4	path_648.png
harvard	Go to the Fogg Museum. Make a slight left turn to head to the Pusey Library. At the Pusey Library, make a sharp left turn and go to the Sever Quadrangle.	Busch-Reisinger Museum|Fogg Museum|Pusey Library|Sever Quadrangle	9|14|7|4	path_648.png
harvard	Go from Leverett Towers to Harvard Bookstore to Fogg Museum to Sever Quadrangle	Leverett Towers|Harvard Bookstore|Fogg Museum|Sever Quadrangle	5|12|14|4	path_131.png
harvard	Walk from Leverett Towers to Harvard Bookstore, then turn slightly left and walk to Fogg Museum, then turn right and walk to Sever Quadrangle.	Leverett Towers|Harvard Bookstore|Fogg Museum|Sever Quadrangle	5|12|14|4	path_131.png
harvard	Start at Leverett Towers. Then Harvard Bookstore. Go to the Fogg Museum. End at Sever Quadrangle.	Leverett Towers|Harvard Bookstore|Fogg Museum|Sever Quadrangle	5|12|14|4	path_131.png
harvard	Walk from Fogg Museum to Elm Yard, then turn right and walk to Malkin Quad.	Fogg Museum|Elm Yard|Malkin Quad	14|3|6	path_371.png
harvard	Start at the fogg museum and head straight to elm yard.  Make a 90 degree right turn and go to malkin quad.	Fogg Museum|Elm Yard|Malkin Quad	14|3|6	path_371.png
harvard	Starting at Fogg Museum head South to Elm Yard and then head Southwest to Malkin Quad.	Fogg Museum|Elm Yard|Malkin Quad	14|3|6	path_371.png
harvard	Starting at the Busch-Reisinger Museum, a person makes their way to the Tercentary Theatre. After making it to the Tercentary Theatre, a person makes their last stop towards Harvard Square.	Busch-Reisinger Museum|Tercentary Theatre|Harvard Square	9|2|1	path_878.png
harvard	Begin at Busch- Reisinger Museum, go to Tercentary Theatre. End at Harvard Square	Busch-Reisinger Museum|Tercentary Theatre|Harvard Square	9|2|1	path_878.png
harvard	Begin at the Busch-Reisinger Museum and then go to the Tercentary Theatre and then Harvard Square.	Busch-Reisinger Museum|Tercentary Theatre|Harvard Square	9|2|1	path_878.png
harvard	Starting at Busch-Reisinger Museum, Go to Sever Quadrangle. Then, go to Harvard Bookstore. Finally, go to Malkin Quad.	Busch-Reisinger Museum|Sever Quadrangle|Harvard Bookstore|Malkin Quad	9|4|12|6	path_649.png
harvard	From Busch-Reislinger Museum, go south to Sever Quadrangle, then head west to Harvard Bookstore and finally go directly to the Malkin Quad.	Busch-Reisinger Museum|Sever Quadrangle|Harvard Bookstore|Malkin Quad	9|4|12|6	path_649.png
harvard	Starting at Busch-Reisinger Museum and ending at the Malkin Quad, fly by the Server Quadrangle and the Harvard Bookstore.	Busch-Reisinger Museum|Sever Quadrangle|Harvard Bookstore|Malkin Quad	9|4|12|6	path_649.png
harvard	Go from Elm Yard to Harvard Bookstore to Pusey Library to Harvard	Elm Yard|Harvard Bookstore|Pusey Library|Harvard	3|12|7|0	path_132.png
harvard	Start at Elm Yard, go to Harvard Bookstore, then Pusey Library. Then Elm Yard again. End at Harvard.	Elm Yard|Harvard Bookstore|Pusey Library|Harvard	3|12|7|0	path_132.png
harvard	from elm yard go north west to harvard bookstore and then go north east to pusey library, from there go south east to harvard.	Elm Yard|Harvard Bookstore|Pusey Library|Harvard	3|12|7|0	path_132.png
harvard	Start at Leverett Towers move southeast to Winthrop House then move east to Malkin Quad then southeast again to Drivemint.	Leverett Towers|Winthrop House|Malkin Quad|Drivemint	5|10|6|13	path_372.png
harvard	Start Leverelt Towers, travel south/southeast to Winthrop House.  Continue on from there and continue south/southeast to Malkie Quad.  Once there continue South/south east to Drivemint.	Leverett Towers|Winthrop House|Malkin Quad|Drivemint	5|10|6|13	path_372.png
harvard	Go from Leverett Towers to Winthrop House to Malkin Quad to Drivemint	Leverett Towers|Winthrop House|Malkin Quad|Drivemint	5|10|6|13	path_372.png
harvard	The trajectory starts at Elm Yard and travels southwest towards Harvard Square. Once at Harvard Square, it travels south to Drive Mint at the southern most part of the entire trajectory course.	Elm Yard|Harvard Square|Drivemint	3|1|13	path_879.png
harvard	Go south west to Harvard Square, then south to Drivemint	Elm Yard|Harvard Square|Drivemint	3|1|13	path_879.png
harvard	Starting in Elm Yard, travel southwest to Harvard Square. Then travel south to Drivemint.	Elm Yard|Harvard Square|Drivemint	3|1|13	path_879.png
harvard	Pusey library to fogg museum to cafe pamplona to leverett towers	Pusey Library|Fogg Museum|Cafe Pamplona|Leverett Towers	7|14|11|5	path_651.png
harvard	Pusey Library to Fogg Museum, then to Cafe Pampiona, then end in Leverett Towers.	Pusey Library|Fogg Museum|Cafe Pamplona|Leverett Towers	7|14|11|5	path_651.png
harvard	Start at Pusey Library and then go to the Fogg Museum, followed by Cafe Pomplona and then the Leverett Towers.	Pusey Library|Fogg Museum|Cafe Pamplona|Leverett Towers	7|14|11|5	path_651.png
harvard	Start at Cafe Pamplona. Move to the right and slightly down to Pusey Library. Move up and to the right to Sever Quadrangle. Go slightly up and to the right to Busch-Relsinger Museum.	Cafe Pamplona|Pusey Library|Sever Quadrangle|Busch-Reisinger Museum	11|7|4|9	path_373.png
harvard	Go from Café Pamplona to Pusey Library to Sever Quadrangle to Busch-Reisinger Museum	Cafe Pamplona|Pusey Library|Sever Quadrangle|Busch-Reisinger Museum	11|7|4|9	path_373.png
harvard	Walk from Cafe Pamplona to Pusey Library, then turn left and walk to Sever Quadrangle, then turn slightly left and walk to Busch-Reisinger Museum.	Cafe Pamplona|Pusey Library|Sever Quadrangle|Busch-Reisinger Museum	11|7|4|9	path_373.png
harvard	From Server Quadrangle go Northwest to the Fogg Museum, then make a sharp left turn and go to the Tercentary Theatre.	Sever Quadrangle|Fogg Museum|Tercentary Theatre	4|14|2	path_133.png
harvard	Go from Sever Quadrangle to Fogg Museum to Tercentary Theatre	Sever Quadrangle|Fogg Museum|Tercentary Theatre	4|14|2	path_133.png
harvard	Starting at Sever Quadrangle, go northwest to Fogg Museum, then go southeast to Tercentary Theatre.	Sever Quadrangle|Fogg Museum|Tercentary Theatre	4|14|2	path_133.png
harvard	From Busch-Reisinger Museum fly southwestish to Elm Yard, and then northeast to Tercentary Theatre	Busch-Reisinger Museum|Elm Yard|Tercentary Theatre	9|3|2	path_880.png
harvard	start Busch Roisinger Museum go south/southwest bypassing Server Quadrangle to Elm yard.  Once there turn North/northeast then goto Tercentary Theatre.	Busch-Reisinger Museum|Elm Yard|Tercentary Theatre	9|3|2	path_880.png
harvard	Start at the Busch-Reisinger Museum and go to Elm Yard, then proceed to the Tercentary Theatre.	Busch-Reisinger Museum|Elm Yard|Tercentary Theatre	9|3|2	path_880.png
harvard	Begin at Elm Yard and continue towards Harvard Square	Elm Yard|Harvard Square	3|1	path_134.png
harvard	Walk from Elm Street to Harvard Square.	Elm Yard|Harvard Square	3|1	path_134.png
harvard	Please go from Elm Yard to Harvard Square.	Elm Yard|Harvard Square	3|1	path_134.png
harvard	At the start go from Harvard Square to Elm Yard. Keep going to Tercentary Theatre. Keep going until you get to the Busch-Reisinger Museum.	Harvard Square|Elm Yard|Tercentary Theatre|Busch-Reisinger Museum	1|3|2|9	path_374.png
harvard	Go from Harvard Square to Elm Yard to Tercentary Theatre to Busch-Reisinger Museum	Harvard Square|Elm Yard|Tercentary Theatre|Busch-Reisinger Museum	1|3|2|9	path_374.png
harvard	Walk from Harvard Square to Elm Yard, then straight on to Tercentary Theatre, then turn slightly left and walk to Busch-Reisinger Museum.	Harvard Square|Elm Yard|Tercentary Theatre|Busch-Reisinger Museum	1|3|2|9	path_374.png
harvard	left then straight	Harvard Bookstore|Winthrop House|Malkin Quad	12|10|6	path_881.png
harvard	Start at the Harvard Bookstore then go southwest to the Winthrop House then southeast to Malkin Quad.	Harvard Bookstore|Winthrop House|Malkin Quad	12|10|6	path_881.png
harvard	Start at Havard Bookstore and travel to Winthrop House. From there continue travel to Malkin Quad.	Harvard Bookstore|Winthrop House|Malkin Quad	12|10|6	path_881.png
harvard	Start at Busch-Reisinger Museum and go to Fogg Museum and then to Harvard Bookstore.	Busch-Reisinger Museum|Fogg Museum|Harvard Bookstore	9|14|12	path_375.png
harvard	start at busch-reisinger head left to fogg museum and downward 7 oclock to harvard bookstore	Busch-Reisinger Museum|Fogg Museum|Harvard Bookstore	9|14|12	path_375.png
harvard	Start at Busch Reisinger Museum. Go to Fogg Museum. End at Harvard Bookstore.	Busch-Reisinger Museum|Fogg Museum|Harvard Bookstore	9|14|12	path_375.png
harvard	From Tercentary Theatre, go to Elm Yard and then Malkin Quad.	Tercentary Theatre|Elm Yard|Malkin Quad	2|3|6	path_652.png
harvard	From Tercentary Theatre fly southwest to Elm Yard, and then in a west-southwest direction to Malkin Quad	Tercentary Theatre|Elm Yard|Malkin Quad	2|3|6	path_652.png
harvard	Start the Tercentary Theatre then go southwest to Elm Yard then southwest again to the Malkin Quad.	Tercentary Theatre|Elm Yard|Malkin Quad	2|3|6	path_652.png
harvard	From Fogg Museum fly south to Pusey Library, and then west to the Harvard Bookstore. Finally fly southwest to Winthrop House	Fogg Museum|Pusey Library|Harvard Bookstore|Winthrop House	14|7|12|10	path_135.png
harvard	Fogg Museum to Pusey Library to Harvard Bookstore to Winthrop House	Fogg Museum|Pusey Library|Harvard Bookstore|Winthrop House	14|7|12|10	path_135.png
harvard	Begin at Fogg Museum, go to Pusey Library, then Harvard Bookstore. End at Winthrop House	Fogg Museum|Pusey Library|Harvard Bookstore|Winthrop House	14|7|12|10	path_135.png
harvard	Start at Elm Yard goto Harvard Square then finish at Malkin Quad.	Elm Yard|Harvard Square|Malkin Quad	3|1|6	path_882.png
harvard	Begin at Elm Yard, go to Harvard Square, and end at Malkin Quad.	Elm Yard|Harvard Square|Malkin Quad	3|1|6	path_882.png
harvard	Start at Elm Yard. Go to Harvard Square. End at Malkin Quad.	Elm Yard|Harvard Square|Malkin Quad	3|1|6	path_882.png
harvard	Begin at the Fogg Museum and then go to the Tercentary Theatre.	Fogg Museum|Tercentary Theatre	14|2	path_376.png
harvard	starting at fogg museum down 5 oclock to end at tercentary theatre	Fogg Museum|Tercentary Theatre	14|2	path_376.png
harvard	Walk from Fogg Museum southeast to Tercentary Theatre.	Fogg Museum|Tercentary Theatre	14|2	path_376.png
harvard	Start at Cafe Pamplona and go to Pusey Library and then to Tercentary Theatre.	Cafe Pamplona|Pusey Library|Tercentary Theatre	11|7|2	path_884.png
harvard	Walk from Cafe Pamplona to Pusey Library, then turn slightly right and walk to Tercentary Theatre.	Cafe Pamplona|Pusey Library|Tercentary Theatre	11|7|2	path_884.png
harvard	from cafe pampino  go south east to pusey library and then go south east to the tercentary theatre	Cafe Pamplona|Pusey Library|Tercentary Theatre	11|7|2	path_884.png
harvard	Begin at Drivemint, got to Malkin Quad, then Harvard Square. End at Winthrop House	Drivemint|Malkin Quad|Harvard Square|Winthrop House	13|6|1|10	path_136.png
harvard	Go from Drivemint to Malkin Quad to Harvard Square to Winthrop House	Drivemint|Malkin Quad|Harvard Square|Winthrop House	13|6|1|10	path_136.png
harvard	Drivemint to malkin quad to Harvard sqaure to Winthrop house	Drivemint|Malkin Quad|Harvard Square|Winthrop House	13|6|1|10	path_136.png
harvard	Walk from Malkin Quad to Elm Yard, then turn sharply right and walk to Harvard Square, then turn left and walk to Drivemint.	Malkin Quad|Elm Yard|Harvard Square|Drivemint	6|3|1|13	path_886.png
harvard	from malkin quad go north east to the elm yard and then turn south west to go to harvard square. then go south west to drivemint.	Malkin Quad|Elm Yard|Harvard Square|Drivemint	6|3|1|13	path_886.png
harvard	Start at Malkin Quad and then go to Elm Yard, Harvard Sqaure, and then Drivemint.	Malkin Quad|Elm Yard|Harvard Square|Drivemint	6|3|1|13	path_886.png
harvard	Start at the Harvard Bookstore. End at the Busch Reisinger Museum.	Harvard Bookstore|Busch-Reisinger Museum	12|9	path_377.png
harvard	Begin at Harvard Bookstore End at Busch- Reisinger Museum	Harvard Bookstore|Busch-Reisinger Museum	12|9	path_377.png
harvard	Harvard bookstore to reisinger museum.	Harvard Bookstore|Busch-Reisinger Museum	12|9	path_377.png
harvard	From Pusey Library fly northeast to Fogg Museum, and then head southeast to Tercentary Theatre	Pusey Library|Fogg Museum|Tercentary Theatre	7|14|2	path_137.png
harvard	From Pusey Library head up to Fogg Museum then down to Tercentary Theatre.	Pusey Library|Fogg Museum|Tercentary Theatre	7|14|2	path_137.png
harvard	Go from Pusey Library to Fogg Museum before heading to Tercentary Theatre.	Pusey Library|Fogg Museum|Tercentary Theatre	7|14|2	path_137.png
harvard	Start at Pusey Library then move southeast to Elm Yard then finish going southwest to Harvard Square.	Pusey Library|Elm Yard|Harvard Square	7|3|1	path_378.png
harvard	Go right from Pusey Library to Elms Yard. Now go from there to Harvard Square.	Pusey Library|Elm Yard|Harvard Square	7|3|1	path_378.png
harvard	Go from Pusey Library to Elm Yard and then to Harvard Square.	Pusey Library|Elm Yard|Harvard Square	7|3|1	path_378.png
harvard	Begin at the Wintrhop House and then go to Malkin Quad before heading to the Harvard Bookstore and ending at the Pusey Library.	Winthrop House|Malkin Quad|Harvard Bookstore|Pusey Library	10|6|12|7	path_138.png
