map_name	utterance	trajectory	path_names	path_idxs
harvard	Tercentenary Theater to Harvard Square to Malkin Quad.	Tercentary Theatre|Harvard Square|Malkin Quad	2|1|6	path_571.png
harvard	From Tercentary Theatre go to Harvard Square and then to Malkin Quad.	Tercentary Theatre|Harvard Square|Malkin Quad	2|1|6	path_571.png
harvard	Begin at leverett towers then go right to harvard bookstore, then continue to pusey library	Leverett Towers|Harvard Bookstore|Pusey Library	5|12|7	path_304.png
harvard	Begin at Leverett Towers, go to Harvard Bookstore. End at Pusey Library	Leverett Towers|Harvard Bookstore|Pusey Library	5|12|7	path_304.png
harvard	Start at Leverell Towers to Harvard Bookstore. End at Pusey Library.	Leverett Towers|Harvard Bookstore|Pusey Library	5|12|7	path_304.png
harvard	Go west from Elm Yard to Harvard Bookstore to Cafe Pamplona to Leverlt Towers	Elm Yard|Cafe Pamplona|Leverett Towers	3|11|5	path_69.png
harvard	yard to tower via bookstore then cafe	Elm Yard|Cafe Pamplona|Leverett Towers	3|11|5	path_69.png
harvard	Starting at Elm Yard, go northwest toward Cafe Pamplona, then go southwest to Leverett Towers.	Elm Yard|Cafe Pamplona|Leverett Towers	3|11|5	path_69.png
harvard	From Winthrop House fly northeast past Harvard Bookstore and Sever Quadrangle to reach Busch-Reisinger Museum	Winthrop House|Harvard Bookstore|Sever Quadrangle|Busch-Reisinger Museum	10|12|4|9	path_809.png
harvard	winthrop to museum via bookstore then quad	Winthrop House|Harvard Bookstore|Sever Quadrangle|Busch-Reisinger Museum	10|12|4|9	path_809.png
harvard	Winthrop house to Harvard bookstore to sever quadrangle to reisinger museum	Winthrop House|Harvard Bookstore|Sever Quadrangle|Busch-Reisinger Museum	10|12|4|9	path_809.png
harvard	Go from Pusey Library to Harvard Bookstore and then to Harvard Square.	Pusey Library|Harvard Bookstore|Harvard Square	7|12|1	path_307.png
harvard	Starting at Pusey Library a person makes their way to the Harvard Bookstore, then from the Harvard Bookstore the person makes their way to Harvard Square.	Pusey Library|Harvard Bookstore|Harvard Square	7|12|1	path_307.png
harvard	From Pusey Library go to Harvard Bookstore and then to Harvard Square.	Pusey Library|Harvard Bookstore|Harvard Square	7|12|1	path_307.png
harvard	Start in Harvard Square facing North. Head Northeast until you get to Elm Yard. At Elm Yard head Southeast until you reach Harvard.	Harvard Square|Elm Yard|Harvard	1|3|0	path_71.png
harvard	Go from Harvard Square to Elm Yard before heading to Harvard.	Harvard Square|Elm Yard|Harvard	1|3|0	path_71.png
harvard	From Harvard Square go northeast to Elm Yard, and then southeast to Harvard	Harvard Square|Elm Yard|Harvard	1|3|0	path_71.png
harvard	Start at Busch-Reisinger Museum and head to Tercentary Theatre. Next, go directly to Harvard Square without passing through Elm Yard. Afterwards, go to Drivemint.	Busch-Reisinger Museum|Tercentary Theatre|Harvard Square|Drivemint	9|2|1|13	path_810.png
harvard	Go down from Busch-Reisinger Museum to Tercentary Theatre. Now go from there to Harvard Square. Go from there to Drivemint.	Busch-Reisinger Museum|Tercentary Theatre|Harvard Square|Drivemint	9|2|1|13	path_810.png
harvard	From Busch-Reisinger Museum go to Tercentary Theatre. Continue to Harvard Square and end at Drivemint.	Busch-Reisinger Museum|Tercentary Theatre|Harvard Square|Drivemint	9|2|1|13	path_810.png
harvard	Start at Cafe Pamplona and go just south of east until you get to Pusey Library. Next, go just east of south and you will arrive at Elm Yard.	Cafe Pamplona|Pusey Library|Elm Yard	11|7|3	path_309.png
harvard	Begin at Cafe Pampiona, go to Pusey Library. End at Elm Yard	Cafe Pamplona|Pusey Library|Elm Yard	11|7|3	path_309.png
harvard	Start at Cafe Pamplona and go to Pusey Library then go to Elm Yard.	Cafe Pamplona|Pusey Library|Elm Yard	11|7|3	path_309.png
harvard	Start at the Malkin Quad and fly to Elm Yard, then proceed to the Harvard Bookstore and Cafe Pamplona. Finish at Leverett Towers.	Malkin Quad|Elm Yard|Harvard Bookstore|Cafe Pamplona|Leverett Towers	6|3|12|11|5	path_310.png
harvard	Begin at Malkin Quad, go to Elm Yard, then Harvard Bookstore, then Cafe Pampiona. End at Leverett Towers	Malkin Quad|Elm Yard|Harvard Bookstore|Cafe Pamplona|Leverett Towers	6|3|12|11|5	path_310.png
harvard	turn right twice	Malkin Quad|Elm Yard|Harvard Bookstore|Cafe Pamplona|Leverett Towers	6|3|12|11|5	path_310.png
harvard	Walk from Sever Quadrangle to Fogg Museum, then turn right and walk to Busch-Reisinger Museum.	Sever Quadrangle|Fogg Museum|Busch-Reisinger Museum	4|14|9	path_72.png
harvard	Start at the Sever Quadrangle then go to the Fogg Museum and end at the Busch-Reisinger Museum.	Sever Quadrangle|Fogg Museum|Busch-Reisinger Museum	4|14|9	path_72.png
harvard	Go from Sever Quadrangle to Fogg Museum to Busch-Reisinger Museum	Sever Quadrangle|Fogg Museum|Busch-Reisinger Museum	4|14|9	path_72.png
harvard	From Drivemint head up to Harvard Square, then go over to Harvard Bookstore.	Drivemint|Harvard Square|Harvard Bookstore	13|1|12	path_572.png
harvard	From Drivemint travel to Harvard Square and then to Harvard Bookstore.	Drivemint|Harvard Square|Harvard Bookstore	13|1|12	path_572.png
harvard	Start at Drivemint. Head up into Harvard Square. End at the Harvard Bookstore.	Drivemint|Harvard Square|Harvard Bookstore	13|1|12	path_572.png
harvard	Go from the Server Quardrangle to the Tercentary Theatre.	Sever Quadrangle|Tercentary Theatre	4|2	path_812.png
harvard	From Sever Quadrangle go south to Tercentary Theatre	Sever Quadrangle|Tercentary Theatre	4|2	path_812.png
harvard	Walk from Sever Quadrangle to Tercentary Theatre.	Sever Quadrangle|Tercentary Theatre	4|2	path_812.png
harvard	Starting at Harvard Bookstore, go to Pusey Library.	Harvard Bookstore|Pusey Library	12|7	path_73.png
harvard	Travel east-northeast from Harvard Bookstore to Pusey Library.	Harvard Bookstore|Pusey Library	12|7	path_73.png
harvard	From the Hravared Bookstore, head east towards the Pusey Library	Harvard Bookstore|Pusey Library	12|7	path_73.png
harvard	Start at Busch-Reisinger Museum, then go to Sever Quadrangle, then go to Pusey Library, then go to Harvard Bookstore, then finally to Leverett Towers.	Busch-Reisinger Museum|Sever Quadrangle|Pusey Library|Harvard Bookstore|Leverett Towers	9|4|7|12|5	path_312.png
harvard	Go from Busch-Reisinger Museum to Sever Quadrangle to Pusey Library to Harvard Bookstore to Leverett Towers	Busch-Reisinger Museum|Sever Quadrangle|Pusey Library|Harvard Bookstore|Leverett Towers	9|4|7|12|5	path_312.png
harvard	start at the busch-reisinger museum and then go to the sever quadrangle before the pusey library, the harvard bookstore and ending at leverett towers.	Busch-Reisinger Museum|Sever Quadrangle|Pusey Library|Harvard Bookstore|Leverett Towers	9|4|7|12|5	path_312.png
harvard	Start at Malkin Quad and end at Harvard Square.	Malkin Quad|Harvard Square	6|1	path_573.png
harvard	TO get from Malkin quad to harvard square proceed right on malkin Quad at a slight 10 degree angle.	Malkin Quad|Harvard Square	6|1	path_573.png
harvard	Move from Malkin Quad towards Harvard Square.	Malkin Quad|Harvard Square	6|1	path_573.png
harvard	Go to the Elm Yard directly from Tercentary Theatre.	Tercentary Theatre|Elm Yard	2|3	path_813.png
harvard	Starting from the Tercentary Theatre, head straight to the Elm Yard.	Tercentary Theatre|Elm Yard	2|3	path_813.png
harvard	Start at Tercentary Theatre then goto Elm Yard	Tercentary Theatre|Elm Yard	2|3	path_813.png
harvard	From Busch-Reisinger Museum, fly past the Harvard Bookstore to Malkin Quad	Busch-Reisinger Museum|Harvard Bookstore|Malkin Quad	9|12|6	path_75.png
harvard	Walk from Busch-Reisinger Museum to Harvard Bookstore, then straight on to Malkin Quad.	Busch-Reisinger Museum|Harvard Bookstore|Malkin Quad	9|12|6	path_75.png
harvard	Begin at Busch-Reisinger Museum, then go to Harvard Bookstore and then Malkin Quad.	Busch-Reisinger Museum|Harvard Bookstore|Malkin Quad	9|12|6	path_75.png
harvard	Start at Drivemint. Go to Malkin Quad. Then to the Winthrop House. End at Harvard Square.	Drivemint|Malkin Quad|Winthrop House|Harvard Square	13|6|10|1	path_574.png
harvard	Starting in Drivemint, go through Malkin Quad until you reach the Winthrop House. At the Winthrop House, take a sharp right and continue until you reach Harvard Square.	Drivemint|Malkin Quad|Winthrop House|Harvard Square	13|6|10|1	path_574.png
harvard	Start at Drivemint and head to Malkin Quad. Then head to Winthrop House. After that, end to Harvard Square.	Drivemint|Malkin Quad|Winthrop House|Harvard Square	13|6|10|1	path_574.png
harvard	Leave Leverette Square and go to Malkin Quad, then go past Harvard Square to Harvard.	Leverett Towers|Malkin Quad|Harvard	5|6|0	path_313.png
harvard	From Leverett Towers head southeast to Malkin Quad, and then go east to Harvard	Leverett Towers|Malkin Quad|Harvard	5|6|0	path_313.png
harvard	Start at Leverett Towers and go to Malkin Quad and then to Harvard.	Leverett Towers|Malkin Quad|Harvard	5|6|0	path_313.png
harvard	From Leverett Towers fly by Cafe Pamplona, and finally arrive at Pusey Library	Leverett Towers|Cafe Pamplona|Pusey Library	5|11|7	path_814.png
harvard	Starting at the Leverett Towers, a person makes their way towards Cafe Pamplona. After making it to Cafe Pamplona, a person makes their last stop towards Pusey Library.	Leverett Towers|Cafe Pamplona|Pusey Library	5|11|7	path_814.png
harvard	Begin at Leverett Towers, go to Cafe Pampiona. End at Pusey Library	Leverett Towers|Cafe Pamplona|Pusey Library	5|11|7	path_814.png
harvard	Go from Elm Yard to Harvard to Harvard Square	Elm Yard|Harvard|Harvard Square	3|0|1	path_315.png
harvard	Travel from Elm Yard to Harvard and then turn to go to Harvard Square.	Elm Yard|Harvard|Harvard Square	3|0|1	path_315.png
harvard	Start at Elm Yard. Head into Harvard, then end at Harvard Square.	Elm Yard|Harvard|Harvard Square	3|0|1	path_315.png
harvard	From Tercentary Theatre, travel to Elm Yard and then to Harvard.	Tercentary Theatre|Elm Yard|Harvard	2|3|0	path_575.png
harvard	Tercentary Theatre to Elm Yard to Harvard	Tercentary Theatre|Elm Yard|Harvard	2|3|0	path_575.png
harvard	Travel south west to Elm Yard. Then turn left to Harvard.	Tercentary Theatre|Elm Yard|Harvard	2|3|0	path_575.png
harvard	Go from Leverett Towers to the Harvard Bookstore, then pass by Tercentary Theatre to make it to Elm Yard	Leverett Towers|Harvard Bookstore|Tercentary Theatre|Elm Yard	5|12|2|3	path_76.png
harvard	Begin at Leverett Towers, go to Harvard Bookstore, then Tercentary Theatre. End at Elm Yard	Leverett Towers|Harvard Bookstore|Tercentary Theatre|Elm Yard	5|12|2|3	path_76.png
harvard	From Leverett Towers go to Harvard Bookstore, to Tercentary Theatre, and then to Elm Yard.	Leverett Towers|Harvard Bookstore|Tercentary Theatre|Elm Yard	5|12|2|3	path_76.png
harvard	Start at Winthrop House.
Go straight to Harvard Bookstore.
Go straight to Fogg Museum. 
Go right to Busch-Reisinger Museum.	Busch-Reisinger Museum|Fogg Museum|Harvard Bookstore|Winthrop House	9|14|12|10	path_576.png
harvard	Beginning at the Busch Reisinger Museum, head to the Fogg Museaum. Then continue to the Harvard Bookstore. End at the Winthrop House.	Busch-Reisinger Museum|Fogg Museum|Harvard Bookstore|Winthrop House	9|14|12|10	path_576.png
harvard	Start Busch-Roisinger Museum go west to Fogg Museum, once there travel South/southwest to Harvard BookStore.  Once there travel south/southwest to Winthrop house.	Busch-Reisinger Museum|Fogg Museum|Harvard Bookstore|Winthrop House	9|14|12|10	path_576.png
harvard	quad to winthrop	Sever Quadrangle|Harvard Bookstore|Winthrop House	4|12|10	path_816.png
harvard	Go from Sever Quadrangle to Harvard Bookstore to Winthrop House	Sever Quadrangle|Harvard Bookstore|Winthrop House	4|12|10	path_816.png
harvard	Sever quadrangle to Harvard bookstore to Winthrop House	Sever Quadrangle|Harvard Bookstore|Winthrop House	4|12|10	path_816.png
harvard	Go from Elms Yard to Tercentary Theatre. Now go from Tercentary Theatre to Cafe Pamalona.	Elm Yard|Tercentary Theatre|Cafe Pamplona	3|2|11	path_316.png
harvard	Begin at Elm Yard before going to the Tercentary Theatre and then Cafe Pomplona.	Elm Yard|Tercentary Theatre|Cafe Pamplona	3|2|11	path_316.png
harvard	You should go from Elm Yard to the Tercentary Theatre and after we will meet you at Cafe Pamplona.	Elm Yard|Tercentary Theatre|Cafe Pamplona	3|2|11	path_316.png
harvard	From Busch-Resinger Museum head Southwest to Harvard Bookstore. Then continue in same direction to Malkin Quad.	Busch-Reisinger Museum|Harvard Bookstore|Malkin Quad	9|12|6	path_317.png
harvard	busch-r musem to quad by-way of bookstore	Busch-Reisinger Museum|Harvard Bookstore|Malkin Quad	9|12|6	path_317.png
harvard	Proceed from the Busch-Reisinger Museum going by the Harvard Bookstore and to finish at the Malkin Quad.	Busch-Reisinger Museum|Harvard Bookstore|Malkin Quad	9|12|6	path_317.png
harvard	Begin at Harvard, then go to Elm Yard, followed by Tercentary Theatre and then Pusey Library.	Harvard|Pusey Library|Tercentary Theatre|Elm Yard	0|7|2|3	path_77.png
harvard	Go from Harvard to Pusey Library. Now from there to Tercentary Theatre. Now from there to Elms Yard.	Harvard|Pusey Library|Tercentary Theatre|Elm Yard	0|7|2|3	path_77.png
harvard	Walk from Harvard to Pusey Library, then turn right and walk to Tercentary Theatre, then turn right and walk to Elm Yard.	Harvard|Pusey Library|Tercentary Theatre|Elm Yard	0|7|2|3	path_77.png
harvard	Start at Malkin Quad. End at the Harvard Bookstore.	Malkin Quad|Harvard Bookstore	6|12	path_577.png
harvard	Traverse from Malkim Quad to the Harvard Bookstore	Malkin Quad|Harvard Bookstore	6|12	path_577.png
harvard	Begin at Malkin Quad. End at Harvard Bookstore	Malkin Quad|Harvard Bookstore	6|12	path_577.png
harvard	Start at Drivemint. Go due north to Harvard Square then northeast to Elm Yard. From there, go north and slightly west to Pusey Library. Finish by going northeast to Sever Quadrangle.	Drivemint|Harvard Square|Elm Yard|Pusey Library|Sever Quadrangle	13|1|3|7|4	path_79.png
harvard	Start at Drivemint and go to Harvard Square. From there go to Elm Yard and then move on to Pusey Library. Finally move to Sever Quadrangle.	Drivemint|Harvard Square|Elm Yard|Pusey Library|Sever Quadrangle	13|1|3|7|4	path_79.png
harvard	Starting at Drivemint, go north to Harvard Square, then go northeast to Elm Yard, then go northwest to Pusey Library, then go northeast to Sever Quadrangle.	Drivemint|Harvard Square|Elm Yard|Pusey Library|Sever Quadrangle	13|1|3|7|4	path_79.png
harvard	Walk from Elm Yard to Winthrop House, then turn sharply left and walk to Malkin Quad, then straight on to Drivemint.	Elm Yard|Winthrop House|Malkin Quad|Drivemint	3|10|6|13	path_318.png
harvard	From Elm Yard fly west to Winthrop House and then fly southeast past Malkin Quad to make it to Drivemint	Elm Yard|Winthrop House|Malkin Quad|Drivemint	3|10|6|13	path_318.png
harvard	Start at Elm Yard, then go west to Winthrup House, then down to Malkin Quad, then finally down to Drivemint.	Elm Yard|Winthrop House|Malkin Quad|Drivemint	3|10|6|13	path_318.png
harvard	Start Winthrop House then go north/northeast to Harvard Bookstore.  At the bookstore turn east/northeast and go to the Pusey Library.  Once there turn north/northeast and continue on to Fogg Museum.	Winthrop House|Harvard Bookstore|Pusey Library|Fogg Museum	10|12|7|14	path_817.png
harvard	Go from the Winthrop House to the Harvard Bookstore, then proceed to the Pusey Library and then go to the Fogg Museum.	Winthrop House|Harvard Bookstore|Pusey Library|Fogg Museum	10|12|7|14	path_817.png
harvard	Start at Winthrop House. Go to Harvard Bookstore. Then Pusey Library. End at Fogg Museum.	Winthrop House|Harvard Bookstore|Pusey Library|Fogg Museum	10|12|7|14	path_817.png
harvard	Walk from Harvard Square to Harvard Bookstore, then turn left and walk to Leverett Towers.	Harvard Square|Harvard Bookstore|Leverett Towers	1|12|5	path_578.png
harvard	From Harvard Square, head northwest to the Harvard Bookstore. From the Harvard Bookstore, head due west until you arrive at Leverett Towers.	Harvard Square|Harvard Bookstore|Leverett Towers	1|12|5	path_578.png
harvard	Start at Harvard Square and go to Harvard Bookstore and continue to Leverett Towers.	Harvard Square|Harvard Bookstore|Leverett Towers	1|12|5	path_578.png
harvard	Go from the Harvard Bookstore to Elm Yard.	Harvard Bookstore|Elm Yard	12|3	path_319.png
harvard	Start at Harvard Bookstore. End down at Elm Yard.	Harvard Bookstore|Elm Yard	12|3	path_319.png
harvard	Harvard Bookstore to Elm Yard	Harvard Bookstore|Elm Yard	12|3	path_319.png
harvard	Starting at Elm Yard, a person makes their way to Harvard Square. After making it to Harvard Square, a person makes their way to the Tercentary Theatre.	Elm Yard|Harvard Square|Tercentary Theatre	3|1|2	path_80.png
harvard	Start at Elm Yard, and then go to Harvard Square followed by the Tercentary Theatre.	Elm Yard|Harvard Square|Tercentary Theatre	3|1|2	path_80.png
harvard	Go from Elm Yard to Harvard Square, turn around and go to Tercentary Theatre by going by Elm Yard.	Elm Yard|Harvard Square|Tercentary Theatre	3|1|2	path_80.png
harvard	go north east from the Elm Yard to the Harvard book store. once there turn south west and go to the Malkin Quad	Elm Yard|Harvard Bookstore|Malkin Quad	3|12|6	path_579.png
harvard	Begin at Elm Yard, go to Harvard Bookstore. End at Malkin Quad	Elm Yard|Harvard Bookstore|Malkin Quad	3|12|6	path_579.png
harvard	Go from Elm Yard to Harvard Bookstore to Malkin Quad	Elm Yard|Harvard Bookstore|Malkin Quad	3|12|6	path_579.png
harvard	At Drivemint go to Harvard Square, turn and go to the Server Quadrangle, then go to the Busch Reisinger Museum and then go to the Fogg Museum.	Drivemint|Harvard Square|Sever Quadrangle|Busch-Reisinger Museum|Fogg Museum	13|1|4|9|14	path_818.png
harvard	Go north east to Harvard Square, then east to Sever Quaddrangle, then north east to Busch-Reisinger Museum, then west to Fogg Museum	Drivemint|Harvard Square|Sever Quadrangle|Busch-Reisinger Museum|Fogg Museum	13|1|4|9|14	path_818.png
harvard	Start at Drivemint, go north to Harvard Square, then go northeast to Sever Quadrangle. After that, keep going northeast and stop at Busch-Reisinger Museum. Then go west to Fogg Museum.	Drivemint|Harvard Square|Sever Quadrangle|Busch-Reisinger Museum|Fogg Museum	13|1|4|9|14	path_818.png
harvard	From Harvard just go straight to Harvard Square	Harvard|Harvard Square	0|1	path_320.png
harvard	From Harvard fly to Harvard Square and end there.	Harvard|Harvard Square	0|1	path_320.png
harvard	Harvard to Harvard square	Harvard|Harvard Square	0|1	path_320.png
harvard	Starting at the Winthrop House, a person makes their way to the Harvard Bookstore. After visiting the Harvard Bookstore., the person goes to the Fogg Museum. After the making it to the Fogg Museum, a person makes their way to the Busch-Reisinger Museum.	Winthrop House|Harvard Bookstore|Fogg Museum|Busch-Reisinger Museum	10|12|14|9	path_580.png
harvard	Walk from Winthrop House to Harvard Bookstore, then straight on to Fogg Museum, then straight on to Busch-Reisinger Museum.	Winthrop House|Harvard Bookstore|Fogg Museum|Busch-Reisinger Museum	10|12|14|9	path_580.png
harvard	Start at the Winthrop House and then go to the Harvard Bookstore, the Fogg Museum and ending at Busch-Reisinger Museum.	Winthrop House|Harvard Bookstore|Fogg Museum|Busch-Reisinger Museum	10|12|14|9	path_580.png
harvard	Start at Malkin Quad and then go to Harvard, Harvard Square and the Harvard Bookstore.	Malkin Quad|Harvard|Harvard Square|Harvard Bookstore	6|0|1|12	path_82.png
harvard	Take the path from Malkin Quad to Harvard. Then pass through Harvard Square to get to the Harvard Bookstore	Malkin Quad|Harvard|Harvard Square|Harvard Bookstore	6|0|1|12	path_82.png
harvard	Start at Malkin Quad, and head to Harvard. Then go to Harvard Square. Then end at Harvard Bookstore.	Malkin Quad|Harvard|Harvard Square|Harvard Bookstore	6|0|1|12	path_82.png
harvard	From Cafe Pamplona, go to the Fogg Museum, then Sever Quadrangle and then to Pusey Library.	Cafe Pamplona|Fogg Museum|Sever Quadrangle|Pusey Library	11|14|4|7	path_821.png
harvard	Start at Cafe Pamplona then goto Fogg Museum then to Server Quadrangle then finish at Pusey Library.	Cafe Pamplona|Fogg Museum|Sever Quadrangle|Pusey Library	11|14|4|7	path_821.png
harvard	Start at Cafe Pamplona. Head northwest to Fogg Museum. Head Southwest to Server Quadrangle. Head Southeast to Pusey Library.	Cafe Pamplona|Fogg Museum|Sever Quadrangle|Pusey Library	11|14|4|7	path_821.png
harvard	Take the path from Pusey Library through the Sever Quadrangle and through Fogg Museum to make it to Busch-Reisigner Museum	Pusey Library|Sever Quadrangle|Fogg Museum|Busch-Reisinger Museum	7|4|14|9	path_321.png
harvard	Walk from Pusey Library to Sever Quadrangle, then turn left and walk to Fogg Museum, then turn right and walk to Busch-Reisinger Museum.	Pusey Library|Sever Quadrangle|Fogg Museum|Busch-Reisinger Museum	7|4|14|9	path_321.png
harvard	Fly toward the Sever Quadrangle. Once you get there, turn left and fly directly toward the Fogg Museum. At the Fogg Museum, make a sharp right turn and fly straight toward the Busch-Reisinger Museum.	Pusey Library|Sever Quadrangle|Fogg Museum|Busch-Reisinger Museum	7|4|14|9	path_321.png
harvard	Start at Pusey Library and go directly to Harvard Bookstore. From there, go to Cafe Pamplona. Finally, from Cafe Pamplona, depart for Leverett Towers.	Pusey Library|Harvard Bookstore|Cafe Pamplona|Leverett Towers	7|12|11|5	path_823.png
harvard	Start at Pusey Library and go to Harvard bookstore. Then go to cafe pamplona and then leverett towers.	Pusey Library|Harvard Bookstore|Cafe Pamplona|Leverett Towers	7|12|11|5	path_823.png
harvard	Start at Leverett Towers and then go right towards Cafe Pamplona. Go down to Harvard Bookstore and then back up and right towards Pusey Library.	Pusey Library|Harvard Bookstore|Cafe Pamplona|Leverett Towers	7|12|11|5	path_823.png
harvard	Begin at Cafe Pampiona, go to Harvard Square. End at Malkin Quad	Cafe Pamplona|Harvard Square|Malkin Quad	11|1|6	path_83.png
harvard	Start at Cafe Pamplona and go to Harvard Square before going to Malkin Quad.	Cafe Pamplona|Harvard Square|Malkin Quad	11|1|6	path_83.png
harvard	From Cafe pamplona go to Harvard Square and then to Malkin Quad.	Cafe Pamplona|Harvard Square|Malkin Quad	11|1|6	path_83.png
harvard	Go from Elm Yard to Harvard Square.  Then go to Drivemint.	Elm Yard|Harvard Square|Drivemint	3|1|13	path_322.png
harvard	From Elm Yard fly southwest to Harvard Square. Then head south all the way to Drivemint	Elm Yard|Harvard Square|Drivemint	3|1|13	path_322.png
harvard	Begin at Elm Yard, go to Harvard Square. End at Drivemint	Elm Yard|Harvard Square|Drivemint	3|1|13	path_322.png
harvard	Start at Harvard then go west to Harvard Square then west again to Winthrop House then finish going southeast to Malkin Quad.	Harvard|Harvard Square|Winthrop House|Malkin Quad	0|1|10|6	path_581.png
harvard	Walk from Harvard to Harvard Square, then straight on to Winthrop House, then turn sharply left and walk to Malkin Quad.	Harvard|Harvard Square|Winthrop House|Malkin Quad	0|1|10|6	path_581.png
harvard	Start at Harvard. Go to Harvard Square. Then Winthrop House. End at Malkin Quad.	Harvard|Harvard Square|Winthrop House|Malkin Quad	0|1|10|6	path_581.png
harvard	Go from the Malkin Quad to Elm Yard, then to Sever Quadrangle and finally to Busch-Reisinger Museum.	Malkin Quad|Elm Yard|Sever Quadrangle|Busch-Reisinger Museum	6|3|4|9	path_84.png
harvard	quad to  museum	Malkin Quad|Elm Yard|Sever Quadrangle|Busch-Reisinger Museum	6|3|4|9	path_84.png
harvard	Starting at Malkin Quad, go to Flm Yard. Then proceed to Sever Quadrangle, and finally arrive at Busch-Reisinger Museum.	Malkin Quad|Elm Yard|Sever Quadrangle|Busch-Reisinger Museum	6|3|4|9	path_84.png
harvard	Go from Winthrop House to the Harvard Bookstore, then through Elm Yard to Harvard Square	Winthrop House|Harvard Bookstore|Elm Yard|Harvard Square	10|12|3|1	path_323.png
harvard	Go all the way to Harvard Bookstore, turn right, and go to Elm Yard. At Elm Yard, turn  right and fly to Harvard Square.	Winthrop House|Harvard Bookstore|Elm Yard|Harvard Square	10|12|3|1	path_323.png
harvard	Winthrop House to Harvard Bookstore to Elm Yard to Harvard Square	Winthrop House|Harvard Bookstore|Elm Yard|Harvard Square	10|12|3|1	path_323.png
harvard	Go from Harvard to Tercentary Theatre.	Harvard|Tercentary Theatre	0|2	path_582.png
harvard	harvard up to tercentary theatre	Harvard|Tercentary Theatre	0|2	path_582.png
harvard	Walk from Harvard north to Tercentary Theatre.	Harvard|Tercentary Theatre	0|2	path_582.png
harvard	Walk from Busch-Reisinger Museum southwest to Pusey Library.	Busch-Reisinger Museum|Pusey Library	9|7	path_824.png
harvard	Begin at Busch- Reisinger Museum. End at Pusey Library	Busch-Reisinger Museum|Pusey Library	9|7	path_824.png
harvard	From Busch-Reisinger Museum head southwest to Pusey Library	Busch-Reisinger Museum|Pusey Library	9|7	path_824.png
harvard	Go from Harvard Bookstore to Harvard Square to Drivemint	Harvard Bookstore|Harvard Square|Drivemint	12|1|13	path_324.png
harvard	Start at the Harvard Bookstore. Go to Harvard Square. End at Drivemint.	Harvard Bookstore|Harvard Square|Drivemint	12|1|13	path_324.png
harvard	From the Harvard Bookstore head southeast to Harvard Square, and then south to Drivemint	Harvard Bookstore|Harvard Square|Drivemint	12|1|13	path_324.png
harvard	Go from Fogg Museum to Sever Quadrangle to Busch-Reisinger Museum to Pusey Library to Harvard Bookstore	Fogg Museum|Sever Quadrangle|Busch-Reisinger Museum|Pusey Library|Harvard Bookstore	14|4|9|7|12	path_85.png
harvard	Beginning at the Fogg Museum go to the Server Quadrangle. Turn and go to the Busch-Reisinger Museum. Then go to the Harvard Bookstore by flying by the Pusey Library.	Fogg Museum|Sever Quadrangle|Busch-Reisinger Museum|Pusey Library|Harvard Bookstore	14|4|9|7|12	path_85.png
