map_name	utterance	trajectory	path_names	path_idxs
brown	From Starbucks go west to the War Memorial, then east to P-131317. From there go southwest to Marcus Aurelius.	Starbucks|War Memorial|P-131317|Marcus Aurelius	0|5|3|6	path_685.png
brown	go from starbucks to war memorial to p-131317 to marcus aurelius	Starbucks|War Memorial|P-131317|Marcus Aurelius	0|5|3|6	path_685.png
brown	From the Slavery Memorial go to the Blue Room. Then go to the Campus Market. Then go to Marcus Aurelius. Then go to War Memorial. Then go to P-131317. Then go to Starbucks.	Slavery Memorial|Blue Room|Campus Market|Marcus Aurelius|War Memorial|P-131317|Starbucks	4|1|2|6|5|3|0	path_431.png
brown	From the Slavery Memorial, travel to the Blue Room, then continue to the Campus Market. From there go all the way to Marcus Aurelius, then to the War Memorial. From the War Memorial, travel to P-131317, then continue on to Starbucks.	Slavery Memorial|Blue Room|Campus Market|Marcus Aurelius|War Memorial|P-131317|Starbucks	4|1|2|6|5|3|0	path_431.png
brown	go from slavery memorial to blue room to campus market to marcus aurelius to war memorial to p-131317 to starbucks	Slavery Memorial|Blue Room|Campus Market|Marcus Aurelius|War Memorial|P-131317|Starbucks	4|1|2|6|5|3|0	path_431.png
brown	Beginning at Marcus Aurelius head north east until you reach brown bear. From brown bear turn East and head straight until you reach P - 1 31317. From their make a U-turn and headed westbound until you reach War Memorial	Marcus Aurelius|Brown Bear|P-131317|War Memorial	6|7|3|5	path_190.png
brown	Start from Marcus Aurelius, then go to the Brown Bear, followed by P-131317, and finally from there to the War Memorial.	Marcus Aurelius|Brown Bear|P-131317|War Memorial	6|7|3|5	path_190.png
brown	Begin at Marcus Aurelius and move to the Brown Bear. Make a right and go directly to P-131317, bypassing the War Memorial. Then make a u-turn and head back to the War Memorial.	Marcus Aurelius|Brown Bear|P-131317|War Memorial	6|7|3|5	path_190.png
brown	go from starbucks to brown bear to marcus aurelius to campus market	Starbucks|Brown Bear|Marcus Aurelius|Campus Market	0|7|6|2	path_688.png
brown	Go straight from Starbucks to Brown Bear and then go straight to Marcus Aurelius. Lastly, go straight to Campus Market.	Starbucks|Brown Bear|Marcus Aurelius|Campus Market	0|7|6|2	path_688.png
brown	Beginning at Starbucks head westbound until you reach brown bear. From brown bear turn Southwest and head straight until you reach Marcus Aurelius. From Marcus Aurelius turn slightly Southeast and head straight towards campus market	Starbucks|Brown Bear|Marcus Aurelius|Campus Market	0|7|6|2	path_688.png
brown	go from starbucks to p-131317 to war memorial to marcus aurelius to campus market to blue room to slavery memorial	Starbucks|P-131317|War Memorial|Marcus Aurelius|Campus Market|Blue Room|Slavery Memorial	0|3|5|6|2|1|4	path_434.png
brown	Go straight from Starbucks to P-131317 and then go straight to War Memorial. Then go straight to Marcus Aurelius. Then go straight to Campus Market. Then go straight to Blue Room. Lastly, go straight to Slavery Memorial.	Starbucks|P-131317|War Memorial|Marcus Aurelius|Campus Market|Blue Room|Slavery Memorial	0|3|5|6|2|1|4	path_434.png
brown	Continue straight to the war memorial.  Go slight left and head to marcus aurelius.  Turn sharp left and go to the campus market.  From there turn sharp right to the blue room.  Finally turn slight right and head to the slavery memorial.	Starbucks|P-131317|War Memorial|Marcus Aurelius|Campus Market|Blue Room|Slavery Memorial	0|3|5|6|2|1|4	path_434.png
brown	go from marcus aurelius to war memorial to brown bear to starbucks to p-131317	Marcus Aurelius|War Memorial|Brown Bear|Starbucks|P-131317	6|5|7|0|3	path_191.png
brown	Go straight from Marcus Aurelius to War Memorial and then go straight to Brown Bear. Then go straight to Starbucks. Lastly, go straight to P-131317.	Marcus Aurelius|War Memorial|Brown Bear|Starbucks|P-131317	6|5|7|0|3	path_191.png
brown	From Marcus Aurelius, head up to War Memorial, then over to Brown Bear. From there, you'll want to go to Starbucks, and then over to P-131317.	Marcus Aurelius|War Memorial|Brown Bear|Starbucks|P-131317	6|5|7|0|3	path_191.png
brown	Go from p131317 to starbucks to war memorial to brown bear	P-131317|Starbucks|War Memorial|Brown Bear	3|0|5|7	path_944.png
brown	Go from P-131317 to Starbucks. Then go to War Memorial. Then go to Brown Bear.	P-131317|Starbucks|War Memorial|Brown Bear	3|0|5|7	path_944.png
brown	Begin at P-131317, go to Starbucks, then go to War Memorial. End at Brown Bear.	P-131317|Starbucks|War Memorial|Brown Bear	3|0|5|7	path_944.png
brown	Go straight from Blue Room to Campus Market and then go straight to Marcus Aurelius. Then go straight to War Memorial. Lastly, go straight to Starbucks.	Blue Room|Campus Market|Marcus Aurelius|War Memorial|Starbucks	1|2|6|5|0	path_435.png
brown	go from blue room to campus market to marcus aurelius to war memorial to starbucks	Blue Room|Campus Market|Marcus Aurelius|War Memorial|Starbucks	1|2|6|5|0	path_435.png
brown	starting at blue room fly up to campus market. turn left flying up to 10 oclock to marcus aurelies. turn up at 2 oclock to war memorial	Blue Room|Campus Market|Marcus Aurelius|War Memorial|Starbucks	1|2|6|5|0	path_435.png
brown	Go from war memorial to p-131317 to marcus aurelius to brown bear to starbucks	War Memorial|P-131317|Marcus Aurelius|Brown Bear|Starbucks	5|3|6|7|0	path_192.png
brown	From War Memorial, go on over to P-131317, then head down to Marcus Aurelius, and up to Brown Bear. From there you'll want to go over to Starbucks.	War Memorial|P-131317|Marcus Aurelius|Brown Bear|Starbucks	5|3|6|7|0	path_192.png
brown	Go straight from War Memorial to P-131317 and then go straight to Marcus Aurelius. Then go straight to Brown Bear. Lastly, go straight to Starbucks.	War Memorial|P-131317|Marcus Aurelius|Brown Bear|Starbucks	5|3|6|7|0	path_192.png
brown	From brown bear go to Starbucks, then go over to P-131317.	Brown Bear|Starbucks|P-131317	7|0|3	path_689.png
brown	Go straight from Brown Bear to Starbucks and then go straight to P-131317.	Brown Bear|Starbucks|P-131317	7|0|3	path_689.png
brown	Start at Brown Bear and end up at Star Bucks. 
Start out at P-131317 and end up at Star Bucks.	Brown Bear|Starbucks|P-131317	7|0|3	path_689.png
brown	Begin at P-131317, go to War Memorial, then Marcus Aurelius, then Campus Market. End at Blue Room	P-131317|War Memorial|Marcus Aurelius|Campus Market|Blue Room	3|5|6|2|1	path_436.png
brown	go from p-131317 to war memorial to marcus aurelius to campus market to blue room	P-131317|War Memorial|Marcus Aurelius|Campus Market|Blue Room	3|5|6|2|1	path_436.png
brown	From P-131317 head to War Memorial. Then head over to Marcus Aurelius followed by Campus Market and finish at Blue Room.	P-131317|War Memorial|Marcus Aurelius|Campus Market|Blue Room	3|5|6|2|1	path_436.png
brown	Go from starbucks to brown bear to marcus aurelius	Starbucks|Brown Bear|Marcus Aurelius	0|7|6	path_193.png
brown	Go straight from Starbucks to Brown Bear and then go straight to Marcus Aurelius.	Starbucks|Brown Bear|Marcus Aurelius	0|7|6	path_193.png
brown	{}	Starbucks|Brown Bear|Marcus Aurelius	0|7|6	path_193.png
brown	Start at Brown Bear and head to the War Memorial.	Brown Bear|War Memorial	7|5	path_691.png
brown	Go straight from Brown Bear to War Memorial.	Brown Bear|War Memorial	7|5	path_691.png
brown	go from brown bear to war memorial	Brown Bear|War Memorial	7|5	path_691.png
brown	Go from the Campus Market to the Slavery Memorial.	Campus Market|Slavery Memorial	2|4	path_945.png
brown	Beginning at Campus Market, continue south to Slavery Memorial. Stop at Slavery Memorial.	Campus Market|Slavery Memorial	2|4	path_945.png
brown	Go straight from Campus Market to Slavery Memorial.	Campus Market|Slavery Memorial	2|4	path_945.png
brown	Start at the Slavery Memorial, then go to the Campus Market, followed by Marcus Aurelius. From there go to the War Memorial followed by the Brown Bear, and end at P-131317.	Slavery Memorial|Campus Market|Marcus Aurelius|War Memorial|Brown Bear|P-131317	4|2|6|5|7|3	path_437.png
brown	Beginning at Slavery Memorial, go to Campus Market, then to Marcus Aurelius. Go to War Memorial, then to Brown Bear. End at P-131317.	Slavery Memorial|Campus Market|Marcus Aurelius|War Memorial|Brown Bear|P-131317	4|2|6|5|7|3	path_437.png
brown	go from slavery memorial to campus market to marcus aurelius to war memorial to brown bear to p-131317	Slavery Memorial|Campus Market|Marcus Aurelius|War Memorial|Brown Bear|P-131317	4|2|6|5|7|3	path_437.png
brown	From P-131317 go to the war memorial, then to Marcus Aurelius then to the brown bear.	P-131317|War Memorial|Marcus Aurelius|Brown Bear	3|5|6|7	path_194.png
brown	go from p-131317 to war memorial to marcus aurelius to brown bear	P-131317|War Memorial|Marcus Aurelius|Brown Bear	3|5|6|7	path_194.png
brown	Begin at P-131317, go to War Memorial, then Marcus Aurelius. End at Brown Bear	P-131317|War Memorial|Marcus Aurelius|Brown Bear	3|5|6|7	path_194.png
brown	From P-131317 head towards Marcus Aurelius. Next go to Brown Bear. Now move towards the destination at Starbucks.	P-131317|Marcus Aurelius|Brown Bear|Starbucks	3|6|7|0	path_692.png
brown	go from p-131317 to marcus aurelius to brown bear to starbucks	P-131317|Marcus Aurelius|Brown Bear|Starbucks	3|6|7|0	path_692.png
brown	Go directly from P-131317 to Marcus Aurelius. Then go directly to Brown Bear. Then go directly to Starbucks.	P-131317|Marcus Aurelius|Brown Bear|Starbucks	3|6|7|0	path_692.png
brown	Start with Starbucks.And move to the point of P131317. After move from P131317 to Marcus Attrelius.And after move to from Marcus Attrelius to Campus Market.Then move to Blue room.	Starbucks|P-131317|Marcus Aurelius|Campus Market|Blue Room	0|3|6|2|1	path_946.png
brown	Underpaid and broken.	Starbucks|P-131317|Marcus Aurelius|Campus Market|Blue Room	0|3|6|2|1	path_946.png
brown	Go straight from Starbucks to P-131317 and then go straight to Marcus Aurelius. Then go straight to Campus Market. Lastly, go straight to Blue Room.	Starbucks|P-131317|Marcus Aurelius|Campus Market|Blue Room	0|3|6|2|1	path_946.png
brown	Start at Brown Bear, go to Marcus Aurelius.	Brown Bear|Marcus Aurelius	7|6	path_195.png
brown	go from brown bear to marcus aurelius	Brown Bear|Marcus Aurelius	7|6	path_195.png
brown	Start at brown bear and head straight to marcus aurelius.	Brown Bear|Marcus Aurelius	7|6	path_195.png
brown	Beginning at War Memorial, go to Brown Bear, then go to Starbucks. Go to P-131317, then end at Marcus Aurelius.	War Memorial|Brown Bear|Starbucks|P-131317|Marcus Aurelius	5|7|0|3|6	path_947.png
brown	go from war memorial to brown bear to starbucks to p-131317 to marcus aurelius	War Memorial|Brown Bear|Starbucks|P-131317|Marcus Aurelius	5|7|0|3|6	path_947.png
brown	Start at the War Memorial and go to Brown Bear, then to Starbucks. Continue to P-131317 and finish at Marcus Aurelius.	War Memorial|Brown Bear|Starbucks|P-131317|Marcus Aurelius	5|7|0|3|6	path_947.png
brown	from the brown bear go south to the marcus aurelius then southeast to the campus market then south west to the blue room	Brown Bear|Marcus Aurelius|Campus Market|Blue Room	7|6|2|1	path_196.png
brown	Go from brown bear to marcus aurelius to campus market to blue room	Brown Bear|Marcus Aurelius|Campus Market|Blue Room	7|6|2|1	path_196.png
brown	Start at Brown Bear and go to Marcus Aurelius and then on to the Campus Market before ending at the Blue Room.	Brown Bear|Marcus Aurelius|Campus Market|Blue Room	7|6|2|1	path_196.png
brown	Start at Brown Bear and the go to the War Memorial and on to Marcus Aurelius. Then visit the Campus Market and head to the Slavery Memorial.	Brown Bear|War Memorial|Marcus Aurelius|Campus Market|Slavery Memorial	7|5|6|2|4	path_948.png
brown	go from brown bear to war memorial to marcus aurelius to campus market to slavery memorial	Brown Bear|War Memorial|Marcus Aurelius|Campus Market|Slavery Memorial	7|5|6|2|4	path_948.png
brown	Begin at Brown Bear. Move slightly up and to the right to War Memorial. Go down and to the left to Marcus Aurelius. Move far down to the right to Campus Market. Move down and to the left to Slavery Memorial.	Brown Bear|War Memorial|Marcus Aurelius|Campus Market|Slavery Memorial	7|5|6|2|4	path_948.png
brown	go from blue room to campus market to marcus aurelius to war memorial	Blue Room|Campus Market|Marcus Aurelius|War Memorial	1|2|6|5	path_197.png
brown	Go from Blue Room To Campus Market, then head to Marcus Aurelius and end your journey at War Memorial.	Blue Room|Campus Market|Marcus Aurelius|War Memorial	1|2|6|5	path_197.png
brown	starting at blue room fly up to campus market. turn left flying up to 10 oclock to marcus aurelies. turn up at 2 oclock ending at war memorial	Blue Room|Campus Market|Marcus Aurelius|War Memorial	1|2|6|5	path_197.png
brown	Go from marcus aurelius to campus market to blue room	Marcus Aurelius|Campus Market|Blue Room	6|2|1	path_951.png
brown	Travel from Marcus Aurelius to the Campus Market before going to the Blue Room.	Marcus Aurelius|Campus Market|Blue Room	6|2|1	path_951.png
brown	Go straight from Marcus Aurelius to Campus Market and then go straight to Blue Room.	Marcus Aurelius|Campus Market|Blue Room	6|2|1	path_951.png
brown	go from war memorial to p-131317 to brown bear to marcus aurelius to campus market	War Memorial|P-131317|Brown Bear|Marcus Aurelius|Campus Market	5|3|7|6|2	path_198.png
brown	Start at War Memorial, go to P-131317, then to Brown Bear. Go to Marcus Aurelius, then end at Campus Market.	War Memorial|P-131317|Brown Bear|Marcus Aurelius|Campus Market	5|3|7|6|2	path_198.png
brown	Starting at War Memorial, head east to P-131317, then head west to Brown Bear, then south to Marcus Aurelius, then southeast to Campus Market.	War Memorial|P-131317|Brown Bear|Marcus Aurelius|Campus Market	5|3|7|6|2	path_198.png
brown	start at starbucks go left to p131317	Starbucks|P-131317	0|3	path_439.png
brown	Begin at Starbucks and head directly to P-131317.	Starbucks|P-131317	0|3	path_439.png
brown	Go from starbucks to p-131317	Starbucks|P-131317	0|3	path_439.png
brown	From the War memorial you should go to brown bear. 
Once at Brown bear go to Marcus Aurelius and then campus market.
Do not go to blue room, go to the slavery memorial after campus market.	War Memorial|Brown Bear|Marcus Aurelius|Campus Market|Slavery Memorial	5|7|6|2|4	path_199.png
brown	Go from war memorial to brown bear to marcus aurelius to campus market to slavery memorial	War Memorial|Brown Bear|Marcus Aurelius|Campus Market|Slavery Memorial	5|7|6|2|4	path_199.png
brown	Begin at War Memorial, go to Brown Bear, then Marcus Aurelius, then Campus Market. End at Slavery Memorial	War Memorial|Brown Bear|Marcus Aurelius|Campus Market|Slavery Memorial	5|7|6|2|4	path_199.png
brown	Go straight from P-131317 to Marcus Aurelius and then go straight to Campus Market. Lastly, go straight to Slavery Memorial.	P-131317|Marcus Aurelius|Campus Market|Slavery Memorial	3|6|2|4	path_952.png
brown	Go from P-131317 to Marcus Aurelius. Continue to the Campus Market and then finish at the Slavery Memorial.	P-131317|Marcus Aurelius|Campus Market|Slavery Memorial	3|6|2|4	path_952.png
brown	Travel from P-131317 to Marcus Aurelius before continuing on to the Campus Market followed by the Slavery Memorial.	P-131317|Marcus Aurelius|Campus Market|Slavery Memorial	3|6|2|4	path_952.png
brown	Start at P-131317 and go to Brown Bear. Visit Marcus Aurelius and then go to the Campus Market.	P-131317|Brown Bear|Marcus Aurelius|Campus Market	3|7|6|2	path_440.png
brown	Starting at P-131317, head west to Brown Bear, then south to Marcus Aurelius, then southeast to Campus Market.	P-131317|Brown Bear|Marcus Aurelius|Campus Market	3|7|6|2	path_440.png
brown	Go straight from P-131317 to Brown Bear and then go straight to Marcus Aurelius. Then go straight to Campus Market.	P-131317|Brown Bear|Marcus Aurelius|Campus Market	3|7|6|2	path_440.png
brown	From Marcus Aurelius make your way to campus market and head to your final destination the slavery Memorial.	Marcus Aurelius|Campus Market|Slavery Memorial	6|2|4	path_201.png
brown	Go from marcus aurelius to campus market to slavery memorial	Marcus Aurelius|Campus Market|Slavery Memorial	6|2|4	path_201.png
brown	Go straight from Marcus Aurelius to Campus Market and then go straight to Slavery Memorial.	Marcus Aurelius|Campus Market|Slavery Memorial	6|2|4	path_201.png
brown	Begin at Brown Bear. Move far to the right and slightly up to Starbucks. Move far back to the left and slightly down to War Memorial.	Brown Bear|Starbucks|War Memorial	7|0|5	path_953.png
brown	Beginning at the Brown Bear, go directly to Starbucks, bypassing both the War Memorial and P-131317 on your left. Once at Starbucks, make a u-turn and go to the War Memorial, passing through P-131317 but not stopping there.	Brown Bear|Starbucks|War Memorial	7|0|5	path_953.png
brown	Start at Brown Bear then head east towards Starbucks. Next, turn left and head west to War Memorial. Stop at War Memorial.	Brown Bear|Starbucks|War Memorial	7|0|5	path_953.png
brown	Go straight from Campus Market to Marcus Aurelius and then go straight to Brown Bear. Lastly, go straight to War Memorial.	Campus Market|Marcus Aurelius|Brown Bear|War Memorial	2|6|7|5	path_694.png
brown	Please start at Campus Market and go to Marcus Aurelius. Then go to Brown Bear, and go to the War Memorial from there.	Campus Market|Marcus Aurelius|Brown Bear|War Memorial	2|6|7|5	path_694.png
brown	Beginning at campus market lead and go to Marcus Aurelius make a next stop Brown bear and your final stop War Memorial.	Campus Market|Marcus Aurelius|Brown Bear|War Memorial	2|6|7|5	path_694.png
brown	Begin at Marcus Aurelius, then go to the Campus Market, and then go to the Slavery Memorial.	Marcus Aurelius|Campus Market|Slavery Memorial	6|2|4	path_441.png
brown	Begin at Marcus Aurelius, go to Campus Market. End at Slavery Memorial	Marcus Aurelius|Campus Market|Slavery Memorial	6|2|4	path_441.png
brown	Go straight from Marcus Aurelius to Campus Market and then go straight to Slavery Memorial.	Marcus Aurelius|Campus Market|Slavery Memorial	6|2|4	path_441.png
brown	go from p-131317 to marcus aurelius to campus market to slavery memorial	P-131317|Marcus Aurelius|Campus Market|Slavery Memorial	3|6|2|4	path_695.png
brown	starting g p-131317 going down 7 oclock to marcus aurelies then fly down at 5 oclock to campus market. turn down at 7 oclock to slavery memorial	P-131317|Marcus Aurelius|Campus Market|Slavery Memorial	3|6|2|4	path_695.png
brown	Begin at P-131317, go to Marcus Aurelius, then to Campus Market. End at Slavery Memorial.	P-131317|Marcus Aurelius|Campus Market|Slavery Memorial	3|6|2|4	path_695.png
brown	the image is broken so i cannot view it	Slavery Memorial|Campus Market|Marcus Aurelius|War Memorial|Starbucks	4|2|6|5|0	path_956.png
brown	From Slavery Memorial, go to Campus Market. Then go to Marcus Aurelius. Then go to War Memorial. Then go to past P-131317 to Starbucks.	Slavery Memorial|Campus Market|Marcus Aurelius|War Memorial|Starbucks	4|2|6|5|0	path_956.png
brown	NA	Slavery Memorial|Campus Market|Marcus Aurelius|War Memorial|Starbucks	4|2|6|5|0	path_956.png
brown	go from blue room to campus market to marcus aurelius to p-131317 to brown bear	Blue Room|Campus Market|Marcus Aurelius|P-131317|Brown Bear	1|2|6|3|7	path_442.png
brown	Start at Blue Room, go to Campus Market, then go to Marcus Aurelius. Go to P-131317, and end at Brown Bear.	Blue Room|Campus Market|Marcus Aurelius|P-131317|Brown Bear	1|2|6|3|7	path_442.png
brown	Go straight from Blue Room to Campus Market and then go straight to Marcus Aurelius. Then go straight to P-131317. Lastly, go straight to Brown Bear.	Blue Room|Campus Market|Marcus Aurelius|P-131317|Brown Bear	1|2|6|3|7	path_442.png
brown	Begin at War Memorial. End at P-131317	War Memorial|P-131317	5|3	path_202.png
brown	Go straight from War Memorial to P-131317.	War Memorial|P-131317	5|3	path_202.png
brown	Start at the War Memorial and go east until you reach P-131317.	War Memorial|P-131317	5|3	path_202.png
brown	Begin at Marcus Aurelius then continue north towards Brown Bear.	Marcus Aurelius|Brown Bear	6|7	path_958.png
brown	Go straight from Marcus Aurelius to Brown Bear.	Marcus Aurelius|Brown Bear	6|7	path_958.png
brown	go from marcus aurelius to brown bear	Marcus Aurelius|Brown Bear	6|7	path_958.png
brown	Start at Slavery Memorial, go to Campus Market. End at Marcus Aurelius.	Slavery Memorial|Campus Market|Marcus Aurelius	4|2|6	path_698.png
brown	go from slavery memorial to campus market to marcus aurelius	Slavery Memorial|Campus Market|Marcus Aurelius	4|2|6	path_698.png
brown	Start at the Slavery Memorial. Head to the Campus Market and then head to Marcus Aurelius.	Slavery Memorial|Campus Market|Marcus Aurelius	4|2|6	path_698.png
brown	go from slavery memorial to blue room to campus market to marcus aurelius to brown bear to starbucks to p-131317 to war memorial	Slavery Memorial|Blue Room|Campus Market|Marcus Aurelius|Brown Bear|P-131317|Starbucks|War Memorial	4|1|2|6|7|3|0|5	path_443.png
brown	Begin at Slavery Memorial. Move up and to the right to Blue Room. Move slightly up to the right to Campus Market. Move far up to the left to Marcus Aurelius. Go up to the right to Brown Bear. Move to the right and slightly up to P-131317. Continue moving to the right and slightly up to Starbucks. Move back down to the left past P-131317 to War Memorial.	Slavery Memorial|Blue Room|Campus Market|Marcus Aurelius|Brown Bear|P-131317|Starbucks|War Memorial	4|1|2|6|7|3|0|5	path_443.png
brown	Start at Slavery Memorial, go to Blue Room, then Campus Market. Go to Marcus Aurelius, then to Brown Bear. Go to P-131317, then go to Starbucks. End at War Memorial.	Slavery Memorial|Blue Room|Campus Market|Marcus Aurelius|Brown Bear|P-131317|Starbucks|War Memorial	4|1|2|6|7|3|0|5	path_443.png
brown	Start at Starbucks and go to P-131317. Continue on to Marcus Aurelius, then go to the Campus Market and finish at the Blue Room.	Starbucks|P-131317|Marcus Aurelius|Campus Market|Blue Room	0|3|6|2|1	path_204.png
brown	Go directly from Starbucks to P-131317. Then go directly to Marcus Aurelius. Then go directly to Campus Market. Then go directly to Blue Room.	Starbucks|P-131317|Marcus Aurelius|Campus Market|Blue Room	0|3|6|2|1	path_204.png
brown	Begin at Starbucks and go to P-131317. Once there, turn left and go to Marcus Aurelius. Then make another left to Campus Market, before making a quick right to the Blue Room.	Starbucks|P-131317|Marcus Aurelius|Campus Market|Blue Room	0|3|6|2|1	path_204.png
brown	Start at the war memorial and go to Brown Deer, then to Starbucks then from Starbucks and go to P-131317, then hop on over to Marcus Aurelius followed by the campus market.	War Memorial|Brown Bear|Starbucks|P-131317|Marcus Aurelius|Campus Market	5|7|0|3|6|2	path_960.png
brown	Start at war memorial and go left to brown bear. once you reach brown bear go starbucks then to P-131317 then from there go down and left to marcu aurelius then from then go down and right to campus market	War Memorial|Brown Bear|Starbucks|P-131317|Marcus Aurelius|Campus Market	5|7|0|3|6|2	path_960.png
brown	Starting at War Memorial, go west and slightly south to Brown Bear. Head east and barely north, past War Memorial and P-131317 to Starbucks, back west to P-131317, then southwest to Marcus Aurelius and finally southeast to Campus Market.	War Memorial|Brown Bear|Starbucks|P-131317|Marcus Aurelius|Campus Market	5|7|0|3|6|2	path_960.png
brown	Begin at Marcus Aurelius, go to Campus Market, then end at Blue Room.	Marcus Aurelius|Campus Market|Blue Room	6|2|1	path_699.png
brown	Go from marcus aurelius to campus market to blue room	Marcus Aurelius|Campus Market|Blue Room	6|2|1	path_699.png
brown	Go straight from Marcus Aurelius to Campus Market and then go straight to Blue Room.	Marcus Aurelius|Campus Market|Blue Room	6|2|1	path_699.png
brown	Go straight from War Memorial to Brown Bear and then go straight to Marcus Aurelius.	War Memorial|Brown Bear|Marcus Aurelius	5|7|6	path_206.png
brown	Go from war memorial to brown bear to marcus aurelius	War Memorial|Brown Bear|Marcus Aurelius	5|7|6	path_206.png
brown	Start at the War Memorial, then Brown Bear followed by visiting Marcus Aurelius.	War Memorial|Brown Bear|Marcus Aurelius	5|7|6	path_206.png
brown	Go straight from Starbucks to P-131317 and then go straight to Marcus Aurelius.	Starbucks|P-131317|Marcus Aurelius	0|3|6	path_444.png
brown	Go from Starbucks to Marcus Aurelius via P-131317.	Starbucks|P-131317|Marcus Aurelius	0|3|6	path_444.png
brown	Stop at P-131317 and then head down to Marcus Aurelius.	Starbucks|P-131317|Marcus Aurelius	0|3|6	path_444.png
brown	NA	Brown Bear|War Memorial|Starbucks|P-131317|Marcus Aurelius|Campus Market	7|5|0|3|6|2	path_961.png
brown	Go straight from Brown Bear to Starbucks and then go straight to P-131317. Then go straight to Marcus Aurelius. Then go straight to Campus Market.	Brown Bear|War Memorial|Starbucks|P-131317|Marcus Aurelius|Campus Market	7|5|0|3|6|2	path_961.png
brown	Go from Brown Bear to War Memorial. Then go to Starbucks. Then go to P-131317. Then go to Marcus Aurelius. Then go to Campus Market.	Brown Bear|War Memorial|Starbucks|P-131317|Marcus Aurelius|Campus Market	7|5|0|3|6|2	path_961.png
brown	Starting at Starbucks, head west to Brown Bear.	Starbucks|Brown Bear	0|7	path_700.png
brown	Go from starbucks to brown bear	Starbucks|Brown Bear	0|7	path_700.png
brown	Go straight from Starbucks to Brown Bear.	Starbucks|Brown Bear	0|7	path_700.png
brown	Start at the Slavery Memorial and fly to the Blue Room, then go to the Campus Market and on to Marcus Aurelius. Continue to P-131317 and finish at Starbucks.	Slavery Memorial|Blue Room|Campus Market|Marcus Aurelius|P-131317|Starbucks	4|1|2|6|3|0	path_208.png
