map_name	utterance	trajectory	path_names	path_idxs
brown	go from slavery memorial to blue room to campus market to marcus aurelius to brown bear to p-131317 to war memorial	Slavery Memorial|Blue Room|Campus Market|Marcus Aurelius|Brown Bear|P-131317|War Memorial	4|1|2|6|7|3|5	path_127.png
brown	starting at slavery memorial flying at 2 oclock to  blue room fly up to campus market. turn left flying up to 10 oclock to marcus aurelies. turn up at straight  to brown bear, Continue past war memorial ending at  p-131.317	Slavery Memorial|Blue Room|Campus Market|Marcus Aurelius|Brown Bear|P-131317|War Memorial	4|1|2|6|7|3|5	path_127.png
brown	From Slavery Memorial, head to Blue Room, then to Campus Market. From there you'll want to go to Marcus Aurelius, then up to Brown Bear. After that, head to P-131317, then finally go to War Memorial.	Slavery Memorial|Blue Room|Campus Market|Marcus Aurelius|Brown Bear|P-131317|War Memorial	4|1|2|6|7|3|5	path_127.png
brown	Go straight from Starbucks to P-131317 and then go straight to War Memorial.	Starbucks|P-131317|War Memorial	0|3|5	path_356.png
brown	Go directly on a straight line from Starbucks to P131317 and then go directly on a straight line to War Memorial.	Starbucks|P-131317|War Memorial	0|3|5	path_356.png
brown	go from starbucks to p-131317 then to war memorial	Starbucks|P-131317|War Memorial	0|3|5	path_356.png
brown	{}	Starbucks|War Memorial|Marcus Aurelius|Campus Market	0|5|6|2	path_868.png
brown	Go straight from Starbucks to War Memorial and then go straight to Marcus Aurelius. Lastly, go straight to Campus Market.	Starbucks|War Memorial|Marcus Aurelius|Campus Market	0|5|6|2	path_868.png
brown	Fly from Starbucks to the War Memorial, and then to Marcus Aurelius. Finish at the Campus Market.	Starbucks|War Memorial|Marcus Aurelius|Campus Market	0|5|6|2	path_868.png
brown	Begin at Slavery Memorial, go to Campus Market. End at Marcus Aurelius	Slavery Memorial|Campus Market|Marcus Aurelius	4|2|6	path_610.png
brown	Start at the Slavery Memorial, walk to the Campus Market, turn left about 80 degrees, and walk to Marcus Aurelius.	Slavery Memorial|Campus Market|Marcus Aurelius	4|2|6	path_610.png
brown	From the Slavery Memorial fly to the Campus Market and on to Marcus Aurelius.	Slavery Memorial|Campus Market|Marcus Aurelius	4|2|6	path_610.png
brown	Start at starbucks, go past the P131317 until you hit the war memorial. If you hit the brown bear you went to far.	Starbucks|War Memorial|P-131317	0|5|3	path_358.png
brown	Go from Starbucks to War Memorial, then head back to P-131317.	Starbucks|War Memorial|P-131317	0|5|3	path_358.png
brown	Start at War Memorial go straight to  point  P-131317. Then go  from the point P-131317 to Starbucks.	Starbucks|War Memorial|P-131317	0|5|3	path_358.png
brown	NA	P-131317|Brown Bear|Marcus Aurelius|War Memorial|Starbucks	3|7|6|5|0	path_128.png
brown	Go from P-131317 to Brown Bear. Then go to Marcus Aurelius. Then go to War Memorial. Then go to Starbucks.	P-131317|Brown Bear|Marcus Aurelius|War Memorial|Starbucks	3|7|6|5|0	path_128.png
brown	go from p-131317 to starbucks to brown bear to marcus aurelius to war memorial	P-131317|Brown Bear|Marcus Aurelius|War Memorial|Starbucks	3|7|6|5|0	path_128.png
brown	Go from the War Memorial to P-131317, and finish at Starbucks.	War Memorial|Starbucks	5|0	path_869.png
brown	Go from War Memorial to P-131317, then go to Starbucks.	War Memorial|Starbucks	5|0	path_869.png
brown	Start from the War Memorial and go to P-131317, then to Starbucks.	War Memorial|Starbucks	5|0	path_869.png
brown	NA	War Memorial|P-131317|Marcus Aurelius	5|3|6	path_611.png
brown	Travel from the War Memorial to P-131317.   From P-131317 go directly to Marcus Aurelius with no in between stops or junctions	War Memorial|P-131317|Marcus Aurelius	5|3|6	path_611.png
brown	Go from the War Memorial to P-131317, and then to Marcus Aurelius.	War Memorial|P-131317|Marcus Aurelius	5|3|6	path_611.png
brown	Go straight	War Memorial|Brown Bear|P-131317|Marcus Aurelius	5|7|3|6	path_359.png
brown	war memorial to p-131317 to brown bear then back to p-131317 then go to marcus aurelius	War Memorial|Brown Bear|P-131317|Marcus Aurelius	5|7|3|6	path_359.png
brown	Starting at the War Memorial, head to the Brown Bear. Then make a u-turn and go to P-131317, bypassing the War Memorial on your left. Once there, make a sharp right and head to Marcus Aurelius.	War Memorial|Brown Bear|P-131317|Marcus Aurelius	5|7|3|6	path_359.png
brown	Begin at Marcus Aurelius and head North toward Brown Bear.  At Brown Bear turn right and continue straight towards Starbucks.	Marcus Aurelius|Brown Bear|Starbucks	6|7|0	path_129.png
brown	Go north from Marcus Aurelius, turn right at Brown Bear, and travel until you get to Starbucks	Marcus Aurelius|Brown Bear|Starbucks	6|7|0	path_129.png
brown	Go straight from Marcus Aurelius to Brown Bear and then go straight to Starbucks.	Marcus Aurelius|Brown Bear|Starbucks	6|7|0	path_129.png
brown	Go from the War Memorial to P-131317, and then to Marcus Aurelius and finally to Brown Bear.	War Memorial|P-131317|Marcus Aurelius|Brown Bear	5|3|6|7	path_870.png
brown	From War Memorial go to P-131317. Then go to Marcus Aurelius. Then go to Brown Bear.	War Memorial|P-131317|Marcus Aurelius|Brown Bear	5|3|6|7	path_870.png
brown	Begin at War Memorial, go to P-131317, then Marcus Aurelius. End at Brown Bear	War Memorial|P-131317|Marcus Aurelius|Brown Bear	5|3|6|7	path_870.png
brown	From the Campus Market, make a semi-circle to the landmarks of Marcus Aurelius, the War Memorial, and P-131317.	Campus Market|Marcus Aurelius|War Memorial|P-131317	2|6|5|3	path_612.png
brown	Go straight from Campus Market to Marcus Aurelius and then go straight to War Memorial. Lastly, go straight to P-131317.	Campus Market|Marcus Aurelius|War Memorial|P-131317	2|6|5|3	path_612.png
brown	Go from the Campus Market to Marcus Aurelius. Carry on to the War Memorial and finally to P-131317.	Campus Market|Marcus Aurelius|War Memorial|P-131317	2|6|5|3	path_612.png
brown	Follow West from Starbucks to reach the War Memorial. Continue West at a slightly more southern angle to reach Brown Bear.	War Memorial|Starbucks|Brown Bear	5|0|7	path_360.png
brown	Beginning at War Memorial, head east to Starbucks. Once at Starbucks, turn left then continue west to Brown Bear. Stop at Brown Bear.	War Memorial|Starbucks|Brown Bear	5|0|7	path_360.png
brown	Go from war memorial to starbucks to brown bear	War Memorial|Starbucks|Brown Bear	5|0|7	path_360.png
brown	starting at marcus aurelius goup 2 oclock ending at  p-131317	Marcus Aurelius|P-131317	6|3	path_871.png
brown	go from marcus aurelius to p-131317	Marcus Aurelius|P-131317	6|3	path_871.png
brown	Go to Marcus Aurelius and then P-131317.	Marcus Aurelius|P-131317	6|3	path_871.png
brown	{}	War Memorial|Starbucks|Brown Bear|P-131317	5|0|7|3	path_872.png
brown	Starting at the War Memorial, head to P-131317. Then turn around and head back the other way to the Brown Bear. Then turn around again and go directly to Starbucks, bypassing the War Memorial and P-131317 on your left.	War Memorial|Starbucks|Brown Bear|P-131317	5|0|7|3	path_872.png
brown	Start at War Memorial, go to P-131317, then to Starbucks. End at Brown Bear.	War Memorial|Starbucks|Brown Bear|P-131317	5|0|7|3	path_872.png
brown	Please go from the War Memorial to P-131317, then to Brown Bear. Then, go to Starbucks.	War Memorial|P-131317|Brown Bear|Starbucks	5|3|7|0	path_364.png
brown	Starting at the War Memorial, head East to reach your first stop which is P-131317. When you reach P-131317, start heading West to reach Brown Bear. When you reach Brown Bear, head East to reach Starbucks.	War Memorial|P-131317|Brown Bear|Starbucks	5|3|7|0	path_364.png
brown	At War Memorial, head east to P131317 then head west to Brown Bear. At Brown Bear, turn right and continue east Starbucks.	War Memorial|P-131317|Brown Bear|Starbucks	5|3|7|0	path_364.png
brown	Start at Starbucks and head to Brown Bear. From there head to the War Memorial, then to Marcus Aurelius, then to the Campus Market, and finally arrive at Blue Room.	Starbucks|Brown Bear|War Memorial|Marcus Aurelius|Campus Market|Blue Room	0|7|5|6|2|1	path_613.png
brown	Beginning at Starbucks, go to Brown Bear, then to War Memorial. Go to Marcus Aurelius, then to Campus Market. End at Blue Room.	Starbucks|Brown Bear|War Memorial|Marcus Aurelius|Campus Market|Blue Room	0|7|5|6|2|1	path_613.png
brown	go from starbucks to brown bear to war memorial to marcus aurelius to campus market to blue room	Starbucks|Brown Bear|War Memorial|Marcus Aurelius|Campus Market|Blue Room	0|7|5|6|2|1	path_613.png
brown	Depart Starbucks for P-131317, and then go to Marcus Aurelius before the Campus Market.	Starbucks|P-131317|Marcus Aurelius|Campus Market	0|3|6|2	path_130.png
brown	Go straight from Starbucks to P-131317 and then go straight to Marcus Aurelius. Lastly, go straight to Campus Market.	Starbucks|P-131317|Marcus Aurelius|Campus Market	0|3|6|2	path_130.png
brown	Go to P-131317 from Starbucks. At that point you will head over to Marcus Aurelius before finishing at the Campus Market.	Starbucks|P-131317|Marcus Aurelius|Campus Market	0|3|6|2	path_130.png
brown	Start at Slavery Memorial continue up and right to Blue Moon. From there continue up tio Campus Market then go up and left to Marcus Aurelius. Proceed up and right to p-131317 then left to starbucks.	Slavery Memorial|Blue Room|Campus Market|Marcus Aurelius|P-131317|Starbucks	4|1|2|6|3|0	path_365.png
brown	Start at the Slavery Memorial and fly to Blue Room, then to the Campus Market. Continue to Marcus Aurelius, on to P-131317, and finish at Starbucks.	Slavery Memorial|Blue Room|Campus Market|Marcus Aurelius|P-131317|Starbucks	4|1|2|6|3|0	path_365.png
brown	From Slavery Memorial go to Blue Room. Then go to Campus Market. Then go to Marcus Aurelius. Then go to P-131317. Then go to Starbucks.	Slavery Memorial|Blue Room|Campus Market|Marcus Aurelius|P-131317|Starbucks	4|1|2|6|3|0	path_365.png
brown	Starting from the slavery memorial, go to the Campus market. Then head to  Marcus Aurelius.  From there, head to P-131317. Go to the War Memorial and then end up at Brown Bear.	Slavery Memorial|Campus Market|Marcus Aurelius|P-131317|War Memorial|Brown Bear	4|2|6|3|5|7	path_614.png
brown	go from slavery memorial to campus market to marcus aurelius to p-131317 to war memorial to brown bear	Slavery Memorial|Campus Market|Marcus Aurelius|P-131317|War Memorial|Brown Bear	4|2|6|3|5|7	path_614.png
brown	Starting at slavery Memorial heading north east until you reach campus market from there you will take a slight turn Northwestern and drive towards Marcus Aurelius. Once you reach Marcus Aurelius slight Northeast turn and straight until you get to P - 1 3 1 3 1 7and  from there head westbound, pass war memorial until you reach brown bear	Slavery Memorial|Campus Market|Marcus Aurelius|P-131317|War Memorial|Brown Bear	4|2|6|3|5|7	path_614.png
brown	Go straight from Brown Bear to P-131317 and then go straight to Starbucks. Lastly, go straight to War Memorial.	Brown Bear|P-131317|Starbucks|War Memorial	7|3|0|5	path_132.png
brown	Start at Brown Bear, go east and a little north to P-131317, continue east to Starbucks, then head back west past P-131317 to reach War Memorial.	Brown Bear|P-131317|Starbucks|War Memorial	7|3|0|5	path_132.png
brown	Go from Brown Bear to P-131317. Then go to Starbuck. From Starbucks go to War Memorial.	Brown Bear|P-131317|Starbucks|War Memorial	7|3|0|5	path_132.png
brown	Go from War Memorial to Starbucks. From Starbucks go to P-131317. Then go to Brown Bear. Then go to Marcus Aurelius. Then go to Campus Market. Then go to Blue Room.	War Memorial|Starbucks|P-131317|Brown Bear|Marcus Aurelius|Campus Market|Blue Room	5|0|3|7|6|2|1	path_366.png
brown	go from war memorial to starbucks to brown bear to marcus aurelius to campus market to blue room	War Memorial|Starbucks|P-131317|Brown Bear|Marcus Aurelius|Campus Market|Blue Room	5|0|3|7|6|2|1	path_366.png
brown	Go straight from War Memorial to Starbucks and then go straight to P-131317. Then go straight to Brown Bear. Then go straight to Marcus Aurelius. Then go straight to Campus Market. Lastly, go straight to Blue Room.	War Memorial|Starbucks|P-131317|Brown Bear|Marcus Aurelius|Campus Market|Blue Room	5|0|3|7|6|2|1	path_366.png
brown	Start from the Starbucks then head to P-131317 followed by War Memorial.	Starbucks|P-131317|War Memorial	0|3|5	path_615.png
brown	NA	Starbucks|P-131317|War Memorial	0|3|5	path_615.png
brown	Go straight from Starbucks to P-131317 and then go straight to War Memorial.	Starbucks|P-131317|War Memorial	0|3|5	path_615.png
brown	Please go straight from Slavery Memorial to Campus Market, and then to Marcus Aurelius. From there go to Brown Bear, and finally to War Memorial.	Slavery Memorial|Campus Market|Marcus Aurelius|Brown Bear|War Memorial	4|2|6|7|5	path_134.png
brown	Go straight from Slavery Memorial to Campus Market and then go straight to Marcus Aurelius. Then go straight to Brown Bear. Lastly, go straight to War Memorial.	Slavery Memorial|Campus Market|Marcus Aurelius|Brown Bear|War Memorial	4|2|6|7|5	path_134.png
brown	First, begin at Slavery Memorial then continue northeast towards Campus Market. Next, turn left and continue west towards Marcus Aurelius. Then, continue north towards Brown Bear. Lastly, turn right and continue east towards War Memorial.	Slavery Memorial|Campus Market|Marcus Aurelius|Brown Bear|War Memorial	4|2|6|7|5	path_134.png
brown	Go straight from Marcus Aurelius to Brown Bear.	Marcus Aurelius|Brown Bear	6|7	path_874.png
brown	Starting at Marcus Aurelius, move North to Brown Bear.	Marcus Aurelius|Brown Bear	6|7	path_874.png
brown	{}	Marcus Aurelius|Brown Bear	6|7	path_874.png
brown	Starting at Starbucks, fly to Brown Bear and then to Marcus Aurelius. Continue on to the Campus Market and finish at the Slavery Memorial.	Starbucks|Brown Bear|Marcus Aurelius|Campus Market|Slavery Memorial	0|7|6|2|4	path_135.png
brown	Start at Star Bucks and head towards Brown Bear. At Brown Bear turn left towards Marcus Aurelius. From Marcus Aurelius head toward campus Market. Once at Campus Market turn right and end up at Slavery Memorial.	Starbucks|Brown Bear|Marcus Aurelius|Campus Market|Slavery Memorial	0|7|6|2|4	path_135.png
brown	Go straight from Starbucks to Brown Bear and then go straight to Marcus Aurelius. Then go straight to Campus Market. Lastly, go straight to Slavery Memorial.	Starbucks|Brown Bear|Marcus Aurelius|Campus Market|Slavery Memorial	0|7|6|2|4	path_135.png
brown	go from slavery memorial to blue room to campus market to marcus aurelius to war memorial	Slavery Memorial|Blue Room|Campus Market|Marcus Aurelius|War Memorial	4|1|2|6|5	path_616.png
brown	Please go from Slavery Memorial to the Blue Room. From there, go to Campus Market, then to Marcus Aurelius, and then to the War Memorial.	Slavery Memorial|Blue Room|Campus Market|Marcus Aurelius|War Memorial	4|1|2|6|5	path_616.png
brown	Go straight from Slavery Memorial to Blue Room and then go straight to Campus Market. Then go straight to Marcus Aurelius. Lastly, go straight to War Memorial.	Slavery Memorial|Blue Room|Campus Market|Marcus Aurelius|War Memorial	4|1|2|6|5	path_616.png
brown	NA	P-131317|War Memorial|Brown Bear	3|5|7	path_138.png
brown	Go from P-131317, go to War Memorial and end up at Brown Bear.	P-131317|War Memorial|Brown Bear	3|5|7	path_138.png
brown	Beginning at Brown Bear go northeast to war memorial then straight east to the next point.	P-131317|War Memorial|Brown Bear	3|5|7	path_138.png
brown	Go from the Blue Room to the Campus Market and then to Marcus Aurelius. Proceed to P-131317 and finish at the War Memorial.	Blue Room|Campus Market|Marcus Aurelius|P-131317|War Memorial	1|2|6|3|5	path_618.png
brown	start at blue moos go up slighty and right slighty to campus market go from there right and up to marcus aurelius then from there go up and right to p-131317 then proceed to war memorial.	Blue Room|Campus Market|Marcus Aurelius|P-131317|War Memorial	1|2|6|3|5	path_618.png
brown	go from blue room to campus market to marcus aurelius to p-131317 to war memorial	Blue Room|Campus Market|Marcus Aurelius|P-131317|War Memorial	1|2|6|3|5	path_618.png
brown	Go from brown bear to war memorial to p-131317 to starbucks	Brown Bear|War Memorial|Starbucks|P-131317	7|5|0|3	path_619.png
brown	Go straight from Brown Bear to War Memorial and then go straight to P-131317. Lastly, go straight to Starbucks.	Brown Bear|War Memorial|Starbucks|P-131317	7|5|0|3	path_619.png
brown	Start at Brown Bear and fly to the War Memorial. Go on to P-131317 and finish up at Starbucks.	Brown Bear|War Memorial|Starbucks|P-131317	7|5|0|3	path_619.png
brown	i liked in the land mark	Slavery Memorial|Blue Room	4|1	path_875.png
brown	Travel North East by East from the Slavery Memorial.	Slavery Memorial|Blue Room	4|1	path_875.png
brown	slavery memorial to blue room	Slavery Memorial|Blue Room	4|1	path_875.png
brown	Head towards the Campus Market. When you reach it, go to the right, to the Slavery Memorial, passing the Blue Room on the left.	Marcus Aurelius|Campus Market|Slavery Memorial	6|2|4	path_139.png
brown	Starting at Marcus Aurelius, stop at the Campus Market before heading to the Slavery Memorial.	Marcus Aurelius|Campus Market|Slavery Memorial	6|2|4	path_139.png
brown	Start at Marcus Aurelius. From Marcus Aurelius go straight to Campus Market. Next from Campus Market go to Slavery Memorial	Marcus Aurelius|Campus Market|Slavery Memorial	6|2|4	path_139.png
brown	Go straight from War Memorial to Starbucks and then go straight to Starbucks. Lastly, go straight to Marcus Aurelius.	War Memorial|Starbucks|Brown Bear|Marcus Aurelius	5|0|7|6	path_620.png
brown	go from war memorial to starbucks to brown bear to marcus aurelius	War Memorial|Starbucks|Brown Bear|Marcus Aurelius	5|0|7|6	path_620.png
brown	Start at War Memorial and go right to P-131317. From there go to Starbucks then to Brown Bear. At Brown Bear go down to Marcus Aurelius.	War Memorial|Starbucks|Brown Bear|Marcus Aurelius	5|0|7|6	path_620.png
brown	Proceed from the Slavery Memorial to the Campus Market, then go to Marcus Aurelius.	Slavery Memorial|Campus Market|Marcus Aurelius	4|2|6	path_876.png
brown	Do not stop walking	Slavery Memorial|Campus Market|Marcus Aurelius	4|2|6	path_876.png
brown	{}	Slavery Memorial|Campus Market|Marcus Aurelius	4|2|6	path_876.png
brown	Please go to the first stop-campus market then to Marcus Aurelius. Third stop to War Memorial and then go to P-131317. Go to last stop to brown bear	Campus Market|Marcus Aurelius|War Memorial|P-131317|Brown Bear	2|6|5|3|7	path_369.png
brown	go from campus market to marcus aurelius to war memorial to p-131317 to brown bear	Campus Market|Marcus Aurelius|War Memorial|P-131317|Brown Bear	2|6|5|3|7	path_369.png
brown	Go right then left then right	Campus Market|Marcus Aurelius|War Memorial|P-131317|Brown Bear	2|6|5|3|7	path_369.png
brown	Proceed northwest from Campus Market to Marcus Aurelius, then continue north to Brown Bear. Lastly, proceed due east to P131317.	Campus Market|Marcus Aurelius|Brown Bear|P-131317|War Memorial	2|6|7|3|5	path_141.png
brown	Begin at Campus Market and head Northwest towards Marcus Aurelius.  Then head North towards Brown Bear.  Take a right and go directly to P-131317 on the far right.  Once there turn around and head towards War Memorial.	Campus Market|Marcus Aurelius|Brown Bear|P-131317|War Memorial	2|6|7|3|5	path_141.png
brown	Head to Marcus Aurelius from the Campus Market. At that point, you will go straight to the Brown Bear before continuing on to P-131317. From P-131317, your trip will end at the War Memorial.	Campus Market|Marcus Aurelius|Brown Bear|P-131317|War Memorial	2|6|7|3|5	path_141.png
brown	Start at the War Memorial go straight to Starbucks. From Starbucks go to Brown Bear. From Brown Bear go to Marcus Aurelius. From Marcus Aurelius go to Campus Market	War Memorial|Starbucks|Brown Bear|Marcus Aurelius|Campus Market	5|0|7|6|2	path_370.png
brown	Please leave from War Memorial and go to Starbucks. Then go to Brown Bear, then to Marcus Aurelius, and then to the Campus Market.	War Memorial|Starbucks|Brown Bear|Marcus Aurelius|Campus Market	5|0|7|6|2	path_370.png
brown	Begin at the War Memorial and proceed to Starbucks, before going to Brown Bear, Marcus Aurelius and then the Campus Market.	War Memorial|Starbucks|Brown Bear|Marcus Aurelius|Campus Market	5|0|7|6|2	path_370.png
brown	Start at Blue Room then proceed north to Campus Market. At Campus Market, turn left and continue west to Marcus Aurelius. Next, head north to Brown Bear then proceed east to Starbucks. Stop at Starbucks.	Blue Room|Campus Market|Marcus Aurelius|Brown Bear|Starbucks	1|2|6|7|0	path_621.png
brown	Start a the blue room and head to the campus market from there go to Marcus Aurelius then head over to brown bear and shoot from brown bear to Starbucks.	Blue Room|Campus Market|Marcus Aurelius|Brown Bear|Starbucks	1|2|6|7|0	path_621.png
brown	Do not stop going forward	Blue Room|Campus Market|Marcus Aurelius|Brown Bear|Starbucks	1|2|6|7|0	path_621.png
brown	From Marcus Aurelius, go north-northeast to Brown Bear, then east to War Memorial.	Marcus Aurelius|Brown Bear|War Memorial	6|7|5	path_371.png
brown	{}	Marcus Aurelius|Brown Bear|War Memorial	6|7|5	path_371.png
brown	Go from marcus aurelius to brown bear to war memorial	Marcus Aurelius|Brown Bear|War Memorial	6|7|5	path_371.png
brown	Start at Marcus Aurelius. Continue to Brown Bear. Make a right hand turn at Brown Bear. Pass War Memorial. Continue until arrival at P-131317.	Marcus Aurelius|Brown Bear|P-131317	6|7|3	path_878.png
brown	Go from Marcus Aurelius to Brown Bear and then to P-131317.	Marcus Aurelius|Brown Bear|P-131317	6|7|3	path_878.png
brown	Start at Marcus Aurelius and the go to Brown Bear and then to P-131317.	Marcus Aurelius|Brown Bear|P-131317	6|7|3	path_878.png
brown	go from slavery memorial to campus market to marcus aurelius to war memorial to brown bear to p-131317	Slavery Memorial|Campus Market|Marcus Aurelius|War Memorial|Brown Bear|P-131317	4|2|6|5|7|3	path_622.png
brown	Go straight from Slavery Memorial to Campus Market and then go straight to Marcus Aurelius. Then go straight to War Memorial. Then go straight to Brown Bear. Lastly, go straight to P-131317.	Slavery Memorial|Campus Market|Marcus Aurelius|War Memorial|Brown Bear|P-131317	4|2|6|5|7|3	path_622.png
brown	Starting from the Slavery Memorial, travel northeast to the Campus Market, then northwest to Marcus Aurelius. From there go northeast to the War Memorial, west to the Brown Bear, and finally east to P-131317.	Slavery Memorial|Campus Market|Marcus Aurelius|War Memorial|Brown Bear|P-131317	4|2|6|5|7|3	path_622.png
brown	Go straight from P-131317 to War Memorial and then go straight to Brown Bear. Then go straight to Marcus Aurelius. Lastly, go straight to Campus Market.	War Memorial|P-131317|Brown Bear|Marcus Aurelius|Campus Market	5|3|7|6|2	path_372.png
brown	From War Memorial, fly NNE to P-131317, then turn and fly SSW to Brown Bear. After Brown Bear, fly SSW toards Marcus Aurelius and then fly SSE towards Campus Market.	War Memorial|P-131317|Brown Bear|Marcus Aurelius|Campus Market	5|3|7|6|2	path_372.png
brown	Please go from War Memorial to P-131317. From there please go to Brown Bear, then to Marcus Aurelius, and finally to Campus Market.	War Memorial|P-131317|Brown Bear|Marcus Aurelius|Campus Market	5|3|7|6|2	path_372.png
brown	Go from Marcus Aurelius to Brown Bear and then to Starbucks. Continue to P-131317 and finish at the War Memorial.	Marcus Aurelius|Brown Bear|Starbucks|P-131317|War Memorial	6|7|0|3|5	path_879.png
brown	Go from Marcus Aurelius to Brown Bear. Then go to Starbucks. Then go to P-131317. Then go to War Memorial.	Marcus Aurelius|Brown Bear|Starbucks|P-131317|War Memorial	6|7|0|3|5	path_879.png
brown	go from marcus aurelius to brown bear to starbucks to p-131317 to war memorial	Marcus Aurelius|Brown Bear|Starbucks|P-131317|War Memorial	6|7|0|3|5	path_879.png
brown	Go from Marcus Aurelius to P-131317. Then go to Brown Bear. Then go to War Memorial.	Marcus Aurelius|P-131317|Brown Bear|War Memorial	6|3|7|5	path_623.png
brown	Starting at Marcus Aurelius head Northeast until you reach P - 1 3 1 3 1 7. From there head west bound until you reach brown bear once you reach brown bear slight turn to the Northeast and continue straight until you reach War Memorial	Marcus Aurelius|P-131317|Brown Bear|War Memorial	6|3|7|5	path_623.png
brown	From the war memorial go to the brown bear, then to P-131317, then to Marcus Aurelius.	Marcus Aurelius|P-131317|Brown Bear|War Memorial	6|3|7|5	path_623.png
brown	Go straight from P-131317 to Brown Bear and then go straight to Marcus Aurelius. Lastly, go straight to Campus Market.	P-131317|Brown Bear|Marcus Aurelius|Campus Market	3|7|6|2	path_142.png
brown	Starting at P - 1 3 1 3 1 7 go west pass war memorial until you reach the corner of brown bear at the corner of brown bear turn Southwest and had to Marcus Aurelius from their head south Southeast until you get to campus market.	P-131317|Brown Bear|Marcus Aurelius|Campus Market	3|7|6|2	path_142.png
brown	Go directly on a straight line from P121317 to Brown Bear. Turn left at Brown Bear and go directly on a straight line to Marcus Aurelius. Turn left at Marcus Aurelius and go directly on a straight line to Campus Market.	P-131317|Brown Bear|Marcus Aurelius|Campus Market	3|7|6|2	path_142.png
brown	From Brown Bear to War Memorial to Marcus Aurelius to Campus Market to Blue Room to Slavery Memorial.	Brown Bear|War Memorial|Marcus Aurelius|Campus Market|Blue Room|Slavery Memorial	7|5|6|2|1|4	path_373.png
brown	Starting at Brown Bear, go to War Memorial. Then go to Marcus Aurelius. Then, proceed to Campus Market, and then Blue Room. Finally, go to Slavery Memorial.	Brown Bear|War Memorial|Marcus Aurelius|Campus Market|Blue Room|Slavery Memorial	7|5|6|2|1|4	path_373.png
